1111626-1116113 cec: st: "ST"
1116113-1118494 cec: bits: "0"
1118494-1120875 cec: bits: "0"
1120875-1123256 cec: bits: "0"
1123256-1125637 cec: bits: "0"
1125637-1128018 cec: bits: "0"
1128018-1130399 cec: bits: "1"
1130399-1132780 cec: bits: "0"
1132780-1135161 cec: bits: "1"
1116113-1135161 cec: bytes: "0x05"
1135161-1137542 cec: eom-0: "EOM=N"
1137542-1139923 cec: ack: "ACK"
1139923-1142304 cec: bits: "1"
1142304-1144685 cec: bits: "0"
1144685-1147066 cec: bits: "1"
1147066-1149447 cec: bits: "0"
1149447-1151828 cec: bits: "0"
1151828-1154209 cec: bits: "0"
1154209-1156590 cec: bits: "0"
1156590-1158971 cec: bits: "0"
1139923-1158971 cec: bytes: "0xa0"
1158971-1161352 cec: eom-0: "EOM=N"
1161352-1163733 cec: ack: "ACK"
1163733-1166114 cec: bits: "0"
1166114-1168495 cec: bits: "0"
1168495-1170876 cec: bits: "0"
1170876-1173257 cec: bits: "0"
1173257-1175638 cec: bits: "1"
1175638-1178019 cec: bits: "0"
1178019-1180400 cec: bits: "0"
1180400-1182781 cec: bits: "0"
1163733-1182781 cec: bytes: "0x08"
1182781-1185162 cec: eom-0: "EOM=N"
1185162-1187543 cec: ack: "ACK"
1187543-1189924 cec: bits: "0"
1189924-1192304 cec: bits: "0"
1192304-1194685 cec: bits: "0"
1194685-1197066 cec: bits: "0"
1197066-1199447 cec: bits: "0"
1199447-1201828 cec: bits: "0"
1201828-1204209 cec: bits: "0"
1204209-1206590 cec: bits: "0"
1187543-1206590 cec: bytes: "0x00"
1206590-1208971 cec: eom-0: "EOM=N"
1208971-1211352 cec: ack: "ACK"
1211352-1213733 cec: bits: "0"
1213733-1216114 cec: bits: "1"
1216114-1218495 cec: bits: "0"
1218495-1220876 cec: bits: "0"
1220876-1223257 cec: bits: "0"
1223257-1225638 cec: bits: "1"
1225638-1228019 cec: bits: "1"
1228019-1230400 cec: bits: "0"
1211352-1230400 cec: bytes: "0x46"
1230400-1232781 cec: eom-0: "EOM=N"
1232781-1235162 cec: ack: "ACK"
1235162-1237543 cec: bits: "0"
1237543-1239924 cec: bits: "0"
1239924-1242305 cec: bits: "0"
1242305-1244686 cec: bits: "0"
1244686-1247067 cec: bits: "0"
1247067-1249448 cec: bits: "0"
1249448-1251829 cec: bits: "0"
1251829-1254210 cec: bits: "0"
1235162-1254210 cec: bytes: "0x00"
1254210-1256591 cec: eom-0: "EOM=N"
1256591-1258972 cec: ack: "ACK"
1258972-1261353 cec: bits: "0"
1261353-1263734 cec: bits: "0"
1263734-1266115 cec: bits: "0"
1266115-1268496 cec: bits: "0"
1268496-1270876 cec: bits: "1"
1270876-1273257 cec: bits: "1"
1273257-1275638 cec: bits: "0"
1275638-1278019 cec: bits: "0"
1258972-1278019 cec: bytes: "0x0c"
1278019-1280400 cec: eom-0: "EOM=N"
1280400-1282781 cec: ack: "ACK"
1282781-1285162 cec: bits: "0"
1285162-1287543 cec: bits: "0"
1287543-1289924 cec: bits: "0"
1289924-1292305 cec: bits: "0"
1292305-1294686 cec: bits: "0"
1294686-1297067 cec: bits: "0"
1297067-1299448 cec: bits: "0"
1299448-1301829 cec: bits: "0"
1282781-1301829 cec: bytes: "0x00"
1301829-1304210 cec: eom-0: "EOM=N"
1304210-1306591 cec: ack: "ACK"
1306591-1308972 cec: bits: "1"
1308972-1311353 cec: bits: "1"
1311353-1313734 cec: bits: "1"
1313734-1316115 cec: bits: "1"
1316115-1318496 cec: bits: "1"
1318496-1320877 cec: bits: "1"
1320877-1323258 cec: bits: "1"
1323258-1325639 cec: bits: "1"
1306591-1325639 cec: bytes: "0xff"
1325639-1328020 cec: eom-1: "EOM=Y"
1328020-1332120 cec: ack: "ACK"
1116113-1328020 cec: frames: "05:a0:08:00:46:00:0c:00:ff"
1116113-1328020 cec: sections: "HDR: TV, AudioSystem | OPC: VENDOR_COMMAND_WITH_ID | OPS: 0x08, 0x00, 0x46, 0x00, 0x0c, 0x00, 0xff | R: ACK"
1344757-1349263 cec: st: "ST"
1349263-1351669 cec: bits: "0"
1351669-1354075 cec: bits: "1"
1354075-1356481 cec: bits: "0"
1356481-1358887 cec: bits: "1"
1358887-1361293 cec: bits: "0"
1361293-1363699 cec: bits: "0"
1363699-1366105 cec: bits: "0"
1366105-1368511 cec: bits: "0"
1349263-1368511 cec: bytes: "0x50"
1368511-1370916 cec: eom-0: "EOM=N"
1370916-1373322 cec: ack: "ACK"
1373322-1375728 cec: bits: "0"
1375728-1378134 cec: bits: "0"
1378134-1380540 cec: bits: "0"
1380540-1382946 cec: bits: "0"
1382946-1385352 cec: bits: "0"
1385352-1387758 cec: bits: "0"
1387758-1390164 cec: bits: "0"
1390164-1392570 cec: bits: "0"
1373322-1392570 cec: bytes: "0x00"
1392570-1394976 cec: eom-0: "EOM=N"
1394976-1397382 cec: ack: "ACK"
1397382-1399788 cec: bits: "1"
1399788-1402194 cec: bits: "0"
1402194-1404599 cec: bits: "1"
1404599-1407005 cec: bits: "0"
1407005-1409412 cec: bits: "0"
1409412-1411818 cec: bits: "0"
1411818-1414224 cec: bits: "0"
1414224-1416630 cec: bits: "0"
1397382-1416630 cec: bytes: "0xa0"
1416630-1419036 cec: eom-0: "EOM=N"
1419036-1421442 cec: ack: "ACK"
1421442-1423848 cec: bits: "0"
1423848-1426254 cec: bits: "0"
1426254-1428660 cec: bits: "0"
1428660-1431065 cec: bits: "0"
1431065-1433471 cec: bits: "0"
1433471-1435877 cec: bits: "0"
1435877-1438283 cec: bits: "0"
1438283-1440689 cec: bits: "0"
1421442-1440689 cec: bytes: "0x00"
1440689-1443095 cec: eom-1: "EOM=Y"
1443095-1447195 cec: ack: "ACK"
1349263-1443095 cec: frames: "50:00:a0:00"
1349263-1443095 cec: sections: "HDR: AudioSystem, TV | OPC: FEATURE_ABORT | OPS: 0xa0, 0x00 | R: ACK"
1457508-1461995 cec: st: "ST"
1461995-1464376 cec: bits: "0"
1464376-1466757 cec: bits: "0"
1466757-1469138 cec: bits: "0"
1469138-1471519 cec: bits: "0"
1471519-1473900 cec: bits: "0"
1473900-1476281 cec: bits: "0"
1476281-1478662 cec: bits: "0"
1478662-1481043 cec: bits: "0"
1461995-1481043 cec: bytes: "0x00"
1481043-1483424 cec: eom-1: "EOM=Y"
1483424-1487524 cec: nack: "NACK"
1461995-1483424 cec: frames: "00"
1461995-1483424 cec: sections: "HDR: TV, TV | OPC: PING | R: NACK"
1493070-1497557 cec: st: "ST"
1497557-1499938 cec: bits: "0"
1499938-1502319 cec: bits: "0"
1502319-1504700 cec: bits: "0"
1504700-1507081 cec: bits: "0"
1507081-1509462 cec: bits: "0"
1509462-1511843 cec: bits: "0"
1511843-1514224 cec: bits: "0"
1514224-1516605 cec: bits: "0"
1497557-1516605 cec: bytes: "0x00"
1516605-1518986 cec: eom-1: "EOM=Y"
1518986-1523086 cec: nack: "NACK"
1497557-1518986 cec: frames: "00"
1497557-1518986 cec: sections: "HDR: TV, TV | OPC: PING | R: NACK"
1538247-1542734 cec: st: "ST"
1542734-1545115 cec: bits: "0"
1545115-1547496 cec: bits: "0"
1547496-1549877 cec: bits: "0"
1549877-1552258 cec: bits: "0"
1552258-1554639 cec: bits: "0"
1554639-1557020 cec: bits: "0"
1557020-1559401 cec: bits: "0"
1559401-1561782 cec: bits: "0"
1542734-1561782 cec: bytes: "0x00"
1561782-1564163 cec: eom-1: "EOM=Y"
1564163-1568263 cec: nack: "NACK"
1542734-1564163 cec: frames: "00"
1542734-1564163 cec: sections: "HDR: TV, TV | OPC: PING | R: NACK"
1573809-1578296 cec: st: "ST"
1578296-1580677 cec: bits: "0"
1580677-1583058 cec: bits: "0"
1583058-1585439 cec: bits: "0"
1585439-1587820 cec: bits: "0"
1587820-1590201 cec: bits: "0"
1590201-1592582 cec: bits: "0"
1592582-1594963 cec: bits: "0"
1594963-1597344 cec: bits: "0"
1578296-1597344 cec: bytes: "0x00"
1597344-1599725 cec: eom-1: "EOM=Y"
1599725-1603825 cec: nack: "NACK"
1578296-1599725 cec: frames: "00"
1578296-1599725 cec: sections: "HDR: TV, TV | OPC: PING | R: NACK"
1618986-1623474 cec: st: "ST"
1623474-1625855 cec: bits: "0"
1625855-1628236 cec: bits: "0"
1628236-1630617 cec: bits: "0"
1630617-1632998 cec: bits: "0"
1632998-1635379 cec: bits: "0"
1635379-1637760 cec: bits: "0"
1637760-1640140 cec: bits: "0"
1640140-1642521 cec: bits: "0"
1623474-1642521 cec: bytes: "0x00"
1642521-1644902 cec: eom-1: "EOM=Y"
1644902-1649002 cec: nack: "NACK"
1623474-1644902 cec: frames: "00"
1623474-1644902 cec: sections: "HDR: TV, TV | OPC: PING | R: NACK"
1654548-1659036 cec: st: "ST"
1659036-1661417 cec: bits: "0"
1661417-1663798 cec: bits: "0"
1663798-1666179 cec: bits: "0"
1666179-1668559 cec: bits: "0"
1668559-1670940 cec: bits: "0"
1670940-1673321 cec: bits: "0"
1673321-1675702 cec: bits: "0"
1675702-1678083 cec: bits: "0"
1659036-1678083 cec: bytes: "0x00"
1678083-1680464 cec: eom-1: "EOM=Y"
1680464-1684564 cec: nack: "NACK"
1659036-1680464 cec: frames: "00"
1659036-1680464 cec: sections: "HDR: TV, TV | OPC: PING | R: NACK"
1699726-1704213 cec: st: "ST"
1704213-1706594 cec: bits: "0"
1706594-1708975 cec: bits: "0"
1708975-1711356 cec: bits: "0"
1711356-1713737 cec: bits: "0"
1713737-1716118 cec: bits: "1"
1716118-1718499 cec: bits: "1"
1718499-1720880 cec: bits: "1"
1720880-1723261 cec: bits: "1"
1704213-1723261 cec: bytes: "0x0f"
1723261-1725642 cec: eom-0: "EOM=N"
1725642-1728023 cec: ack: "ACK"
1728023-1730404 cec: bits: "1"
1730404-1732785 cec: bits: "0"
1732785-1735166 cec: bits: "0"
1735166-1737547 cec: bits: "0"
1737547-1739928 cec: bits: "0"
1739928-1742309 cec: bits: "1"
1742309-1744689 cec: bits: "0"
1744689-1747070 cec: bits: "0"
1728023-1747070 cec: bytes: "0x84"
1747070-1749451 cec: eom-0: "EOM=N"
1749451-1751832 cec: ack: "ACK"
1751832-1754213 cec: bits: "0"
1754213-1756594 cec: bits: "0"
1756594-1758975 cec: bits: "0"
1758975-1761356 cec: bits: "0"
1761356-1763737 cec: bits: "0"
1763737-1766118 cec: bits: "0"
1766118-1768499 cec: bits: "0"
1768499-1770880 cec: bits: "0"
1751832-1770880 cec: bytes: "0x00"
1770880-1773261 cec: eom-0: "EOM=N"
1773261-1775642 cec: ack: "ACK"
1775642-1778023 cec: bits: "0"
1778023-1780404 cec: bits: "0"
1780404-1782785 cec: bits: "0"
1782785-1785166 cec: bits: "0"
1785166-1787547 cec: bits: "0"
1787547-1789928 cec: bits: "0"
1789928-1792309 cec: bits: "0"
1792309-1794690 cec: bits: "0"
1775642-1794690 cec: bytes: "0x00"
1794690-1797071 cec: eom-0: "EOM=N"
1797071-1799452 cec: ack: "ACK"
1799452-1801833 cec: bits: "0"
1801833-1804214 cec: bits: "0"
1804214-1806595 cec: bits: "0"
1806595-1808976 cec: bits: "0"
1808976-1811357 cec: bits: "0"
1811357-1813738 cec: bits: "0"
1813738-1816119 cec: bits: "0"
1816119-1818500 cec: bits: "0"
1799452-1818500 cec: bytes: "0x00"
1818500-1820881 cec: eom-1: "EOM=Y"
1820881-1824981 cec: ack: "ACK"
1704213-1820881 cec: frames: "0f:84:00:00:00"
1704213-1820881 cec: sections: "HDR: TV, Broadcast | OPC: REPORT_PHYSICAL_ADDRESS | OPS: 0x00, 0x00, 0x00 | R: ACK"
1840142-1844629 cec: st: "ST"
1844629-1847010 cec: bits: "0"
1847010-1849391 cec: bits: "0"
1849391-1851772 cec: bits: "0"
1851772-1854153 cec: bits: "0"
1854153-1856534 cec: bits: "1"
1856534-1858915 cec: bits: "1"
1858915-1861296 cec: bits: "1"
1861296-1863677 cec: bits: "1"
1844629-1863677 cec: bytes: "0x0f"
1863677-1866058 cec: eom-0: "EOM=N"
1866058-1868439 cec: ack: "ACK"
1868439-1870820 cec: bits: "1"
1870820-1873201 cec: bits: "0"
1873201-1875582 cec: bits: "0"
1875582-1877963 cec: bits: "0"
1877963-1880344 cec: bits: "0"
1880344-1882725 cec: bits: "1"
1882725-1885106 cec: bits: "1"
1885106-1887487 cec: bits: "1"
1868439-1887487 cec: bytes: "0x87"
1887487-1889868 cec: eom-0: "EOM=N"
1889868-1892249 cec: ack: "ACK"
1892249-1894630 cec: bits: "0"
1894630-1897010 cec: bits: "0"
1897010-1899391 cec: bits: "0"
1899391-1901772 cec: bits: "0"
1901772-1904153 cec: bits: "1"
1904153-1906534 cec: bits: "0"
1906534-1908915 cec: bits: "0"
1908915-1911296 cec: bits: "0"
1892249-1911296 cec: bytes: "0x08"
1911296-1913677 cec: eom-0: "EOM=N"
1913677-1916058 cec: ack: "ACK"
1916058-1918439 cec: bits: "0"
1918439-1920820 cec: bits: "0"
1920820-1923201 cec: bits: "0"
1923201-1925582 cec: bits: "0"
1925582-1927963 cec: bits: "0"
1927963-1930344 cec: bits: "0"
1930344-1932725 cec: bits: "0"
1932725-1935106 cec: bits: "0"
1916058-1935106 cec: bytes: "0x00"
1935106-1937487 cec: eom-0: "EOM=N"
1937487-1939868 cec: ack: "ACK"
1939868-1942249 cec: bits: "0"
1942249-1944630 cec: bits: "1"
1944630-1947011 cec: bits: "0"
1947011-1949392 cec: bits: "0"
1949392-1951773 cec: bits: "0"
1951773-1954154 cec: bits: "1"
1954154-1956535 cec: bits: "1"
1956535-1958916 cec: bits: "0"
1939868-1958916 cec: bytes: "0x46"
1958916-1961297 cec: eom-1: "EOM=Y"
1961297-1965397 cec: ack: "ACK"
1844629-1961297 cec: frames: "0f:87:08:00:46"
1844629-1961297 cec: sections: "HDR: TV, Broadcast | OPC: DEVICE_VENDOR_ID | OPS: 0x08, 0x00, 0x46 | R: ACK"
1980558-1985045 cec: st: "ST"
1985045-1987426 cec: bits: "0"
1987426-1989807 cec: bits: "0"
1989807-1992188 cec: bits: "0"
1992188-1994569 cec: bits: "0"
1994569-1996950 cec: bits: "1"
1996950-1999331 cec: bits: "1"
1999331-2001712 cec: bits: "1"
2001712-2004093 cec: bits: "1"
1985045-2004093 cec: bytes: "0x0f"
2004093-2006474 cec: eom-0: "EOM=N"
2006474-2008855 cec: ack: "ACK"
2008855-2011236 cec: bits: "1"
2011236-2013617 cec: bits: "0"
2013617-2015998 cec: bits: "1"
2015998-2018379 cec: bits: "0"
2018379-2020760 cec: bits: "0"
2020760-2023141 cec: bits: "0"
2023141-2025522 cec: bits: "0"
2025522-2027903 cec: bits: "0"
2008855-2027903 cec: bytes: "0xa0"
2027903-2030284 cec: eom-0: "EOM=N"
2030284-2032665 cec: ack: "ACK"
2032665-2035046 cec: bits: "0"
2035046-2037427 cec: bits: "0"
2037427-2039808 cec: bits: "0"
2039808-2042189 cec: bits: "0"
2042189-2044570 cec: bits: "1"
2044570-2046951 cec: bits: "0"
2046951-2049332 cec: bits: "0"
2049332-2051712 cec: bits: "0"
2032665-2051712 cec: bytes: "0x08"
2051712-2054093 cec: eom-0: "EOM=N"
2054093-2056474 cec: ack: "ACK"
2056474-2058855 cec: bits: "0"
2058855-2061236 cec: bits: "0"
2061236-2063617 cec: bits: "0"
2063617-2065998 cec: bits: "0"
2065998-2068379 cec: bits: "0"
2068379-2070760 cec: bits: "0"
2070760-2073141 cec: bits: "0"
2073141-2075522 cec: bits: "0"
2056474-2075522 cec: bytes: "0x00"
2075522-2077903 cec: eom-0: "EOM=N"
2077903-2080284 cec: ack: "ACK"
2080284-2082665 cec: bits: "0"
2082665-2085046 cec: bits: "1"
2085046-2087427 cec: bits: "0"
2087427-2089808 cec: bits: "0"
2089808-2092189 cec: bits: "0"
2092189-2094570 cec: bits: "1"
2094570-2096951 cec: bits: "1"
2096951-2099332 cec: bits: "0"
2080284-2099332 cec: bytes: "0x46"
2099332-2101713 cec: eom-0: "EOM=N"
2101713-2104094 cec: ack: "ACK"
2104094-2106475 cec: bits: "0"
2106475-2108856 cec: bits: "0"
2108856-2111237 cec: bits: "0"
2111237-2113618 cec: bits: "0"
2113618-2115999 cec: bits: "0"
2115999-2118380 cec: bits: "0"
2118380-2120761 cec: bits: "0"
2120761-2123142 cec: bits: "0"
2104094-2123142 cec: bytes: "0x00"
2123142-2125523 cec: eom-0: "EOM=N"
2125523-2127904 cec: ack: "ACK"
2127904-2130284 cec: bits: "0"
2130284-2132665 cec: bits: "0"
2132665-2135046 cec: bits: "0"
2135046-2137427 cec: bits: "0"
2137427-2139808 cec: bits: "0"
2139808-2142189 cec: bits: "1"
2142189-2144570 cec: bits: "0"
2144570-2146951 cec: bits: "0"
2127904-2146951 cec: bytes: "0x04"
2146951-2149332 cec: eom-0: "EOM=N"
2149332-2151713 cec: ack: "ACK"
2151713-2154094 cec: bits: "0"
2154094-2156475 cec: bits: "0"
2156475-2158856 cec: bits: "0"
2158856-2161237 cec: bits: "0"
2161237-2163618 cec: bits: "0"
2163618-2165999 cec: bits: "0"
2165999-2168380 cec: bits: "0"
2168380-2170761 cec: bits: "0"
2151713-2170761 cec: bytes: "0x00"
2170761-2173142 cec: eom-0: "EOM=N"
2173142-2175523 cec: ack: "ACK"
2175523-2177904 cec: bits: "0"
2177904-2180285 cec: bits: "0"
2180285-2182666 cec: bits: "0"
2182666-2185047 cec: bits: "0"
2185047-2187428 cec: bits: "0"
2187428-2189809 cec: bits: "0"
2189809-2192190 cec: bits: "0"
2192190-2194571 cec: bits: "1"
2175523-2194571 cec: bytes: "0x01"
2194571-2196952 cec: eom-1: "EOM=Y"
2196952-2201052 cec: ack: "ACK"
1985045-2196952 cec: frames: "0f:a0:08:00:46:00:04:00:01"
1985045-2196952 cec: sections: "HDR: TV, Broadcast | OPC: VENDOR_COMMAND_WITH_ID | OPS: 0x08, 0x00, 0x46, 0x00, 0x04, 0x00, 0x01 | R: ACK"
2212972-2217478 cec: st: "ST"
2217478-2219884 cec: bits: "0"
2219884-2222290 cec: bits: "1"
2222290-2224696 cec: bits: "0"
2224696-2227102 cec: bits: "1"
2227102-2229508 cec: bits: "0"
2229508-2231914 cec: bits: "0"
2231914-2234320 cec: bits: "0"
2234320-2236726 cec: bits: "0"
2217478-2236726 cec: bytes: "0x50"
2236726-2239132 cec: eom-0: "EOM=N"
2239132-2241538 cec: ack: "ACK"
2241538-2243944 cec: bits: "0"
2243944-2246350 cec: bits: "0"
2246350-2248756 cec: bits: "0"
2248756-2251162 cec: bits: "0"
2251162-2253567 cec: bits: "0"
2253567-2255973 cec: bits: "0"
2255973-2258379 cec: bits: "0"
2258379-2260785 cec: bits: "0"
2241538-2260785 cec: bytes: "0x00"
2260785-2263191 cec: eom-0: "EOM=N"
2263191-2265597 cec: ack: "ACK"
2265597-2268003 cec: bits: "1"
2268003-2270409 cec: bits: "0"
2270409-2272815 cec: bits: "1"
2272815-2275221 cec: bits: "0"
2275221-2277627 cec: bits: "0"
2277627-2280033 cec: bits: "0"
2280033-2282439 cec: bits: "0"
2282439-2284845 cec: bits: "0"
2265597-2284845 cec: bytes: "0xa0"
2284845-2287250 cec: eom-0: "EOM=N"
2287250-2289656 cec: ack: "ACK"
2289656-2292062 cec: bits: "0"
2292062-2294468 cec: bits: "0"
2294468-2296874 cec: bits: "0"
2296874-2299280 cec: bits: "0"
2299280-2301686 cec: bits: "0"
2301686-2304092 cec: bits: "0"
2304092-2306498 cec: bits: "0"
2306498-2308904 cec: bits: "0"
2289656-2308904 cec: bytes: "0x00"
2308904-2311310 cec: eom-1: "EOM=Y"
2311310-2315410 cec: ack: "ACK"
2217478-2311310 cec: frames: "50:00:a0:00"
2217478-2311310 cec: sections: "HDR: AudioSystem, TV | OPC: FEATURE_ABORT | OPS: 0xa0, 0x00 | R: ACK"
2325738-2330225 cec: st: "ST"
2330225-2332606 cec: bits: "0"
2332606-2334987 cec: bits: "0"
2334987-2337368 cec: bits: "0"
2337368-2339749 cec: bits: "0"
2339749-2342130 cec: bits: "1"
2342130-2344511 cec: bits: "1"
2344511-2346892 cec: bits: "1"
2346892-2349273 cec: bits: "1"
2330225-2349273 cec: bytes: "0x0f"
2349273-2351654 cec: eom-0: "EOM=N"
2351654-2354035 cec: ack: "ACK"
2354035-2356416 cec: bits: "1"
2356416-2358797 cec: bits: "0"
2358797-2361178 cec: bits: "0"
2361178-2363559 cec: bits: "0"
2363559-2365940 cec: bits: "0"
2365940-2368320 cec: bits: "0"
2368320-2370701 cec: bits: "0"
2370701-2373082 cec: bits: "0"
2354035-2373082 cec: bytes: "0x80"
2373082-2375463 cec: eom-0: "EOM=N"
2375463-2377844 cec: ack: "ACK"
2377844-2380225 cec: bits: "0"
2380225-2382606 cec: bits: "0"
2382606-2384987 cec: bits: "0"
2384987-2387368 cec: bits: "0"
2387368-2389749 cec: bits: "0"
2389749-2392130 cec: bits: "0"
2392130-2394511 cec: bits: "0"
2394511-2396892 cec: bits: "0"
2377844-2396892 cec: bytes: "0x00"
2396892-2399273 cec: eom-0: "EOM=N"
2399273-2401654 cec: ack: "ACK"
2401654-2404035 cec: bits: "0"
2404035-2406416 cec: bits: "0"
2406416-2408797 cec: bits: "0"
2408797-2411178 cec: bits: "0"
2411178-2413559 cec: bits: "0"
2413559-2415940 cec: bits: "0"
2415940-2418321 cec: bits: "0"
2418321-2420702 cec: bits: "0"
2401654-2420702 cec: bytes: "0x00"
2420702-2423083 cec: eom-0: "EOM=N"
2423083-2425464 cec: ack: "ACK"
2425464-2427845 cec: bits: "0"
2427845-2430226 cec: bits: "0"
2430226-2432607 cec: bits: "1"
2432607-2434988 cec: bits: "1"
2434988-2437369 cec: bits: "0"
2437369-2439750 cec: bits: "0"
2439750-2442131 cec: bits: "0"
2442131-2444512 cec: bits: "0"
2425464-2444512 cec: bytes: "0x30"
2444512-2446892 cec: eom-0: "EOM=N"
2446892-2449273 cec: ack: "ACK"
2449273-2451654 cec: bits: "0"
2451654-2454035 cec: bits: "0"
2454035-2456416 cec: bits: "0"
2456416-2458797 cec: bits: "0"
2458797-2461178 cec: bits: "0"
2461178-2463559 cec: bits: "0"
2463559-2465940 cec: bits: "0"
2465940-2468321 cec: bits: "0"
2449273-2468321 cec: bytes: "0x00"
2468321-2470702 cec: eom-1: "EOM=Y"
2470702-2474802 cec: ack: "ACK"
2330225-2470702 cec: frames: "0f:80:00:00:30:00"
2330225-2470702 cec: sections: "HDR: TV, Broadcast | OPC: ROUTING_CHANGE | OPS: 0x00, 0x00, 0x30, 0x00 | R: ACK"
2489964-2494451 cec: st: "ST"
2494451-2496832 cec: bits: "0"
2496832-2499213 cec: bits: "0"
2499213-2501594 cec: bits: "0"
2501594-2503975 cec: bits: "0"
2503975-2506356 cec: bits: "1"
2506356-2508737 cec: bits: "1"
2508737-2511118 cec: bits: "1"
2511118-2513499 cec: bits: "0"
2494451-2513499 cec: bytes: "0x0e"
2513499-2515880 cec: eom-1: "EOM=Y"
2515880-2519980 cec: nack: "NACK"
2494451-2515880 cec: frames: "0e"
2494451-2515880 cec: sections: "HDR: TV, FreeUse | OPC: PING | R: NACK"
2525526-2530013 cec: st: "ST"
2530013-2532394 cec: bits: "0"
2532394-2534775 cec: bits: "0"
2534775-2537156 cec: bits: "0"
2537156-2539537 cec: bits: "0"
2539537-2541918 cec: bits: "1"
2541918-2544299 cec: bits: "1"
2544299-2546680 cec: bits: "1"
2546680-2549061 cec: bits: "0"
2530013-2549061 cec: bytes: "0x0e"
2549061-2551442 cec: eom-1: "EOM=Y"
2551442-2555542 cec: nack: "NACK"
2530013-2551442 cec: frames: "0e"
2530013-2551442 cec: sections: "HDR: TV, FreeUse | OPC: PING | R: NACK"
2582333-2586820 cec: st: "ST"
2586820-2589201 cec: bits: "0"
2589201-2591582 cec: bits: "0"
2591582-2593963 cec: bits: "0"
2593963-2596344 cec: bits: "0"
2596344-2598725 cec: bits: "1"
2598725-2601106 cec: bits: "1"
2601106-2603487 cec: bits: "1"
2603487-2605868 cec: bits: "1"
2586820-2605868 cec: bytes: "0x0f"
2605868-2608249 cec: eom-0: "EOM=N"
2608249-2610630 cec: ack: "ACK"
2610630-2613011 cec: bits: "1"
2613011-2615392 cec: bits: "0"
2615392-2617773 cec: bits: "1"
2617773-2620154 cec: bits: "0"
2620154-2622535 cec: bits: "0"
2622535-2624916 cec: bits: "0"
2624916-2627297 cec: bits: "0"
2627297-2629678 cec: bits: "0"
2610630-2629678 cec: bytes: "0xa0"
2629678-2632059 cec: eom-0: "EOM=N"
2632059-2634440 cec: ack: "ACK"
2634440-2636821 cec: bits: "0"
2636821-2639202 cec: bits: "0"
2639202-2641583 cec: bits: "0"
2641583-2643964 cec: bits: "0"
2643964-2646345 cec: bits: "1"
2646345-2648726 cec: bits: "0"
2648726-2651107 cec: bits: "0"
2651107-2653487 cec: bits: "0"
2634440-2653487 cec: bytes: "0x08"
2653487-2655868 cec: eom-0: "EOM=N"
2655868-2658249 cec: ack: "ACK"
2658249-2660630 cec: bits: "0"
2660630-2663011 cec: bits: "0"
2663011-2665392 cec: bits: "0"
2665392-2667773 cec: bits: "0"
2667773-2670154 cec: bits: "0"
2670154-2672535 cec: bits: "0"
2672535-2674916 cec: bits: "0"
2674916-2677297 cec: bits: "0"
2658249-2677297 cec: bytes: "0x00"
2677297-2679678 cec: eom-0: "EOM=N"
2679678-2682059 cec: ack: "ACK"
2682059-2684440 cec: bits: "0"
2684440-2686821 cec: bits: "1"
2686821-2689202 cec: bits: "0"
2689202-2691583 cec: bits: "0"
2691583-2693964 cec: bits: "0"
2693964-2696345 cec: bits: "1"
2696345-2698726 cec: bits: "1"
2698726-2701107 cec: bits: "0"
2682059-2701107 cec: bytes: "0x46"
2701107-2703488 cec: eom-0: "EOM=N"
2703488-2705869 cec: ack: "ACK"
2705869-2708250 cec: bits: "0"
2708250-2710631 cec: bits: "0"
2710631-2713012 cec: bits: "0"
2713012-2715393 cec: bits: "0"
2715393-2717774 cec: bits: "0"
2717774-2720155 cec: bits: "0"
2720155-2722536 cec: bits: "0"
2722536-2724917 cec: bits: "0"
2705869-2724917 cec: bytes: "0x00"
2724917-2727298 cec: eom-0: "EOM=N"
2727298-2729679 cec: ack: "ACK"
2729679-2732059 cec: bits: "0"
2732059-2734440 cec: bits: "0"
2734440-2736821 cec: bits: "0"
2736821-2739202 cec: bits: "1"
2739202-2741583 cec: bits: "0"
2741583-2743964 cec: bits: "1"
2743964-2746345 cec: bits: "1"
2746345-2748726 cec: bits: "1"
2729679-2748726 cec: bytes: "0x17"
2748726-2751107 cec: eom-0: "EOM=N"
2751107-2753488 cec: ack: "ACK"
2753488-2755869 cec: bits: "0"
2755869-2758250 cec: bits: "0"
2758250-2760631 cec: bits: "0"
2760631-2763012 cec: bits: "0"
2763012-2765393 cec: bits: "0"
2765393-2767774 cec: bits: "0"
2767774-2770155 cec: bits: "0"
2770155-2772536 cec: bits: "0"
2753488-2772536 cec: bytes: "0x00"
2772536-2774917 cec: eom-0: "EOM=N"
2774917-2777298 cec: ack: "ACK"
2777298-2779679 cec: bits: "1"
2779679-2782060 cec: bits: "0"
2782060-2784441 cec: bits: "0"
2784441-2786822 cec: bits: "0"
2786822-2789203 cec: bits: "0"
2789203-2791584 cec: bits: "0"
2791584-2793965 cec: bits: "0"
2793965-2796346 cec: bits: "0"
2777298-2796346 cec: bytes: "0x80"
2796346-2798727 cec: eom-1: "EOM=Y"
2798727-2802827 cec: ack: "ACK"
2586820-2798727 cec: frames: "0f:a0:08:00:46:00:17:00:80"
2586820-2798727 cec: sections: "HDR: TV, Broadcast | OPC: VENDOR_COMMAND_WITH_ID | OPS: 0x08, 0x00, 0x46, 0x00, 0x17, 0x00, 0x80 | R: ACK"
2815121-2819627 cec: st: "ST"
2819627-2822033 cec: bits: "0"
2822033-2824439 cec: bits: "1"
2824439-2826845 cec: bits: "0"
2826845-2829251 cec: bits: "1"
2829251-2831657 cec: bits: "0"
2831657-2834063 cec: bits: "0"
2834063-2836469 cec: bits: "0"
2836469-2838874 cec: bits: "0"
2819627-2838874 cec: bytes: "0x50"
2838874-2841280 cec: eom-0: "EOM=N"
2841280-2843686 cec: ack: "ACK"
2843686-2846092 cec: bits: "0"
2846092-2848498 cec: bits: "0"
2848498-2850904 cec: bits: "0"
2850904-2853310 cec: bits: "0"
2853310-2855716 cec: bits: "0"
2855716-2858122 cec: bits: "0"
2858122-2860528 cec: bits: "0"
2860528-2862934 cec: bits: "0"
2843686-2862934 cec: bytes: "0x00"
2862934-2865340 cec: eom-0: "EOM=N"
2865340-2867746 cec: ack: "ACK"
2867746-2870152 cec: bits: "1"
2870152-2872557 cec: bits: "0"
2872557-2874963 cec: bits: "1"
2874963-2877369 cec: bits: "0"
2877369-2879775 cec: bits: "0"
2879775-2882181 cec: bits: "0"
2882181-2884587 cec: bits: "0"
2884587-2886993 cec: bits: "0"
2867746-2886993 cec: bytes: "0xa0"
2886993-2889399 cec: eom-0: "EOM=N"
2889399-2891805 cec: ack: "ACK"
2891805-2894211 cec: bits: "0"
2894211-2896617 cec: bits: "0"
2896617-2899023 cec: bits: "0"
2899023-2901429 cec: bits: "0"
2901429-2903835 cec: bits: "0"
2903835-2906240 cec: bits: "0"
2906240-2908646 cec: bits: "0"
2908646-2911052 cec: bits: "0"
2891805-2911052 cec: bytes: "0x00"
2911052-2913458 cec: eom-1: "EOM=Y"
2913458-2917558 cec: ack: "ACK"
2819627-2913458 cec: frames: "50:00:a0:00"
2819627-2913458 cec: sections: "HDR: AudioSystem, TV | OPC: FEATURE_ABORT | OPS: 0xa0, 0x00 | R: ACK"
2927879-2932366 cec: st: "ST"
2932366-2934747 cec: bits: "0"
2934747-2937128 cec: bits: "0"
2937128-2939509 cec: bits: "0"
2939509-2941890 cec: bits: "0"
2941890-2944271 cec: bits: "1"
2944271-2946652 cec: bits: "1"
2946652-2949033 cec: bits: "0"
2949033-2951414 cec: bits: "1"
2932366-2951414 cec: bytes: "0x0d"
2951414-2953795 cec: eom-1: "EOM=Y"
2953795-2957895 cec: nack: "NACK"
2932366-2953795 cec: frames: "0d"
2932366-2953795 cec: sections: "HDR: TV, Backup_2 | OPC: PING | R: NACK"
2963441-2967928 cec: st: "ST"
2967928-2970309 cec: bits: "0"
2970309-2972690 cec: bits: "0"
2972690-2975071 cec: bits: "0"
2975071-2977452 cec: bits: "0"
2977452-2979833 cec: bits: "1"
2979833-2982214 cec: bits: "1"
2982214-2984595 cec: bits: "0"
2984595-2986976 cec: bits: "1"
2967928-2986976 cec: bytes: "0x0d"
2986976-2989357 cec: eom-1: "EOM=Y"
2989357-2993457 cec: nack: "NACK"
2967928-2989357 cec: frames: "0d"
2967928-2989357 cec: sections: "HDR: TV, Backup_2 | OPC: PING | R: NACK"
3008618-3013105 cec: st: "ST"
3013105-3015486 cec: bits: "0"
3015486-3017867 cec: bits: "0"
3017867-3020248 cec: bits: "0"
3020248-3022629 cec: bits: "0"
3022629-3025010 cec: bits: "1"
3025010-3027391 cec: bits: "1"
3027391-3029772 cec: bits: "1"
3029772-3032153 cec: bits: "1"
3013105-3032153 cec: bytes: "0x0f"
3032153-3034534 cec: eom-0: "EOM=N"
3034534-3036915 cec: ack: "ACK"
3036915-3039296 cec: bits: "1"
3039296-3041677 cec: bits: "0"
3041677-3044058 cec: bits: "1"
3044058-3046439 cec: bits: "0"
3046439-3048820 cec: bits: "0"
3048820-3051201 cec: bits: "0"
3051201-3053582 cec: bits: "0"
3053582-3055963 cec: bits: "0"
3036915-3055963 cec: bytes: "0xa0"
3055963-3058344 cec: eom-0: "EOM=N"
3058344-3060725 cec: ack: "ACK"
3060725-3063106 cec: bits: "0"
3063106-3065487 cec: bits: "0"
3065487-3067868 cec: bits: "0"
3067868-3070249 cec: bits: "0"
3070249-3072630 cec: bits: "1"
3072630-3075011 cec: bits: "0"
3075011-3077392 cec: bits: "0"
3077392-3079773 cec: bits: "0"
3060725-3079773 cec: bytes: "0x08"
3079773-3082154 cec: eom-0: "EOM=N"
3082154-3084535 cec: ack: "ACK"
3084535-3086916 cec: bits: "0"
3086916-3089297 cec: bits: "0"
3089297-3091677 cec: bits: "0"
3091677-3094058 cec: bits: "0"
3094058-3096439 cec: bits: "0"
3096439-3098820 cec: bits: "0"
3098820-3101201 cec: bits: "0"
3101201-3103582 cec: bits: "0"
3084535-3103582 cec: bytes: "0x00"
3103582-3105963 cec: eom-0: "EOM=N"
3105963-3108344 cec: ack: "ACK"
3108344-3110725 cec: bits: "0"
3110725-3113106 cec: bits: "1"
3113106-3115487 cec: bits: "0"
3115487-3117868 cec: bits: "0"
3117868-3120249 cec: bits: "0"
3120249-3122630 cec: bits: "1"
3122630-3125011 cec: bits: "1"
3125011-3127392 cec: bits: "0"
3108344-3127392 cec: bytes: "0x46"
3127392-3129773 cec: eom-0: "EOM=N"
3129773-3132154 cec: ack: "ACK"
3132154-3134535 cec: bits: "0"
3134535-3136916 cec: bits: "0"
3136916-3139297 cec: bits: "0"
3139297-3141678 cec: bits: "0"
3141678-3144059 cec: bits: "0"
3144059-3146440 cec: bits: "0"
3146440-3148821 cec: bits: "0"
3148821-3151202 cec: bits: "0"
3132154-3151202 cec: bytes: "0x00"
3151202-3153583 cec: eom-0: "EOM=N"
3153583-3155964 cec: ack: "ACK"
3155964-3158345 cec: bits: "0"
3158345-3160726 cec: bits: "0"
3160726-3163107 cec: bits: "0"
3163107-3165488 cec: bits: "1"
3165488-3167869 cec: bits: "0"
3167869-3170250 cec: bits: "0"
3170250-3172630 cec: bits: "1"
3172630-3175011 cec: bits: "1"
3155964-3175011 cec: bytes: "0x13"
3175011-3177392 cec: eom-0: "EOM=N"
3177392-3179773 cec: ack: "ACK"
3179773-3182154 cec: bits: "0"
3182154-3184535 cec: bits: "0"
3184535-3186916 cec: bits: "0"
3186916-3189297 cec: bits: "0"
3189297-3191678 cec: bits: "0"
3191678-3194059 cec: bits: "0"
3194059-3196440 cec: bits: "0"
3196440-3198821 cec: bits: "0"
3179773-3198821 cec: bytes: "0x00"
3198821-3201202 cec: eom-0: "EOM=N"
3201202-3203583 cec: ack: "ACK"
3203583-3205964 cec: bits: "0"
3205964-3208345 cec: bits: "0"
3208345-3210726 cec: bits: "0"
3210726-3213107 cec: bits: "1"
3213107-3215488 cec: bits: "0"
3215488-3217869 cec: bits: "0"
3217869-3220250 cec: bits: "0"
3220250-3222631 cec: bits: "0"
3203583-3222631 cec: bytes: "0x10"
3222631-3225012 cec: eom-0: "EOM=N"
3225012-3227393 cec: ack: "ACK"
3227393-3229774 cec: bits: "1"
3229774-3232155 cec: bits: "0"
3232155-3234536 cec: bits: "0"
3234536-3236917 cec: bits: "0"
3236917-3239298 cec: bits: "0"
3239298-3241679 cec: bits: "0"
3241679-3244060 cec: bits: "0"
3244060-3246441 cec: bits: "0"
3227393-3246441 cec: bytes: "0x80"
3246441-3248822 cec: eom-0: "EOM=N"
3248822-3251202 cec: ack: "ACK"
3251202-3253583 cec: bits: "0"
3253583-3255964 cec: bits: "0"
3255964-3258345 cec: bits: "0"
3258345-3260726 cec: bits: "0"
3260726-3263107 cec: bits: "0"
3263107-3265488 cec: bits: "0"
3265488-3267869 cec: bits: "0"
3267869-3270250 cec: bits: "0"
3251202-3270250 cec: bytes: "0x00"
3270250-3272631 cec: eom-0: "EOM=N"
3272631-3275012 cec: ack: "ACK"
3275012-3277393 cec: bits: "0"
3277393-3279774 cec: bits: "0"
3279774-3282155 cec: bits: "0"
3282155-3284536 cec: bits: "0"
3284536-3286917 cec: bits: "0"
3286917-3289298 cec: bits: "0"
3289298-3291679 cec: bits: "0"
3291679-3294060 cec: bits: "1"
3275012-3294060 cec: bytes: "0x01"
3294060-3296441 cec: eom-0: "EOM=N"
3296441-3298822 cec: ack: "ACK"
3298822-3301203 cec: bits: "0"
3301203-3303584 cec: bits: "0"
3303584-3305965 cec: bits: "0"
3305965-3308346 cec: bits: "0"
3308346-3310727 cec: bits: "0"
3310727-3313108 cec: bits: "0"
3313108-3315489 cec: bits: "0"
3315489-3317870 cec: bits: "0"
3298822-3317870 cec: bytes: "0x00"
3317870-3320251 cec: eom-0: "EOM=N"
3320251-3322632 cec: ack: "ACK"
3322632-3325013 cec: bits: "0"
3325013-3327394 cec: bits: "0"
3327394-3329774 cec: bits: "0"
3329774-3332155 cec: bits: "0"
3332155-3334536 cec: bits: "0"
3334536-3336917 cec: bits: "0"
3336917-3339298 cec: bits: "0"
3339298-3341679 cec: bits: "0"
3322632-3341679 cec: bytes: "0x00"
3341679-3344060 cec: eom-0: "EOM=N"
3344060-3346441 cec: ack: "ACK"
3346441-3348822 cec: bits: "0"
3348822-3351203 cec: bits: "0"
3351203-3353584 cec: bits: "0"
3353584-3355965 cec: bits: "0"
3355965-3358346 cec: bits: "0"
3358346-3360727 cec: bits: "0"
3360727-3363108 cec: bits: "0"
3363108-3365489 cec: bits: "0"
3346441-3365489 cec: bytes: "0x00"
3365489-3367870 cec: eom-0: "EOM=N"
3367870-3370251 cec: ack: "ACK"
3370251-3372632 cec: bits: "0"
3372632-3375013 cec: bits: "0"
3375013-3377394 cec: bits: "0"
3377394-3379775 cec: bits: "0"
3379775-3382156 cec: bits: "0"
3382156-3384537 cec: bits: "0"
3384537-3386918 cec: bits: "0"
3386918-3389299 cec: bits: "0"
3370251-3389299 cec: bytes: "0x00"
3389299-3391680 cec: eom-1: "EOM=Y"
3391680-3395780 cec: ack: "ACK"
3013105-3391680 cec: frames: "0f:a0:08:00:46:00:13:00:10:80:00:01:00:00:00:00"
3013105-3391680 cec: sections: "HDR: TV, Broadcast | OPC: VENDOR_COMMAND_WITH_ID | OPS: 0x08, 0x00, 0x46, 0x00, 0x13, 0x00, 0x10, 0x80, 0x00, 0x01, 0x00, 0x00, 0x00, 0x00 | R: ACK"
3408268-3412774 cec: st: "ST"
3412774-3415180 cec: bits: "0"
3415180-3417586 cec: bits: "1"
3417586-3419992 cec: bits: "0"
3419992-3422398 cec: bits: "1"
3422398-3424803 cec: bits: "0"
3424803-3427209 cec: bits: "0"
3427209-3429615 cec: bits: "0"
3429615-3432021 cec: bits: "0"
3412774-3432021 cec: bytes: "0x50"
3432021-3434427 cec: eom-0: "EOM=N"
3434427-3436833 cec: ack: "ACK"
3436833-3439239 cec: bits: "0"
3439239-3441645 cec: bits: "0"
3441645-3444051 cec: bits: "0"
3444051-3446457 cec: bits: "0"
3446457-3448863 cec: bits: "0"
3448863-3451269 cec: bits: "0"
3451269-3453675 cec: bits: "0"
3453675-3456081 cec: bits: "0"
3436833-3456081 cec: bytes: "0x00"
3456081-3458486 cec: eom-0: "EOM=N"
3458486-3460892 cec: ack: "ACK"
3460892-3463298 cec: bits: "1"
3463298-3465705 cec: bits: "0"
3465705-3468110 cec: bits: "1"
3468110-3470516 cec: bits: "0"
3470516-3472922 cec: bits: "0"
3472922-3475328 cec: bits: "0"
3475328-3477734 cec: bits: "0"
3477734-3480140 cec: bits: "0"
3460892-3480140 cec: bytes: "0xa0"
3480140-3482546 cec: eom-0: "EOM=N"
3482546-3484952 cec: ack: "ACK"
3484952-3487358 cec: bits: "0"
3487358-3489764 cec: bits: "0"
3489764-3492170 cec: bits: "0"
3492170-3494576 cec: bits: "0"
3494576-3496982 cec: bits: "0"
3496982-3499388 cec: bits: "0"
3499388-3501793 cec: bits: "0"
3501793-3504199 cec: bits: "0"
3484952-3504199 cec: bytes: "0x00"
3504199-3506605 cec: eom-1: "EOM=Y"
3506605-3510705 cec: ack: "ACK"
3412774-3506605 cec: frames: "50:00:a0:00"
3412774-3506605 cec: sections: "HDR: AudioSystem, TV | OPC: FEATURE_ABORT | OPS: 0xa0, 0x00 | R: ACK"
3521015-3525502 cec: st: "ST"
3525502-3527883 cec: bits: "0"
3527883-3530264 cec: bits: "0"
3530264-3532645 cec: bits: "0"
3532645-3535026 cec: bits: "0"
3535026-3537407 cec: bits: "1"
3537407-3539788 cec: bits: "1"
3539788-3542169 cec: bits: "0"
3542169-3544550 cec: bits: "0"
3525502-3544550 cec: bytes: "0x0c"
3544550-3546931 cec: eom-1: "EOM=Y"
3546931-3551031 cec: nack: "NACK"
3525502-3546931 cec: frames: "0c"
3525502-3546931 cec: sections: "HDR: TV, Backup_1 | OPC: PING | R: NACK"
3556577-3561064 cec: st: "ST"
3561064-3563445 cec: bits: "0"
3563445-3565826 cec: bits: "0"
3565826-3568207 cec: bits: "0"
3568207-3570588 cec: bits: "0"
3570588-3572969 cec: bits: "1"
3572969-3575350 cec: bits: "1"
3575350-3577731 cec: bits: "0"
3577731-3580112 cec: bits: "0"
3561064-3580112 cec: bytes: "0x0c"
3580112-3582493 cec: eom-1: "EOM=Y"
3582493-3586593 cec: nack: "NACK"
3561064-3582493 cec: frames: "0c"
3561064-3582493 cec: sections: "HDR: TV, Backup_1 | OPC: PING | R: NACK"
3601754-3606242 cec: st: "ST"
3606242-3608623 cec: bits: "0"
3608623-3611004 cec: bits: "0"
3611004-3613385 cec: bits: "0"
3613385-3615766 cec: bits: "0"
3615766-3618147 cec: bits: "1"
3618147-3620528 cec: bits: "1"
3620528-3622908 cec: bits: "1"
3622908-3625289 cec: bits: "1"
3606242-3625289 cec: bytes: "0x0f"
3625289-3627670 cec: eom-0: "EOM=N"
3627670-3630051 cec: ack: "ACK"
3630051-3632432 cec: bits: "1"
3632432-3634813 cec: bits: "0"
3634813-3637194 cec: bits: "1"
3637194-3639575 cec: bits: "0"
3639575-3641956 cec: bits: "0"
3641956-3644337 cec: bits: "0"
3644337-3646718 cec: bits: "0"
3646718-3649099 cec: bits: "0"
3630051-3649099 cec: bytes: "0xa0"
3649099-3651480 cec: eom-0: "EOM=N"
3651480-3653861 cec: ack: "ACK"
3653861-3656242 cec: bits: "0"
3656242-3658623 cec: bits: "0"
3658623-3661004 cec: bits: "0"
3661004-3663385 cec: bits: "0"
3663385-3665766 cec: bits: "1"
3665766-3668147 cec: bits: "0"
3668147-3670528 cec: bits: "0"
3670528-3672909 cec: bits: "0"
3653861-3672909 cec: bytes: "0x08"
3672909-3675290 cec: eom-0: "EOM=N"
3675290-3677671 cec: ack: "ACK"
3677671-3680052 cec: bits: "0"
3680052-3682433 cec: bits: "0"
3682433-3684814 cec: bits: "0"
3684814-3687195 cec: bits: "0"
3687195-3689576 cec: bits: "0"
3689576-3691957 cec: bits: "0"
3691957-3694338 cec: bits: "0"
3694338-3696719 cec: bits: "0"
3677671-3696719 cec: bytes: "0x00"
3696719-3699100 cec: eom-0: "EOM=N"
3699100-3701481 cec: ack: "ACK"
3701481-3703861 cec: bits: "0"
3703861-3706242 cec: bits: "1"
3706242-3708623 cec: bits: "0"
3708623-3711004 cec: bits: "0"
3711004-3713385 cec: bits: "0"
3713385-3715766 cec: bits: "1"
3715766-3718147 cec: bits: "1"
3718147-3720528 cec: bits: "0"
3701481-3720528 cec: bytes: "0x46"
3720528-3722909 cec: eom-0: "EOM=N"
3722909-3725290 cec: ack: "ACK"
3725290-3727671 cec: bits: "0"
3727671-3730052 cec: bits: "0"
3730052-3732433 cec: bits: "0"
3732433-3734814 cec: bits: "0"
3734814-3737195 cec: bits: "0"
3737195-3739576 cec: bits: "0"
3739576-3741957 cec: bits: "0"
3741957-3744338 cec: bits: "0"
3725290-3744338 cec: bytes: "0x00"
3744338-3746719 cec: eom-0: "EOM=N"
3746719-3749100 cec: ack: "ACK"
3749100-3751481 cec: bits: "0"
3751481-3753862 cec: bits: "0"
3753862-3756243 cec: bits: "0"
3756243-3758624 cec: bits: "0"
3758624-3761005 cec: bits: "1"
3761005-3763386 cec: bits: "0"
3763386-3765767 cec: bits: "0"
3765767-3768148 cec: bits: "0"
3749100-3768148 cec: bytes: "0x08"
3768148-3770529 cec: eom-0: "EOM=N"
3770529-3772910 cec: ack: "ACK"
3772910-3775291 cec: bits: "0"
3775291-3777672 cec: bits: "0"
3777672-3780053 cec: bits: "0"
3780053-3782433 cec: bits: "0"
3782433-3784814 cec: bits: "0"
3784814-3787195 cec: bits: "0"
3787195-3789576 cec: bits: "0"
3789576-3791957 cec: bits: "0"
3772910-3791957 cec: bytes: "0x00"
3791957-3794338 cec: eom-0: "EOM=N"
3794338-3796719 cec: ack: "ACK"
3796719-3799100 cec: bits: "0"
3799100-3801481 cec: bits: "0"
3801481-3803862 cec: bits: "0"
3803862-3806243 cec: bits: "0"
3806243-3808624 cec: bits: "0"
3808624-3811005 cec: bits: "0"
3811005-3813386 cec: bits: "0"
3813386-3815767 cec: bits: "0"
3796719-3815767 cec: bytes: "0x00"
3815767-3818148 cec: eom-1: "EOM=Y"
3818148-3822248 cec: ack: "ACK"
3606242-3818148 cec: frames: "0f:a0:08:00:46:00:08:00:00"
3606242-3818148 cec: sections: "HDR: TV, Broadcast | OPC: VENDOR_COMMAND_WITH_ID | OPS: 0x08, 0x00, 0x46, 0x00, 0x08, 0x00, 0x00 | R: ACK"
3834373-3838879 cec: st: "ST"
3838879-3841285 cec: bits: "0"
3841285-3843691 cec: bits: "1"
3843691-3846097 cec: bits: "0"
3846097-3848503 cec: bits: "1"
3848503-3850909 cec: bits: "0"
3850909-3853315 cec: bits: "0"
3853315-3855721 cec: bits: "0"
3855721-3858127 cec: bits: "0"
3838879-3858127 cec: bytes: "0x50"
3858127-3860533 cec: eom-0: "EOM=N"
3860533-3862939 cec: ack: "ACK"
3862939-3865345 cec: bits: "0"
3865345-3867750 cec: bits: "0"
3867750-3870156 cec: bits: "0"
3870156-3872562 cec: bits: "0"
3872562-3874968 cec: bits: "0"
3874968-3877374 cec: bits: "0"
3877374-3879780 cec: bits: "0"
3879780-3882186 cec: bits: "0"
3862939-3882186 cec: bytes: "0x00"
3882186-3884592 cec: eom-0: "EOM=N"
3884592-3886998 cec: ack: "ACK"
3886998-3889404 cec: bits: "1"
3889404-3891810 cec: bits: "0"
3891810-3894216 cec: bits: "1"
3894216-3896622 cec: bits: "0"
3896622-3899028 cec: bits: "0"
3899028-3901433 cec: bits: "0"
3901433-3903839 cec: bits: "0"
3903839-3906245 cec: bits: "0"
3886998-3906245 cec: bytes: "0xa0"
3906245-3908651 cec: eom-0: "EOM=N"
3908651-3911057 cec: ack: "ACK"
3911057-3913463 cec: bits: "0"
3913463-3915869 cec: bits: "0"
3915869-3918275 cec: bits: "0"
3918275-3920681 cec: bits: "0"
3920681-3923087 cec: bits: "0"
3923087-3925493 cec: bits: "0"
3925493-3927899 cec: bits: "0"
3927899-3930305 cec: bits: "0"
3911057-3930305 cec: bytes: "0x00"
3930305-3932711 cec: eom-1: "EOM=Y"
3932711-3936811 cec: ack: "ACK"
3838879-3932711 cec: frames: "50:00:a0:00"
3838879-3932711 cec: sections: "HDR: AudioSystem, TV | OPC: FEATURE_ABORT | OPS: 0xa0, 0x00 | R: ACK"
3947148-3951635 cec: st: "ST"
3951635-3954016 cec: bits: "0"
3954016-3956397 cec: bits: "0"
3956397-3958778 cec: bits: "0"
3958778-3961159 cec: bits: "0"
3961159-3963540 cec: bits: "0"
3963540-3965921 cec: bits: "1"
3965921-3968302 cec: bits: "0"
3968302-3970683 cec: bits: "1"
3951635-3970683 cec: bytes: "0x05"
3970683-3973064 cec: eom-0: "EOM=N"
3973064-3975445 cec: ack: "ACK"
3975445-3977826 cec: bits: "1"
3977826-3980207 cec: bits: "0"
3980207-3982588 cec: bits: "0"
3982588-3984969 cec: bits: "1"
3984969-3987350 cec: bits: "0"
3987350-3989730 cec: bits: "0"
3989730-3992111 cec: bits: "0"
3992111-3994492 cec: bits: "0"
3975445-3994492 cec: bytes: "0x90"
3994492-3996873 cec: eom-0: "EOM=N"
3996873-3999254 cec: ack: "ACK"
3999254-4001635 cec: bits: "0"
4001635-4004016 cec: bits: "0"
4004016-4006397 cec: bits: "0"
4006397-4008778 cec: bits: "0"
4008778-4011159 cec: bits: "0"
4011159-4013540 cec: bits: "0"
4013540-4015921 cec: bits: "0"
4015921-4018302 cec: bits: "0"
3999254-4018302 cec: bytes: "0x00"
4018302-4020683 cec: eom-1: "EOM=Y"
4020683-4024783 cec: ack: "ACK"
3951635-4020683 cec: frames: "05:90:00"
3951635-4020683 cec: sections: "HDR: TV, AudioSystem | OPC: REPORT_POWER_STATUS | OPS: 0x00 | R: ACK"
4039945-4044432 cec: st: "ST"
4044432-4046813 cec: bits: "0"
4046813-4049194 cec: bits: "0"
4049194-4051575 cec: bits: "0"
4051575-4053956 cec: bits: "0"
4053956-4056337 cec: bits: "0"
4056337-4058718 cec: bits: "1"
4058718-4061099 cec: bits: "0"
4061099-4063479 cec: bits: "1"
4044432-4063479 cec: bytes: "0x05"
4063479-4065860 cec: eom-0: "EOM=N"
4065860-4068241 cec: ack: "ACK"
4068241-4070622 cec: bits: "0"
4070622-4073003 cec: bits: "1"
4073003-4075384 cec: bits: "1"
4075384-4077765 cec: bits: "1"
4077765-4080146 cec: bits: "0"
4080146-4082527 cec: bits: "0"
4082527-4084908 cec: bits: "0"
4084908-4087289 cec: bits: "0"
4068241-4087289 cec: bytes: "0x70"
4087289-4089670 cec: eom-0: "EOM=N"
4089670-4092051 cec: ack: "ACK"
4092051-4094432 cec: bits: "0"
4094432-4096813 cec: bits: "0"
4096813-4099194 cec: bits: "1"
4099194-4101575 cec: bits: "1"
4101575-4103956 cec: bits: "0"
4103956-4106337 cec: bits: "0"
4106337-4108718 cec: bits: "0"
4108718-4111099 cec: bits: "0"
4092051-4111099 cec: bytes: "0x30"
4111099-4113480 cec: eom-0: "EOM=N"
4113480-4115861 cec: ack: "ACK"
4115861-4118242 cec: bits: "0"
4118242-4120623 cec: bits: "0"
4120623-4123004 cec: bits: "0"
4123004-4125385 cec: bits: "0"
4125385-4127766 cec: bits: "0"
4127766-4130147 cec: bits: "0"
4130147-4132528 cec: bits: "0"
4132528-4134909 cec: bits: "0"
4115861-4134909 cec: bytes: "0x00"
4134909-4137290 cec: eom-1: "EOM=Y"
4137290-4141390 cec: ack: "ACK"
4044432-4137290 cec: frames: "05:70:30:00"
4044432-4137290 cec: sections: "HDR: TV, AudioSystem | OPC: SYSTEM_AUDIO_MODE_REQUEST | OPS: 0x30, 0x00 | R: ACK"
4154452-4158959 cec: st: "ST"
4158959-4161364 cec: bits: "0"
4161364-4163770 cec: bits: "1"
4163770-4166176 cec: bits: "0"
4166176-4168582 cec: bits: "1"
4168582-4170988 cec: bits: "1"
4170988-4173394 cec: bits: "1"
4173394-4175800 cec: bits: "1"
4175800-4178206 cec: bits: "1"
4158959-4178206 cec: bytes: "0x5f"
4178206-4180612 cec: eom-0: "EOM=N"
4180612-4183018 cec: ack: "ACK"
4183018-4185424 cec: bits: "0"
4185424-4187830 cec: bits: "1"
4187830-4190236 cec: bits: "1"
4190236-4192642 cec: bits: "1"
4192642-4195047 cec: bits: "0"
4195047-4197453 cec: bits: "0"
4197453-4199859 cec: bits: "1"
4199859-4202265 cec: bits: "0"
4183018-4202265 cec: bytes: "0x72"
4202265-4204671 cec: eom-0: "EOM=N"
4204671-4207077 cec: ack: "ACK"
4207077-4209483 cec: bits: "0"
4209483-4211889 cec: bits: "0"
4211889-4214295 cec: bits: "0"
4214295-4216701 cec: bits: "0"
4216701-4219107 cec: bits: "0"
4219107-4221513 cec: bits: "0"
4221513-4223919 cec: bits: "0"
4223919-4226325 cec: bits: "1"
4207077-4226325 cec: bytes: "0x01"
4226325-4228730 cec: eom-1: "EOM=Y"
4228730-4232830 cec: ack: "ACK"
4158959-4228730 cec: frames: "5f:72:01"
4158959-4228730 cec: sections: "HDR: AudioSystem, Broadcast | OPC: SET_SYSTEM_AUDIO_MODE | OPS: 0x01 | R: ACK"
4243151-4247638 cec: st: "ST"
4247638-4250019 cec: bits: "0"
4250019-4252400 cec: bits: "0"
4252400-4254781 cec: bits: "0"
4254781-4257162 cec: bits: "0"
4257162-4259543 cec: bits: "1"
4259543-4261924 cec: bits: "0"
4261924-4264305 cec: bits: "1"
4264305-4266686 cec: bits: "1"
4247638-4266686 cec: bytes: "0x0b"
4266686-4269067 cec: eom-1: "EOM=Y"
4269067-4273167 cec: nack: "NACK"
4247638-4269067 cec: frames: "0b"
4247638-4269067 cec: sections: "HDR: TV, Playback_3 | OPC: PING | R: NACK"
4278713-4283200 cec: st: "ST"
4283200-4285581 cec: bits: "0"
4285581-4287962 cec: bits: "0"
4287962-4290343 cec: bits: "0"
4290343-4292724 cec: bits: "0"
4292724-4295105 cec: bits: "1"
4295105-4297486 cec: bits: "0"
4297486-4299867 cec: bits: "1"
4299867-4302248 cec: bits: "1"
4283200-4302248 cec: bytes: "0x0b"
4302248-4304629 cec: eom-1: "EOM=Y"
4304629-4308729 cec: nack: "NACK"
4283200-4304629 cec: frames: "0b"
4283200-4304629 cec: sections: "HDR: TV, Playback_3 | OPC: PING | R: NACK"
4323890-4328378 cec: st: "ST"
4328378-4330759 cec: bits: "0"
4330759-4333140 cec: bits: "0"
4333140-4335521 cec: bits: "0"
4335521-4337902 cec: bits: "0"
4337902-4340283 cec: bits: "0"
4340283-4342663 cec: bits: "1"
4342663-4345044 cec: bits: "0"
4345044-4347425 cec: bits: "1"
4328378-4347425 cec: bytes: "0x05"
4347425-4349806 cec: eom-0: "EOM=N"
4349806-4352187 cec: ack: "ACK"
4352187-4354568 cec: bits: "0"
4354568-4356949 cec: bits: "1"
4356949-4359330 cec: bits: "1"
4359330-4361711 cec: bits: "1"
4361711-4364092 cec: bits: "0"
4364092-4366473 cec: bits: "0"
4366473-4368854 cec: bits: "0"
4368854-4371235 cec: bits: "1"
4352187-4371235 cec: bytes: "0x71"
4371235-4373616 cec: eom-1: "EOM=Y"
4373616-4377716 cec: ack: "ACK"
4328378-4373616 cec: frames: "05:71"
4328378-4373616 cec: sections: "HDR: TV, AudioSystem | OPC: GIVE_AUDIO_STATUS | R: ACK"
4390511-4395017 cec: st: "ST"
4395017-4397423 cec: bits: "0"
4397423-4399829 cec: bits: "1"
4399829-4402235 cec: bits: "0"
4402235-4404641 cec: bits: "1"
4404641-4407047 cec: bits: "0"
4407047-4409453 cec: bits: "0"
4409453-4411858 cec: bits: "0"
4411858-4414264 cec: bits: "0"
4395017-4414264 cec: bytes: "0x50"
4414264-4416670 cec: eom-0: "EOM=N"
4416670-4419076 cec: ack: "ACK"
4419076-4421482 cec: bits: "0"
4421482-4423888 cec: bits: "1"
4423888-4426294 cec: bits: "1"
4426294-4428700 cec: bits: "1"
4428700-4431106 cec: bits: "1"
4431106-4433512 cec: bits: "0"
4433512-4435918 cec: bits: "1"
4435918-4438324 cec: bits: "0"
4419076-4438324 cec: bytes: "0x7a"
4438324-4440730 cec: eom-0: "EOM=N"
4440730-4443136 cec: ack: "ACK"
4443136-4445541 cec: bits: "0"
4445541-4447947 cec: bits: "0"
4447947-4450353 cec: bits: "0"
4450353-4452759 cec: bits: "1"
4452759-4455165 cec: bits: "0"
4455165-4457571 cec: bits: "0"
4457571-4459977 cec: bits: "0"
4459977-4462383 cec: bits: "1"
4443136-4462383 cec: bytes: "0x11"
4462383-4464789 cec: eom-1: "EOM=Y"
4464789-4468889 cec: ack: "ACK"
4395017-4464789 cec: frames: "50:7a:11"
4395017-4464789 cec: sections: "HDR: AudioSystem, TV | OPC: REPORT_AUDIO_STATUS | OPS: 0x11 | R: ACK"
4479203-4483690 cec: st: "ST"
4483690-4486071 cec: bits: "0"
4486071-4488452 cec: bits: "0"
4488452-4490833 cec: bits: "0"
4490833-4493214 cec: bits: "0"
4493214-4495595 cec: bits: "1"
4495595-4497976 cec: bits: "0"
4497976-4500357 cec: bits: "1"
4500357-4502738 cec: bits: "0"
4483690-4502738 cec: bytes: "0x0a"
4502738-4505119 cec: eom-1: "EOM=Y"
4505119-4509219 cec: nack: "NACK"
4483690-4505119 cec: frames: "0a"
4483690-4505119 cec: sections: "HDR: TV, Tuner_4 | OPC: PING | R: NACK"
4514765-4519252 cec: st: "ST"
4519252-4521633 cec: bits: "0"
4521633-4524014 cec: bits: "0"
4524014-4526395 cec: bits: "0"
4526395-4528776 cec: bits: "0"
4528776-4531157 cec: bits: "1"
4531157-4533538 cec: bits: "0"
4533538-4535919 cec: bits: "1"
4535919-4538300 cec: bits: "0"
4519252-4538300 cec: bytes: "0x0a"
4538300-4540681 cec: eom-1: "EOM=Y"
4540681-4544781 cec: nack: "NACK"
4519252-4540681 cec: frames: "0a"
4519252-4540681 cec: sections: "HDR: TV, Tuner_4 | OPC: PING | R: NACK"
4559942-4564429 cec: st: "ST"
4564429-4566810 cec: bits: "0"
4566810-4569191 cec: bits: "0"
4569191-4571572 cec: bits: "0"
4571572-4573953 cec: bits: "0"
4573953-4576334 cec: bits: "1"
4576334-4578715 cec: bits: "0"
4578715-4581096 cec: bits: "0"
4581096-4583477 cec: bits: "1"
4564429-4583477 cec: bytes: "0x09"
4583477-4585858 cec: eom-1: "EOM=Y"
4585858-4589958 cec: nack: "NACK"
4564429-4585858 cec: frames: "09"
4564429-4585858 cec: sections: "HDR: TV, Recording_3 | OPC: PING | R: NACK"
4595504-4599991 cec: st: "ST"
4599991-4602372 cec: bits: "0"
4602372-4604753 cec: bits: "0"
4604753-4607134 cec: bits: "0"
4607134-4609515 cec: bits: "0"
4609515-4611896 cec: bits: "1"
4611896-4614277 cec: bits: "0"
4614277-4616658 cec: bits: "0"
4616658-4619039 cec: bits: "1"
4599991-4619039 cec: bytes: "0x09"
4619039-4621420 cec: eom-1: "EOM=Y"
4621420-4625520 cec: nack: "NACK"
4599991-4621420 cec: frames: "09"
4599991-4621420 cec: sections: "HDR: TV, Recording_3 | OPC: PING | R: NACK"
4640682-4645169 cec: st: "ST"
4645169-4647550 cec: bits: "0"
4647550-4649931 cec: bits: "0"
4649931-4652312 cec: bits: "0"
4652312-4654693 cec: bits: "0"
4654693-4657074 cec: bits: "1"
4657074-4659455 cec: bits: "0"
4659455-4661836 cec: bits: "0"
4661836-4664217 cec: bits: "0"
4645169-4664217 cec: bytes: "0x08"
4664217-4666597 cec: eom-1: "EOM=Y"
4666597-4670697 cec: nack: "NACK"
4645169-4666597 cec: frames: "08"
4645169-4666597 cec: sections: "HDR: TV, Playback_2 | OPC: PING | R: NACK"
4676243-4680731 cec: st: "ST"
4680731-4683112 cec: bits: "0"
4683112-4685493 cec: bits: "0"
4685493-4687874 cec: bits: "0"
4687874-4690255 cec: bits: "0"
4690255-4692636 cec: bits: "1"
4692636-4695016 cec: bits: "0"
4695016-4697397 cec: bits: "0"
4697397-4699778 cec: bits: "0"
4680731-4699778 cec: bytes: "0x08"
4699778-4702159 cec: eom-1: "EOM=Y"
4702159-4706259 cec: nack: "NACK"
4680731-4702159 cec: frames: "08"
4680731-4702159 cec: sections: "HDR: TV, Playback_2 | OPC: PING | R: NACK"
4721421-4725908 cec: st: "ST"
4725908-4728289 cec: bits: "0"
4728289-4730670 cec: bits: "0"
4730670-4733051 cec: bits: "0"
4733051-4735432 cec: bits: "0"
4735432-4737813 cec: bits: "0"
4737813-4740194 cec: bits: "1"
4740194-4742575 cec: bits: "1"
4742575-4744956 cec: bits: "1"
4725908-4744956 cec: bytes: "0x07"
4744956-4747337 cec: eom-1: "EOM=Y"
4747337-4751437 cec: nack: "NACK"
4725908-4747337 cec: frames: "07"
4725908-4747337 cec: sections: "HDR: TV, Tuner3 | OPC: PING | R: NACK"
4756983-4761470 cec: st: "ST"
4761470-4763851 cec: bits: "0"
4763851-4766232 cec: bits: "0"
4766232-4768613 cec: bits: "0"
4768613-4770994 cec: bits: "0"
4770994-4773375 cec: bits: "0"
4773375-4775756 cec: bits: "1"
4775756-4778137 cec: bits: "1"
4778137-4780518 cec: bits: "1"
4761470-4780518 cec: bytes: "0x07"
4780518-4782899 cec: eom-1: "EOM=Y"
4782899-4786999 cec: nack: "NACK"
4761470-4782899 cec: frames: "07"
4761470-4782899 cec: sections: "HDR: TV, Tuner3 | OPC: PING | R: NACK"
4802160-4806647 cec: st: "ST"
4806647-4809028 cec: bits: "0"
4809028-4811409 cec: bits: "0"
4811409-4813790 cec: bits: "0"
4813790-4816171 cec: bits: "0"
4816171-4818552 cec: bits: "0"
4818552-4820933 cec: bits: "1"
4820933-4823314 cec: bits: "1"
4823314-4825695 cec: bits: "0"
4806647-4825695 cec: bytes: "0x06"
4825695-4828076 cec: eom-1: "EOM=Y"
4828076-4832176 cec: nack: "NACK"
4806647-4828076 cec: frames: "06"
4806647-4828076 cec: sections: "HDR: TV, Tuner2 | OPC: PING | R: NACK"
4837722-4842209 cec: st: "ST"
4842209-4844590 cec: bits: "0"
4844590-4846971 cec: bits: "0"
4846971-4849352 cec: bits: "0"
4849352-4851733 cec: bits: "0"
4851733-4854114 cec: bits: "0"
4854114-4856495 cec: bits: "1"
4856495-4858876 cec: bits: "1"
4858876-4861257 cec: bits: "0"
4842209-4861257 cec: bytes: "0x06"
4861257-4863638 cec: eom-1: "EOM=Y"
4863638-4867738 cec: nack: "NACK"
4842209-4863638 cec: frames: "06"
4842209-4863638 cec: sections: "HDR: TV, Tuner2 | OPC: PING | R: NACK"
4882899-4887387 cec: st: "ST"
4887387-4889768 cec: bits: "0"
4889768-4892149 cec: bits: "0"
4892149-4894530 cec: bits: "0"
4894530-4896911 cec: bits: "0"
4896911-4899291 cec: bits: "0"
4899291-4901672 cec: bits: "1"
4901672-4904053 cec: bits: "0"
4904053-4906434 cec: bits: "1"
4887387-4906434 cec: bytes: "0x05"
4906434-4908815 cec: eom-1: "EOM=Y"
4908815-4912915 cec: ack: "ACK"
4887387-4908815 cec: frames: "05"
4887387-4908815 cec: sections: "HDR: TV, AudioSystem | OPC: PING | R: ACK"
4928077-4932564 cec: st: "ST"
4932564-4934945 cec: bits: "0"
4934945-4937326 cec: bits: "0"
4937326-4939707 cec: bits: "0"
4939707-4942088 cec: bits: "0"
4942088-4944469 cec: bits: "0"
4944469-4946850 cec: bits: "1"
4946850-4949231 cec: bits: "0"
4949231-4951612 cec: bits: "0"
4932564-4951612 cec: bytes: "0x04"
4951612-4953993 cec: eom-1: "EOM=Y"
4953993-4958093 cec: nack: "NACK"
4932564-4953993 cec: frames: "04"
4932564-4953993 cec: sections: "HDR: TV, Playback_1 | OPC: PING | R: NACK"
4963639-4968126 cec: st: "ST"
4968126-4970507 cec: bits: "0"
4970507-4972888 cec: bits: "0"
4972888-4975269 cec: bits: "0"
4975269-4977650 cec: bits: "0"
4977650-4980031 cec: bits: "0"
4980031-4982412 cec: bits: "1"
4982412-4984793 cec: bits: "0"
4984793-4987174 cec: bits: "0"
4968126-4987174 cec: bytes: "0x04"
4987174-4989555 cec: eom-1: "EOM=Y"
4989555-4993655 cec: nack: "NACK"
4968126-4989555 cec: frames: "04"
4968126-4989555 cec: sections: "HDR: TV, Playback_1 | OPC: PING | R: NACK"
5008816-5013303 cec: st: "ST"
5013303-5015684 cec: bits: "0"
5015684-5018065 cec: bits: "0"
5018065-5020446 cec: bits: "0"
5020446-5022827 cec: bits: "0"
5022827-5025208 cec: bits: "0"
5025208-5027589 cec: bits: "0"
5027589-5029970 cec: bits: "1"
5029970-5032351 cec: bits: "1"
5013303-5032351 cec: bytes: "0x03"
5032351-5034732 cec: eom-1: "EOM=Y"
5034732-5038832 cec: nack: "NACK"
5013303-5034732 cec: frames: "03"
5013303-5034732 cec: sections: "HDR: TV, Tuner_1 | OPC: PING | R: NACK"
5044378-5048865 cec: st: "ST"
5048865-5051246 cec: bits: "0"
5051246-5053627 cec: bits: "0"
5053627-5056008 cec: bits: "0"
5056008-5058389 cec: bits: "0"
5058389-5060770 cec: bits: "0"
5060770-5063151 cec: bits: "0"
5063151-5065532 cec: bits: "1"
5065532-5067913 cec: bits: "1"
5048865-5067913 cec: bytes: "0x03"
5067913-5070294 cec: eom-1: "EOM=Y"
5070294-5074394 cec: nack: "NACK"
5048865-5070294 cec: frames: "03"
5048865-5070294 cec: sections: "HDR: TV, Tuner_1 | OPC: PING | R: NACK"
5089555-5094043 cec: st: "ST"
5094043-5096424 cec: bits: "0"
5096424-5098805 cec: bits: "0"
5098805-5101186 cec: bits: "0"
5101186-5103567 cec: bits: "0"
5103567-5105947 cec: bits: "0"
5105947-5108328 cec: bits: "0"
5108328-5110709 cec: bits: "1"
5110709-5113090 cec: bits: "0"
5094043-5113090 cec: bytes: "0x02"
5113090-5115471 cec: eom-1: "EOM=Y"
5115471-5119571 cec: nack: "NACK"
5094043-5115471 cec: frames: "02"
5094043-5115471 cec: sections: "HDR: TV, Recording_2 | OPC: PING | R: NACK"
5125117-5129605 cec: st: "ST"
5129605-5131986 cec: bits: "0"
5131986-5134366 cec: bits: "0"
5134366-5136747 cec: bits: "0"
5136747-5139128 cec: bits: "0"
5139128-5141509 cec: bits: "0"
5141509-5143890 cec: bits: "0"
5143890-5146271 cec: bits: "1"
5146271-5148652 cec: bits: "0"
5129605-5148652 cec: bytes: "0x02"
5148652-5151033 cec: eom-1: "EOM=Y"
5151033-5155133 cec: nack: "NACK"
5129605-5151033 cec: frames: "02"
5129605-5151033 cec: sections: "HDR: TV, Recording_2 | OPC: PING | R: NACK"
5170295-5174782 cec: st: "ST"
5174782-5177163 cec: bits: "0"
5177163-5179544 cec: bits: "0"
5179544-5181925 cec: bits: "0"
5181925-5184306 cec: bits: "0"
5184306-5186687 cec: bits: "0"
5186687-5189068 cec: bits: "0"
5189068-5191449 cec: bits: "0"
5191449-5193830 cec: bits: "1"
5174782-5193830 cec: bytes: "0x01"
5193830-5196211 cec: eom-1: "EOM=Y"
5196211-5200311 cec: nack: "NACK"
5174782-5196211 cec: frames: "01"
5174782-5196211 cec: sections: "HDR: TV, Recording_1 | OPC: PING | R: NACK"
5205857-5210344 cec: st: "ST"
5210344-5212725 cec: bits: "0"
5212725-5215106 cec: bits: "0"
5215106-5217487 cec: bits: "0"
5217487-5219868 cec: bits: "0"
5219868-5222249 cec: bits: "0"
5222249-5224630 cec: bits: "0"
5224630-5227011 cec: bits: "0"
5227011-5229392 cec: bits: "1"
5210344-5229392 cec: bytes: "0x01"
5229392-5231773 cec: eom-1: "EOM=Y"
5231773-5235873 cec: nack: "NACK"
5210344-5231773 cec: frames: "01"
5210344-5231773 cec: sections: "HDR: TV, Recording_1 | OPC: PING | R: NACK"
5251034-5255521 cec: st: "ST"
5255521-5257902 cec: bits: "0"
5257902-5260283 cec: bits: "0"
5260283-5262664 cec: bits: "0"
5262664-5265045 cec: bits: "0"
5265045-5267426 cec: bits: "0"
5267426-5269807 cec: bits: "1"
5269807-5272188 cec: bits: "0"
5272188-5274569 cec: bits: "1"
5255521-5274569 cec: bytes: "0x05"
5274569-5276950 cec: eom-0: "EOM=N"
5276950-5279331 cec: ack: "ACK"
5279331-5281712 cec: bits: "1"
5281712-5284093 cec: bits: "0"
5284093-5286474 cec: bits: "0"
5286474-5288855 cec: bits: "0"
5288855-5291236 cec: bits: "0"
5291236-5293617 cec: bits: "0"
5293617-5295998 cec: bits: "1"
5295998-5298379 cec: bits: "1"
5279331-5298379 cec: bytes: "0x83"
5298379-5300760 cec: eom-1: "EOM=Y"
5300760-5304860 cec: ack: "ACK"
5255521-5300760 cec: frames: "05:83"
5255521-5300760 cec: sections: "HDR: TV, AudioSystem | OPC: GIVE_PHYSICAL_ADDRESS | R: ACK"
5317740-5322247 cec: st: "ST"
5322247-5324653 cec: bits: "0"
5324653-5327059 cec: bits: "1"
5327059-5329465 cec: bits: "0"
5329465-5331870 cec: bits: "1"
5331870-5334276 cec: bits: "1"
5334276-5336682 cec: bits: "1"
5336682-5339088 cec: bits: "1"
5339088-5341494 cec: bits: "1"
5322247-5341494 cec: bytes: "0x5f"
5341494-5343900 cec: eom-0: "EOM=N"
5343900-5346306 cec: ack: "ACK"
5346306-5348712 cec: bits: "1"
5348712-5351118 cec: bits: "0"
5351118-5353524 cec: bits: "0"
5353524-5355930 cec: bits: "0"
5355930-5358336 cec: bits: "0"
5358336-5360742 cec: bits: "1"
5360742-5363148 cec: bits: "0"
5363148-5365553 cec: bits: "0"
5346306-5365553 cec: bytes: "0x84"
5365553-5367959 cec: eom-0: "EOM=N"
5367959-5370365 cec: ack: "ACK"
5370365-5372771 cec: bits: "0"
5372771-5375177 cec: bits: "0"
5375177-5377583 cec: bits: "0"
5377583-5379989 cec: bits: "1"
5379989-5382395 cec: bits: "0"
5382395-5384801 cec: bits: "0"
5384801-5387207 cec: bits: "0"
5387207-5389613 cec: bits: "0"
5370365-5389613 cec: bytes: "0x10"
5389613-5392019 cec: eom-0: "EOM=N"
5392019-5394425 cec: ack: "ACK"
5394425-5396831 cec: bits: "0"
5396831-5399236 cec: bits: "0"
5399236-5401642 cec: bits: "0"
5401642-5404048 cec: bits: "0"
5404048-5406454 cec: bits: "0"
5406454-5408860 cec: bits: "0"
5408860-5411266 cec: bits: "0"
5411266-5413672 cec: bits: "0"
5394425-5413672 cec: bytes: "0x00"
5413672-5416078 cec: eom-0: "EOM=N"
5416078-5418484 cec: ack: "ACK"
5418484-5420890 cec: bits: "0"
5420890-5423296 cec: bits: "0"
5423296-5425702 cec: bits: "0"
5425702-5428108 cec: bits: "0"
5428108-5430514 cec: bits: "0"
5430514-5432919 cec: bits: "1"
5432919-5435325 cec: bits: "0"
5435325-5437733 cec: bits: "1"
5418484-5437733 cec: bytes: "0x05"
5437733-5440139 cec: eom-1: "EOM=Y"
5440139-5444239 cec: ack: "ACK"
5322247-5440139 cec: frames: "5f:84:10:00:05"
5322247-5440139 cec: sections: "HDR: AudioSystem, Broadcast | OPC: REPORT_PHYSICAL_ADDRESS | OPS: 0x10, 0x00, 0x05 | R: ACK"
5454576-5459064 cec: st: "ST"
5459064-5461445 cec: bits: "0"
5461445-5463826 cec: bits: "0"
5463826-5466207 cec: bits: "0"
5466207-5468588 cec: bits: "0"
5468588-5470968 cec: bits: "0"
5470968-5473349 cec: bits: "1"
5473349-5475730 cec: bits: "0"
5475730-5478111 cec: bits: "1"
5459064-5478111 cec: bytes: "0x05"
5478111-5480492 cec: eom-0: "EOM=N"
5480492-5482873 cec: ack: "ACK"
5482873-5485254 cec: bits: "0"
5485254-5487635 cec: bits: "1"
5487635-5490016 cec: bits: "1"
5490016-5492397 cec: bits: "1"
5492397-5494778 cec: bits: "1"
5494778-5497159 cec: bits: "1"
5497159-5499540 cec: bits: "0"
5499540-5501921 cec: bits: "1"
5482873-5501921 cec: bytes: "0x7d"
5501921-5504302 cec: eom-1: "EOM=Y"
5504302-5508402 cec: ack: "ACK"
5459064-5504302 cec: frames: "05:7d"
5459064-5504302 cec: sections: "HDR: TV, AudioSystem | OPC: GIVE_SYSTEM_AUDIO_MODE_STATUS | R: ACK"
5523563-5528051 cec: st: "ST"
5528051-5530432 cec: bits: "0"
5530432-5532813 cec: bits: "0"
5532813-5535194 cec: bits: "0"
5535194-5537575 cec: bits: "0"
5537575-5539956 cec: bits: "0"
5539956-5542337 cec: bits: "1"
5542337-5544717 cec: bits: "0"
5544717-5547098 cec: bits: "1"
5528051-5547098 cec: bytes: "0x05"
5547098-5549479 cec: eom-0: "EOM=N"
5549479-5551860 cec: ack: "ACK"
5551860-5554241 cec: bits: "1"
5554241-5556622 cec: bits: "1"
5556622-5559003 cec: bits: "0"
5559003-5561384 cec: bits: "0"
5561384-5563765 cec: bits: "0"
5563765-5566146 cec: bits: "0"
5566146-5568527 cec: bits: "1"
5568527-5570908 cec: bits: "1"
5551860-5570908 cec: bytes: "0xc3"
5570908-5573289 cec: eom-1: "EOM=Y"
5573289-5577389 cec: ack: "ACK"
5528051-5573289 cec: frames: "05:c3"
5528051-5573289 cec: sections: "HDR: TV, AudioSystem | OPC: Invalid | R: ACK"
5590808-5595314 cec: st: "ST"
5595314-5597720 cec: bits: "0"
5597720-5600126 cec: bits: "1"
5600126-5602532 cec: bits: "0"
5602532-5604938 cec: bits: "1"
5604938-5607344 cec: bits: "0"
5607344-5609750 cec: bits: "0"
5609750-5612156 cec: bits: "0"
5612156-5614561 cec: bits: "0"
5595314-5614561 cec: bytes: "0x50"
5614561-5616967 cec: eom-0: "EOM=N"
5616967-5619373 cec: ack: "ACK"
5619373-5621779 cec: bits: "0"
5621779-5624185 cec: bits: "1"
5624185-5626591 cec: bits: "1"
5626591-5628997 cec: bits: "1"
5628997-5631403 cec: bits: "1"
5631403-5633809 cec: bits: "1"
5633809-5636215 cec: bits: "1"
5636215-5638621 cec: bits: "0"
5619373-5638621 cec: bytes: "0x7e"
5638621-5641027 cec: eom-0: "EOM=N"
5641027-5643433 cec: ack: "ACK"
5643433-5645839 cec: bits: "0"
5645839-5648245 cec: bits: "0"
5648245-5650650 cec: bits: "0"
5650650-5653056 cec: bits: "0"
5653056-5655462 cec: bits: "0"
5655462-5657868 cec: bits: "0"
5657868-5660274 cec: bits: "0"
5660274-5662680 cec: bits: "1"
5643433-5662680 cec: bytes: "0x01"
5662680-5665086 cec: eom-1: "EOM=Y"
5665086-5669186 cec: ack: "ACK"
5595314-5665086 cec: frames: "50:7e:01"
5595314-5665086 cec: sections: "HDR: AudioSystem, TV | OPC: SYSTEM_AUDIO_MODE_STATUS | OPS: 0x01 | R: ACK"
5679517-5684004 cec: st: "ST"
5684004-5686385 cec: bits: "0"
5686385-5688766 cec: bits: "0"
5688766-5691147 cec: bits: "0"
5691147-5693528 cec: bits: "0"
5693528-5695909 cec: bits: "0"
5695909-5698290 cec: bits: "1"
5698290-5700671 cec: bits: "0"
5700671-5703052 cec: bits: "1"
5684004-5703052 cec: bytes: "0x05"
5703052-5705433 cec: eom-0: "EOM=N"
5705433-5707814 cec: ack: "ACK"
5707814-5710195 cec: bits: "0"
5710195-5712576 cec: bits: "1"
5712576-5714957 cec: bits: "0"
5714957-5717338 cec: bits: "0"
5717338-5719719 cec: bits: "0"
5719719-5722100 cec: bits: "1"
5722100-5724481 cec: bits: "1"
5724481-5726862 cec: bits: "0"
5707814-5726862 cec: bytes: "0x46"
5726862-5729243 cec: eom-1: "EOM=Y"
5729243-5733343 cec: ack: "ACK"
5684004-5729243 cec: frames: "05:46"
5684004-5729243 cec: sections: "HDR: TV, AudioSystem | OPC: GIVE_OSD_NAME | R: ACK"
5748504-5752991 cec: st: "ST"
5752991-5755372 cec: bits: "0"
5755372-5757753 cec: bits: "0"
5757753-5760134 cec: bits: "0"
5760134-5762515 cec: bits: "0"
5762515-5764896 cec: bits: "0"
5764896-5767277 cec: bits: "1"
5767277-5769658 cec: bits: "0"
5769658-5772039 cec: bits: "1"
5752991-5772039 cec: bytes: "0x05"
5772039-5774420 cec: eom-0: "EOM=N"
5774420-5776801 cec: ack: "ACK"
5776801-5779182 cec: bits: "0"
5779182-5781563 cec: bits: "1"
5781563-5783944 cec: bits: "1"
5783944-5786325 cec: bits: "1"
5786325-5788706 cec: bits: "0"
5788706-5791087 cec: bits: "0"
5791087-5793468 cec: bits: "0"
5793468-5795849 cec: bits: "1"
5776801-5795849 cec: bytes: "0x71"
5795849-5798230 cec: eom-1: "EOM=Y"
5798230-5802330 cec: ack: "ACK"
5752991-5798230 cec: frames: "05:71"
5752991-5798230 cec: sections: "HDR: TV, AudioSystem | OPC: GIVE_AUDIO_STATUS | R: ACK"
5814863-5819369 cec: st: "ST"
5819369-5821775 cec: bits: "0"
5821775-5824181 cec: bits: "1"
5824181-5826587 cec: bits: "0"
5826587-5828993 cec: bits: "1"
5828993-5831399 cec: bits: "0"
5831399-5833805 cec: bits: "0"
5833805-5836211 cec: bits: "0"
5836211-5838617 cec: bits: "0"
5819369-5838617 cec: bytes: "0x50"
5838617-5841023 cec: eom-0: "EOM=N"
5841023-5843429 cec: ack: "ACK"
5843429-5845834 cec: bits: "1"
5845834-5848240 cec: bits: "1"
5848240-5850646 cec: bits: "0"
5850646-5853052 cec: bits: "0"
5853052-5855458 cec: bits: "0"
5855458-5857864 cec: bits: "0"
5857864-5860270 cec: bits: "0"
5860270-5862676 cec: bits: "0"
5843429-5862676 cec: bytes: "0xc0"
5862676-5865082 cec: eom-1: "EOM=Y"
5865082-5869182 cec: ack: "ACK"
5819369-5865082 cec: frames: "50:c0"
5819369-5865082 cec: sections: "HDR: AudioSystem, TV | OPC: Invalid | R: ACK"
5879518-5884006 cec: st: "ST"
5884006-5886387 cec: bits: "0"
5886387-5888768 cec: bits: "0"
5888768-5891149 cec: bits: "0"
5891149-5893530 cec: bits: "0"
5893530-5895911 cec: bits: "0"
5895911-5898292 cec: bits: "1"
5898292-5900672 cec: bits: "0"
5900672-5903053 cec: bits: "1"
5884006-5903053 cec: bytes: "0x05"
5903053-5905434 cec: eom-0: "EOM=N"
5905434-5907815 cec: ack: "ACK"
5907815-5910196 cec: bits: "0"
5910196-5912577 cec: bits: "1"
5912577-5914958 cec: bits: "1"
5914958-5917339 cec: bits: "1"
5917339-5919720 cec: bits: "0"
5919720-5922101 cec: bits: "0"
5922101-5924482 cec: bits: "0"
5924482-5926863 cec: bits: "0"
5907815-5926863 cec: bytes: "0x70"
5926863-5929244 cec: eom-0: "EOM=N"
5929244-5931625 cec: ack: "ACK"
5931625-5934006 cec: bits: "0"
5934006-5936387 cec: bits: "0"
5936387-5938768 cec: bits: "1"
5938768-5941149 cec: bits: "1"
5941149-5943530 cec: bits: "0"
5943530-5945911 cec: bits: "0"
5945911-5948292 cec: bits: "0"
5948292-5950673 cec: bits: "0"
5931625-5950673 cec: bytes: "0x30"
5950673-5953054 cec: eom-0: "EOM=N"
5953054-5955435 cec: ack: "ACK"
5955435-5957816 cec: bits: "0"
5957816-5960197 cec: bits: "0"
5960197-5962578 cec: bits: "0"
5962578-5964959 cec: bits: "0"
5964959-5967340 cec: bits: "0"
5967340-5969721 cec: bits: "0"
5969721-5972102 cec: bits: "0"
5972102-5974483 cec: bits: "0"
5955435-5974483 cec: bytes: "0x00"
5974483-5976864 cec: eom-1: "EOM=Y"
5976864-5980964 cec: ack: "ACK"
5884006-5976864 cec: frames: "05:70:30:00"
5884006-5976864 cec: sections: "HDR: TV, AudioSystem | OPC: SYSTEM_AUDIO_MODE_REQUEST | OPS: 0x30, 0x00 | R: ACK"
5996125-6000612 cec: st: "ST"
6000612-6002993 cec: bits: "0"
6002993-6005374 cec: bits: "0"
6005374-6007755 cec: bits: "0"
6007755-6010136 cec: bits: "0"
6010136-6012517 cec: bits: "0"
6012517-6014898 cec: bits: "1"
6014898-6017279 cec: bits: "0"
6017279-6019660 cec: bits: "1"
6000612-6019660 cec: bytes: "0x05"
6019660-6022041 cec: eom-0: "EOM=N"
6022041-6024422 cec: ack: "ACK"
6024422-6026803 cec: bits: "1"
6026803-6029184 cec: bits: "1"
6029184-6031565 cec: bits: "0"
6031565-6033946 cec: bits: "0"
6033946-6036327 cec: bits: "0"
6036327-6038708 cec: bits: "0"
6038708-6041089 cec: bits: "0"
6041089-6043470 cec: bits: "1"
6024422-6043470 cec: bytes: "0xc1"
6043470-6045851 cec: eom-1: "EOM=Y"
6045851-6049951 cec: ack: "ACK"
6000612-6045851 cec: frames: "05:c1"
6000612-6045851 cec: sections: "HDR: TV, AudioSystem | OPC: Invalid | R: ACK"
6062926-6067432 cec: st: "ST"
6067432-6069838 cec: bits: "0"
6069838-6072244 cec: bits: "1"
6072244-6074650 cec: bits: "0"
6074650-6077056 cec: bits: "1"
6077056-6079462 cec: bits: "0"
6079462-6081868 cec: bits: "0"
6081868-6084274 cec: bits: "0"
6084274-6086680 cec: bits: "0"
6067432-6086680 cec: bytes: "0x50"
6086680-6089086 cec: eom-0: "EOM=N"
6089086-6091492 cec: ack: "ACK"
6091492-6093897 cec: bits: "0"
6093897-6096303 cec: bits: "1"
6096303-6098709 cec: bits: "0"
6098709-6101115 cec: bits: "0"
6101115-6103522 cec: bits: "0"
6103522-6105928 cec: bits: "1"
6105928-6108334 cec: bits: "1"
6108334-6110740 cec: bits: "1"
6091492-6110740 cec: bytes: "0x47"
6110740-6113146 cec: eom-0: "EOM=N"
6113146-6115552 cec: ack: "ACK"
6115552-6117958 cec: bits: "0"
6117958-6120363 cec: bits: "1"
6120363-6122769 cec: bits: "0"
6122769-6125175 cec: bits: "0"
6125175-6127581 cec: bits: "0"
6127581-6129987 cec: bits: "0"
6129987-6132393 cec: bits: "0"
6132393-6134799 cec: bits: "1"
6115552-6134799 cec: bytes: "0x41"
6134799-6137205 cec: eom-0: "EOM=N"
6137205-6139611 cec: ack: "ACK"
6139611-6142017 cec: bits: "0"
6142017-6144423 cec: bits: "1"
6144423-6146829 cec: bits: "0"
6146829-6149235 cec: bits: "1"
6149235-6151641 cec: bits: "0"
6151641-6154046 cec: bits: "1"
6154046-6156452 cec: bits: "1"
6156452-6158858 cec: bits: "0"
6139611-6158858 cec: bytes: "0x56"
6158858-6161264 cec: eom-0: "EOM=N"
6161264-6163670 cec: ack: "ACK"
6163670-6166076 cec: bits: "0"
6166076-6168482 cec: bits: "1"
6168482-6170888 cec: bits: "0"
6170888-6173294 cec: bits: "1"
6173294-6175700 cec: bits: "0"
6175700-6178106 cec: bits: "0"
6178106-6180512 cec: bits: "1"
6180512-6182918 cec: bits: "0"
6163670-6182918 cec: bytes: "0x52"
6182918-6185324 cec: eom-0: "EOM=N"
6185324-6187730 cec: ack: "ACK"
6187730-6190135 cec: bits: "0"
6190135-6192541 cec: bits: "0"
6192541-6194947 cec: bits: "1"
6194947-6197353 cec: bits: "0"
6197353-6199759 cec: bits: "1"
6199759-6202165 cec: bits: "1"
6202165-6204571 cec: bits: "0"
6204571-6206977 cec: bits: "1"
6187730-6206977 cec: bytes: "0x2d"
6206977-6209383 cec: eom-0: "EOM=N"
6209383-6211789 cec: ack: "ACK"
6211789-6214195 cec: bits: "0"
6214195-6216601 cec: bits: "1"
6216601-6219007 cec: bits: "0"
6219007-6221413 cec: bits: "1"
6221413-6223818 cec: bits: "1"
6223818-6226224 cec: bits: "0"
6226224-6228630 cec: bits: "0"
6228630-6231036 cec: bits: "0"
6211789-6231036 cec: bytes: "0x58"
6231036-6233442 cec: eom-0: "EOM=N"
6233442-6235848 cec: ack: "ACK"
6235848-6238254 cec: bits: "0"
6238254-6240660 cec: bits: "0"
6240660-6243066 cec: bits: "1"
6243066-6245472 cec: bits: "1"
6245472-6247878 cec: bits: "0"
6247878-6250284 cec: bits: "0"
6250284-6252690 cec: bits: "1"
6252690-6255096 cec: bits: "1"
6235848-6255096 cec: bytes: "0x33"
6255096-6257501 cec: eom-0: "EOM=N"
6257501-6259907 cec: ack: "ACK"
6259907-6262313 cec: bits: "0"
6262313-6264719 cec: bits: "0"
6264719-6267125 cec: bits: "1"
6267125-6269531 cec: bits: "1"
6269531-6271937 cec: bits: "0"
6271937-6274343 cec: bits: "0"
6274343-6276749 cec: bits: "1"
6276749-6279155 cec: bits: "1"
6259907-6279155 cec: bytes: "0x33"
6279155-6281561 cec: eom-0: "EOM=N"
6281561-6283967 cec: ack: "ACK"
6283967-6286373 cec: bits: "0"
6286373-6288779 cec: bits: "0"
6288779-6291184 cec: bits: "1"
6291184-6293590 cec: bits: "1"
6293590-6295996 cec: bits: "0"
6295996-6298402 cec: bits: "0"
6298402-6300808 cec: bits: "0"
6300808-6303214 cec: bits: "0"
6283967-6303214 cec: bytes: "0x30"
6303214-6305620 cec: eom-0: "EOM=N"
6305620-6308026 cec: ack: "ACK"
6308026-6310432 cec: bits: "0"
6310432-6312838 cec: bits: "0"
6312838-6315244 cec: bits: "1"
6315244-6317650 cec: bits: "1"
6317650-6320056 cec: bits: "0"
6320056-6322462 cec: bits: "0"
6322462-6324867 cec: bits: "0"
6324867-6327273 cec: bits: "0"
6308026-6327273 cec: bytes: "0x30"
6327273-6329679 cec: eom-0: "EOM=N"
6329679-6332085 cec: ack: "ACK"
6332085-6334491 cec: bits: "0"
6334491-6336897 cec: bits: "1"
6336897-6339303 cec: bits: "0"
6339303-6341709 cec: bits: "1"
6341709-6344115 cec: bits: "0"
6344115-6346521 cec: bits: "1"
6346521-6348927 cec: bits: "1"
6348927-6351333 cec: bits: "1"
6332085-6351333 cec: bytes: "0x57"
6351333-6353739 cec: eom-1: "EOM=Y"
6353739-6357839 cec: ack: "ACK"
6067432-6353739 cec: frames: "50:47:41:56:52:2d:58:33:33:30:30:57"
6067432-6353739 cec: sections: "HDR: AudioSystem, TV | OPC: SET_OSD_NAME | OPS: 0x41, 0x56, 0x52, 0x2d, 0x58, 0x33, 0x33, 0x30, 0x30, 0x57 | R: ACK"
6368167-6372654 cec: st: "ST"
6372654-6375035 cec: bits: "0"
6375035-6377416 cec: bits: "0"
6377416-6379797 cec: bits: "0"
6379797-6382178 cec: bits: "0"
6382178-6384559 cec: bits: "0"
6384559-6386940 cec: bits: "1"
6386940-6389321 cec: bits: "0"
6389321-6391702 cec: bits: "1"
6372654-6391702 cec: bytes: "0x05"
6391702-6394083 cec: eom-0: "EOM=N"
6394083-6396464 cec: ack: "ACK"
6396464-6398845 cec: bits: "1"
6398845-6401226 cec: bits: "0"
6401226-6403607 cec: bits: "0"
6403607-6405988 cec: bits: "0"
6405988-6408369 cec: bits: "1"
6408369-6410750 cec: bits: "1"
6410750-6413130 cec: bits: "0"
6413130-6415511 cec: bits: "0"
6396464-6415511 cec: bytes: "0x8c"
6415511-6417892 cec: eom-1: "EOM=Y"
6417892-6421992 cec: ack: "ACK"
6372654-6417892 cec: frames: "05:8c"
6372654-6417892 cec: sections: "HDR: TV, AudioSystem | OPC: GIVE_DEVICE_VENDOR_ID | R: ACK"
6460023-6464529 cec: st: "ST"
6464529-6466935 cec: bits: "0"
6466935-6469341 cec: bits: "1"
6469341-6471747 cec: bits: "0"
6471747-6474153 cec: bits: "1"
6474153-6476559 cec: bits: "0"
6476559-6478965 cec: bits: "0"
6478965-6481370 cec: bits: "0"
6481370-6483776 cec: bits: "0"
6464529-6483776 cec: bytes: "0x50"
6483776-6486182 cec: eom-0: "EOM=N"
6486182-6488588 cec: ack: "ACK"
6488588-6490994 cec: bits: "0"
6490994-6493400 cec: bits: "1"
6493400-6495806 cec: bits: "1"
6495806-6498212 cec: bits: "1"
6498212-6500618 cec: bits: "1"
6500618-6503024 cec: bits: "0"
6503024-6505430 cec: bits: "1"
6505430-6507836 cec: bits: "0"
6488588-6507836 cec: bytes: "0x7a"
6507836-6510242 cec: eom-0: "EOM=N"
6510242-6512648 cec: ack: "ACK"
6512648-6515053 cec: bits: "0"
6515053-6517459 cec: bits: "0"
6517459-6519865 cec: bits: "0"
6519865-6522271 cec: bits: "1"
6522271-6524677 cec: bits: "0"
6524677-6527083 cec: bits: "0"
6527083-6529489 cec: bits: "0"
6529489-6531895 cec: bits: "1"
6512648-6531895 cec: bytes: "0x11"
6531895-6534301 cec: eom-1: "EOM=Y"
6534301-6538401 cec: ack: "ACK"
6464529-6534301 cec: frames: "50:7a:11"
6464529-6534301 cec: sections: "HDR: AudioSystem, TV | OPC: REPORT_AUDIO_STATUS | OPS: 0x11 | R: ACK"
6571050-6575557 cec: st: "ST"
6575557-6577963 cec: bits: "0"
6577963-6580369 cec: bits: "1"
6580369-6582774 cec: bits: "0"
6582774-6585180 cec: bits: "1"
6585180-6587586 cec: bits: "1"
6587586-6589992 cec: bits: "1"
6589992-6592398 cec: bits: "1"
6592398-6594804 cec: bits: "1"
6575557-6594804 cec: bytes: "0x5f"
6594804-6597210 cec: eom-0: "EOM=N"
6597210-6599616 cec: ack: "ACK"
6599616-6602022 cec: bits: "0"
6602022-6604428 cec: bits: "1"
6604428-6606834 cec: bits: "1"
6606834-6609240 cec: bits: "1"
6609240-6611646 cec: bits: "0"
6611646-6614052 cec: bits: "0"
6614052-6616457 cec: bits: "1"
6616457-6618863 cec: bits: "0"
6599616-6618863 cec: bytes: "0x72"
6618863-6621269 cec: eom-0: "EOM=N"
6621269-6623675 cec: ack: "ACK"
6623675-6626081 cec: bits: "0"
6626081-6628487 cec: bits: "0"
6628487-6630893 cec: bits: "0"
6630893-6633299 cec: bits: "0"
6633299-6635705 cec: bits: "0"
6635705-6638111 cec: bits: "0"
6638111-6640517 cec: bits: "0"
6640517-6642923 cec: bits: "1"
6623675-6642923 cec: bytes: "0x01"
6642923-6645329 cec: eom-1: "EOM=Y"
6645329-6649429 cec: ack: "ACK"
6575557-6645329 cec: frames: "5f:72:01"
6575557-6645329 cec: sections: "HDR: AudioSystem, Broadcast | OPC: SET_SYSTEM_AUDIO_MODE | OPS: 0x01 | R: ACK"
6681078-6685584 cec: st: "ST"
6685584-6687990 cec: bits: "0"
6687990-6690396 cec: bits: "1"
6690396-6692802 cec: bits: "0"
6692802-6695208 cec: bits: "1"
6695208-6697614 cec: bits: "1"
6697614-6700020 cec: bits: "1"
6700020-6702426 cec: bits: "1"
6702426-6704832 cec: bits: "1"
6685584-6704832 cec: bytes: "0x5f"
6704832-6707238 cec: eom-0: "EOM=N"
6707238-6709643 cec: ack: "ACK"
6709643-6712049 cec: bits: "1"
6712049-6714455 cec: bits: "0"
6714455-6716861 cec: bits: "0"
6716861-6719267 cec: bits: "0"
6719267-6721673 cec: bits: "0"
6721673-6724079 cec: bits: "1"
6724079-6726485 cec: bits: "1"
6726485-6728891 cec: bits: "1"
6709643-6728891 cec: bytes: "0x87"
6728891-6731297 cec: eom-0: "EOM=N"
6731297-6733703 cec: ack: "ACK"
6733703-6736109 cec: bits: "0"
6736109-6738515 cec: bits: "0"
6738515-6740921 cec: bits: "0"
6740921-6743326 cec: bits: "0"
6743326-6745732 cec: bits: "0"
6745732-6748138 cec: bits: "0"
6748138-6750544 cec: bits: "0"
6750544-6752950 cec: bits: "0"
6733703-6752950 cec: bytes: "0x00"
6752950-6755356 cec: eom-0: "EOM=N"
6755356-6757762 cec: ack: "ACK"
6757762-6760168 cec: bits: "0"
6760168-6762574 cec: bits: "0"
6762574-6764980 cec: bits: "0"
6764980-6767386 cec: bits: "0"
6767386-6769792 cec: bits: "0"
6769792-6772198 cec: bits: "1"
6772198-6774604 cec: bits: "0"
6774604-6777009 cec: bits: "1"
6757762-6777009 cec: bytes: "0x05"
6777009-6779415 cec: eom-0: "EOM=N"
6779415-6781821 cec: ack: "ACK"
6781821-6784227 cec: bits: "1"
6784227-6786633 cec: bits: "1"
6786633-6789039 cec: bits: "0"
6789039-6791445 cec: bits: "0"
6791445-6793851 cec: bits: "1"
6793851-6796257 cec: bits: "1"
6796257-6798663 cec: bits: "0"
6798663-6801070 cec: bits: "1"
6781821-6801070 cec: bytes: "0xcd"
6801070-6803476 cec: eom-1: "EOM=Y"
6803476-6807576 cec: ack: "ACK"
6685584-6803476 cec: frames: "5f:87:00:05:cd"
6685584-6803476 cec: sections: "HDR: AudioSystem, Broadcast | OPC: DEVICE_VENDOR_ID | OPS: 0x00, 0x05, 0xcd | R: ACK"
6839116-6843623 cec: st: "ST"
6843623-6846029 cec: bits: "0"
6846029-6848435 cec: bits: "1"
6848435-6850841 cec: bits: "0"
6850841-6853246 cec: bits: "1"
6853246-6855652 cec: bits: "0"
6855652-6858058 cec: bits: "1"
6858058-6860464 cec: bits: "0"
6860464-6862870 cec: bits: "1"
6843623-6862870 cec: bytes: "0x55"
6862870-6865276 cec: eom-1: "EOM=Y"
6865276-6869376 cec: nack: "NACK"
6843623-6865276 cec: frames: "55"
6843623-6865276 cec: sections: "HDR: AudioSystem, AudioSystem | OPC: PING | R: NACK"
6909134-6913640 cec: st: "ST"
6913640-6916046 cec: bits: "0"
6916046-6918452 cec: bits: "1"
6918452-6920858 cec: bits: "0"
6920858-6923264 cec: bits: "1"
6923264-6925670 cec: bits: "0"
6925670-6928076 cec: bits: "0"
6928076-6930482 cec: bits: "0"
6930482-6932888 cec: bits: "0"
6913640-6932888 cec: bytes: "0x50"
6932888-6935293 cec: eom-0: "EOM=N"
6935293-6937699 cec: ack: "ACK"
6937699-6940105 cec: bits: "1"
6940105-6942511 cec: bits: "0"
6942511-6944917 cec: bits: "0"
6944917-6947323 cec: bits: "0"
6947323-6949729 cec: bits: "1"
6949729-6952135 cec: bits: "1"
6952135-6954541 cec: bits: "0"
6954541-6956947 cec: bits: "0"
6937699-6956947 cec: bytes: "0x8c"
6956947-6959353 cec: eom-1: "EOM=Y"
6959353-6963453 cec: ack: "ACK"
6913640-6959353 cec: frames: "50:8c"
6913640-6959353 cec: sections: "HDR: AudioSystem, TV | OPC: GIVE_DEVICE_VENDOR_ID | R: ACK"
6973788-6978275 cec: st: "ST"
6978275-6980656 cec: bits: "0"
6980656-6983037 cec: bits: "0"
6983037-6985418 cec: bits: "0"
6985418-6987799 cec: bits: "0"
6987799-6990180 cec: bits: "1"
6990180-6992561 cec: bits: "1"
6992561-6994942 cec: bits: "1"
6994942-6997323 cec: bits: "1"
6978275-6997323 cec: bytes: "0x0f"
6997323-6999704 cec: eom-0: "EOM=N"
6999704-7002085 cec: ack: "ACK"
7002085-7004466 cec: bits: "1"
7004466-7006847 cec: bits: "0"
7006847-7009228 cec: bits: "0"
7009228-7011609 cec: bits: "0"
7011609-7013990 cec: bits: "0"
7013990-7016371 cec: bits: "1"
7016371-7018752 cec: bits: "1"
7018752-7021133 cec: bits: "1"
7002085-7021133 cec: bytes: "0x87"
7021133-7023513 cec: eom-0: "EOM=N"
7023513-7025894 cec: ack: "ACK"
7025894-7028275 cec: bits: "0"
7028275-7030656 cec: bits: "0"
7030656-7033037 cec: bits: "0"
7033037-7035418 cec: bits: "0"
7035418-7037799 cec: bits: "1"
7037799-7040180 cec: bits: "0"
7040180-7042561 cec: bits: "0"
7042561-7044942 cec: bits: "0"
7025894-7044942 cec: bytes: "0x08"
7044942-7047323 cec: eom-0: "EOM=N"
7047323-7049704 cec: ack: "ACK"
7049704-7052085 cec: bits: "0"
7052085-7054466 cec: bits: "0"
7054466-7056847 cec: bits: "0"
7056847-7059228 cec: bits: "0"
7059228-7061609 cec: bits: "0"
7061609-7063990 cec: bits: "0"
7063990-7066371 cec: bits: "0"
7066371-7068752 cec: bits: "0"
7049704-7068752 cec: bytes: "0x00"
7068752-7071133 cec: eom-0: "EOM=N"
7071133-7073514 cec: ack: "ACK"
7073514-7075895 cec: bits: "0"
7075895-7078276 cec: bits: "1"
7078276-7080657 cec: bits: "0"
7080657-7083038 cec: bits: "0"
7083038-7085419 cec: bits: "0"
7085419-7087800 cec: bits: "1"
7087800-7090181 cec: bits: "1"
7090181-7092562 cec: bits: "0"
7073514-7092562 cec: bytes: "0x46"
7092562-7094943 cec: eom-1: "EOM=Y"
7094943-7099043 cec: ack: "ACK"
6978275-7094943 cec: frames: "0f:87:08:00:46"
6978275-7094943 cec: sections: "HDR: TV, Broadcast | OPC: DEVICE_VENDOR_ID | OPS: 0x08, 0x00, 0x46 | R: ACK"
7141191-7145698 cec: st: "ST"
7145698-7148103 cec: bits: "0"
7148103-7150509 cec: bits: "1"
7150509-7152915 cec: bits: "0"
7152915-7155321 cec: bits: "1"
7155321-7157727 cec: bits: "0"
7157727-7160133 cec: bits: "0"
7160133-7162539 cec: bits: "0"
7162539-7164945 cec: bits: "0"
7145698-7164945 cec: bytes: "0x50"
7164945-7167351 cec: eom-0: "EOM=N"
7167351-7169757 cec: ack: "ACK"
7169757-7172163 cec: bits: "1"
7172163-7174569 cec: bits: "0"
7174569-7176975 cec: bits: "0"
7176975-7179381 cec: bits: "1"
7179381-7181786 cec: bits: "1"
7181786-7184192 cec: bits: "1"
7184192-7186598 cec: bits: "1"
7186598-7189004 cec: bits: "1"
7169757-7189004 cec: bytes: "0x9f"
7189004-7191410 cec: eom-1: "EOM=Y"
7191410-7195510 cec: ack: "ACK"
7145698-7191410 cec: frames: "50:9f"
7145698-7191410 cec: sections: "HDR: AudioSystem, TV | OPC: GET_CEC_VERSION | R: ACK"
7205841-7210328 cec: st: "ST"
7210328-7212709 cec: bits: "0"
7212709-7215090 cec: bits: "0"
7215090-7217471 cec: bits: "0"
7217471-7219852 cec: bits: "0"
7219852-7222233 cec: bits: "0"
7222233-7224614 cec: bits: "1"
7224614-7226995 cec: bits: "0"
7226995-7229376 cec: bits: "1"
7210328-7229376 cec: bytes: "0x05"
7229376-7231757 cec: eom-0: "EOM=N"
7231757-7234138 cec: ack: "ACK"
7234138-7236519 cec: bits: "1"
7236519-7238900 cec: bits: "0"
7238900-7241281 cec: bits: "0"
7241281-7243662 cec: bits: "1"
7243662-7246043 cec: bits: "1"
7246043-7248424 cec: bits: "1"
7248424-7250805 cec: bits: "1"
7250805-7253186 cec: bits: "0"
7234138-7253186 cec: bytes: "0x9e"
7253186-7255566 cec: eom-0: "EOM=N"
7255566-7257947 cec: ack: "ACK"
7257947-7260328 cec: bits: "0"
7260328-7262709 cec: bits: "0"
7262709-7265090 cec: bits: "0"
7265090-7267471 cec: bits: "0"
7267471-7269852 cec: bits: "0"
7269852-7272233 cec: bits: "1"
7272233-7274614 cec: bits: "0"
7274614-7276995 cec: bits: "1"
7257947-7276995 cec: bytes: "0x05"
7276995-7279376 cec: eom-1: "EOM=Y"
7279376-7283476 cec: ack: "ACK"
7210328-7279376 cec: frames: "05:9e:05"
7210328-7279376 cec: sections: "HDR: TV, AudioSystem | OPC: CEC_VERSION | OPS: 0x05 | R: ACK"
7334239-7338745 cec: st: "ST"
7338745-7341151 cec: bits: "0"
7341151-7343557 cec: bits: "1"
7343557-7345963 cec: bits: "0"
7345963-7348369 cec: bits: "1"
7348369-7350775 cec: bits: "0"
7350775-7353181 cec: bits: "1"
7353181-7355587 cec: bits: "0"
7355587-7357993 cec: bits: "0"
7338745-7357993 cec: bytes: "0x54"
7357993-7360399 cec: eom-0: "EOM=N"
7360399-7364499 cec: nack: "NACK"
7338745-7360399 cec: frames: "54"
7338745-7360399 cec: sections: "HDR: AudioSystem, Playback_1 | OPC: NONE. Aborted cmd | R: NACK"
7390253-7394759 cec: st: "ST"
7394759-7397165 cec: bits: "0"
7397165-7399571 cec: bits: "1"
7399571-7401977 cec: bits: "0"
7401977-7404383 cec: bits: "1"
7404383-7406789 cec: bits: "0"
7406789-7409195 cec: bits: "1"
7409195-7411601 cec: bits: "0"
7411601-7414007 cec: bits: "0"
7394759-7414007 cec: bytes: "0x54"
7414007-7416413 cec: eom-0: "EOM=N"
7416413-7420513 cec: nack: "NACK"
7394759-7416413 cec: frames: "54"
7394759-7416413 cec: sections: "HDR: AudioSystem, Playback_1 | OPC: NONE. Aborted cmd | R: NACK"
7456272-7460778 cec: st: "ST"
7460778-7463184 cec: bits: "0"
7463184-7465590 cec: bits: "1"
7465590-7467996 cec: bits: "0"
7467996-7470402 cec: bits: "1"
7470402-7472808 cec: bits: "1"
7472808-7475214 cec: bits: "0"
7475214-7477619 cec: bits: "0"
7477619-7480025 cec: bits: "0"
7460778-7480025 cec: bytes: "0x58"
7480025-7482431 cec: eom-0: "EOM=N"
7482431-7486531 cec: nack: "NACK"
7460778-7482431 cec: frames: "58"
7460778-7482431 cec: sections: "HDR: AudioSystem, Playback_2 | OPC: NONE. Aborted cmd | R: NACK"
7512283-7516789 cec: st: "ST"
7516789-7519195 cec: bits: "0"
7519195-7521601 cec: bits: "1"
7521601-7524007 cec: bits: "0"
7524007-7526413 cec: bits: "1"
7526413-7528819 cec: bits: "1"
7528819-7531225 cec: bits: "0"
7531225-7533631 cec: bits: "0"
7533631-7536037 cec: bits: "0"
7516789-7536037 cec: bytes: "0x58"
7536037-7538443 cec: eom-0: "EOM=N"
7538443-7542543 cec: nack: "NACK"
7516789-7538443 cec: frames: "58"
7516789-7538443 cec: sections: "HDR: AudioSystem, Playback_2 | OPC: NONE. Aborted cmd | R: NACK"
7578302-7582809 cec: st: "ST"
7582809-7585215 cec: bits: "0"
7585215-7587621 cec: bits: "1"
7587621-7590026 cec: bits: "0"
7590026-7592432 cec: bits: "1"
7592432-7594838 cec: bits: "1"
7594838-7597244 cec: bits: "0"
7597244-7599650 cec: bits: "1"
7599650-7602056 cec: bits: "1"
7582809-7602056 cec: bytes: "0x5b"
7602056-7604462 cec: eom-0: "EOM=N"
7604462-7608562 cec: nack: "NACK"
7582809-7604462 cec: frames: "5b"
7582809-7604462 cec: sections: "HDR: AudioSystem, Playback_3 | OPC: NONE. Aborted cmd | R: NACK"
7634313-7638820 cec: st: "ST"
7638820-7641226 cec: bits: "0"
7641226-7643631 cec: bits: "1"
7643631-7646037 cec: bits: "0"
7646037-7648443 cec: bits: "1"
7648443-7650849 cec: bits: "1"
7650849-7653255 cec: bits: "0"
7653255-7655661 cec: bits: "1"
7655661-7658067 cec: bits: "1"
7638820-7658067 cec: bytes: "0x5b"
7658067-7660473 cec: eom-0: "EOM=N"
7660473-7664573 cec: nack: "NACK"
7638820-7660473 cec: frames: "5b"
7638820-7660473 cec: sections: "HDR: AudioSystem, Playback_3 | OPC: NONE. Aborted cmd | R: NACK"
7700330-7704836 cec: st: "ST"
7704836-7707242 cec: bits: "0"
7707242-7709648 cec: bits: "1"
7709648-7712054 cec: bits: "0"
7712054-7714460 cec: bits: "1"
7714460-7716866 cec: bits: "0"
7716866-7719272 cec: bits: "0"
7719272-7721677 cec: bits: "0"
7721677-7724083 cec: bits: "1"
7704836-7724083 cec: bytes: "0x51"
7724083-7726489 cec: eom-0: "EOM=N"
7726489-7730589 cec: nack: "NACK"
7704836-7726489 cec: frames: "51"
7704836-7726489 cec: sections: "HDR: AudioSystem, Recording_1 | OPC: NONE. Aborted cmd | R: NACK"
7756344-7760850 cec: st: "ST"
7760850-7763256 cec: bits: "0"
7763256-7765662 cec: bits: "1"
7765662-7768068 cec: bits: "0"
7768068-7770474 cec: bits: "1"
7770474-7772879 cec: bits: "0"
7772879-7775285 cec: bits: "0"
7775285-7777691 cec: bits: "0"
7777691-7780097 cec: bits: "1"
7760850-7780097 cec: bytes: "0x51"
7780097-7782503 cec: eom-0: "EOM=N"
7782503-7786603 cec: nack: "NACK"
7760850-7782503 cec: frames: "51"
7760850-7782503 cec: sections: "HDR: AudioSystem, Recording_1 | OPC: NONE. Aborted cmd | R: NACK"
7822362-7826868 cec: st: "ST"
7826868-7829274 cec: bits: "0"
7829274-7831680 cec: bits: "1"
7831680-7834086 cec: bits: "0"
7834086-7836492 cec: bits: "1"
7836492-7838898 cec: bits: "0"
7838898-7841304 cec: bits: "0"
7841304-7843710 cec: bits: "1"
7843710-7846116 cec: bits: "0"
7826868-7846116 cec: bytes: "0x52"
7846116-7848522 cec: eom-0: "EOM=N"
7848522-7852622 cec: nack: "NACK"
7826868-7848522 cec: frames: "52"
7826868-7848522 cec: sections: "HDR: AudioSystem, Recording_2 | OPC: NONE. Aborted cmd | R: NACK"
7878374-7882880 cec: st: "ST"
7882880-7885286 cec: bits: "0"
7885286-7887692 cec: bits: "1"
7887692-7890098 cec: bits: "0"
7890098-7892504 cec: bits: "1"
7892504-7894910 cec: bits: "0"
7894910-7897316 cec: bits: "0"
7897316-7899722 cec: bits: "1"
7899722-7902128 cec: bits: "0"
7882880-7902128 cec: bytes: "0x52"
7902128-7904534 cec: eom-0: "EOM=N"
7904534-7908634 cec: nack: "NACK"
7882880-7904534 cec: frames: "52"
7882880-7904534 cec: sections: "HDR: AudioSystem, Recording_2 | OPC: NONE. Aborted cmd | R: NACK"
7944393-7948899 cec: st: "ST"
7948899-7951305 cec: bits: "0"
7951305-7953711 cec: bits: "1"
7953711-7956117 cec: bits: "0"
7956117-7958523 cec: bits: "1"
7958523-7960929 cec: bits: "1"
7960929-7963335 cec: bits: "0"
7963335-7965741 cec: bits: "0"
7965741-7968147 cec: bits: "1"
7948899-7968147 cec: bytes: "0x59"
7968147-7970553 cec: eom-0: "EOM=N"
7970553-7974653 cec: nack: "NACK"
7948899-7970553 cec: frames: "59"
7948899-7970553 cec: sections: "HDR: AudioSystem, Recording_3 | OPC: NONE. Aborted cmd | R: NACK"
8000404-8004910 cec: st: "ST"
8004910-8007316 cec: bits: "0"
8007316-8009722 cec: bits: "1"
8009722-8012128 cec: bits: "0"
8012128-8014534 cec: bits: "1"
8014534-8016940 cec: bits: "1"
8016940-8019346 cec: bits: "0"
8019346-8021752 cec: bits: "0"
8021752-8024158 cec: bits: "1"
8004910-8024158 cec: bytes: "0x59"
8024158-8026564 cec: eom-0: "EOM=N"
8026564-8030664 cec: nack: "NACK"
8004910-8026564 cec: frames: "59"
8004910-8026564 cec: sections: "HDR: AudioSystem, Recording_3 | OPC: NONE. Aborted cmd | R: NACK"
8066421-8070927 cec: st: "ST"
8070927-8073333 cec: bits: "0"
8073333-8075739 cec: bits: "1"
8075739-8078145 cec: bits: "0"
8078145-8080551 cec: bits: "1"
8080551-8082957 cec: bits: "1"
8082957-8085363 cec: bits: "1"
8085363-8087769 cec: bits: "1"
8087769-8090175 cec: bits: "1"
8070927-8090175 cec: bytes: "0x5f"
8090175-8092580 cec: eom-0: "EOM=N"
8092580-8094986 cec: ack: "ACK"
8094986-8097392 cec: bits: "1"
8097392-8099798 cec: bits: "0"
8099798-8102204 cec: bits: "0"
8102204-8104610 cec: bits: "0"
8104610-8107016 cec: bits: "0"
8107016-8109422 cec: bits: "1"
8109422-8111828 cec: bits: "0"
8111828-8114234 cec: bits: "0"
8094986-8114234 cec: bytes: "0x84"
8114234-8116640 cec: eom-0: "EOM=N"
8116640-8119046 cec: ack: "ACK"
8119046-8121452 cec: bits: "0"
8121452-8123858 cec: bits: "0"
8123858-8126264 cec: bits: "0"
8126264-8128670 cec: bits: "1"
8128670-8131076 cec: bits: "0"
8131076-8133482 cec: bits: "0"
8133482-8135888 cec: bits: "0"
8135888-8138294 cec: bits: "0"
8119046-8138294 cec: bytes: "0x10"
8138294-8140700 cec: eom-0: "EOM=N"
8140700-8143106 cec: ack: "ACK"
8143106-8145512 cec: bits: "0"
8145512-8147918 cec: bits: "0"
8147918-8150325 cec: bits: "0"
8150325-8152731 cec: bits: "0"
8152731-8155136 cec: bits: "0"
8155136-8157542 cec: bits: "0"
8157542-8159948 cec: bits: "0"
8159948-8162354 cec: bits: "0"
8143106-8162354 cec: bytes: "0x00"
8162354-8164760 cec: eom-0: "EOM=N"
8164760-8167166 cec: ack: "ACK"
8167166-8169572 cec: bits: "0"
8169572-8171978 cec: bits: "0"
8171978-8174384 cec: bits: "0"
8174384-8176790 cec: bits: "0"
8176790-8179196 cec: bits: "0"
8179196-8181602 cec: bits: "1"
8181602-8184008 cec: bits: "0"
8184008-8186414 cec: bits: "1"
8167166-8186414 cec: bytes: "0x05"
8186414-8188820 cec: eom-1: "EOM=Y"
8188820-8192920 cec: ack: "ACK"
8070927-8188820 cec: frames: "5f:84:10:00:05"
8070927-8188820 cec: sections: "HDR: AudioSystem, Broadcast | OPC: REPORT_PHYSICAL_ADDRESS | OPS: 0x10, 0x00, 0x05 | R: ACK"
8203254-8207741 cec: st: "ST"
8207741-8210122 cec: bits: "0"
8210122-8212503 cec: bits: "0"
8212503-8214884 cec: bits: "0"
8214884-8217265 cec: bits: "0"
8217265-8219646 cec: bits: "0"
8219646-8222027 cec: bits: "1"
8222027-8224408 cec: bits: "0"
8224408-8226789 cec: bits: "1"
8207741-8226789 cec: bytes: "0x05"
8226789-8229170 cec: eom-0: "EOM=N"
8229170-8231550 cec: ack: "ACK"
8231550-8233931 cec: bits: "0"
8233931-8236312 cec: bits: "1"
8236312-8238693 cec: bits: "0"
8238693-8241074 cec: bits: "0"
8241074-8243455 cec: bits: "0"
8243455-8245836 cec: bits: "1"
8245836-8248217 cec: bits: "1"
8248217-8250598 cec: bits: "0"
8231550-8250598 cec: bytes: "0x46"
8250598-8252979 cec: eom-1: "EOM=Y"
8252979-8257079 cec: ack: "ACK"
8207741-8252979 cec: frames: "05:46"
8207741-8252979 cec: sections: "HDR: TV, AudioSystem | OPC: GIVE_OSD_NAME | R: ACK"
8272241-8276728 cec: st: "ST"
8276728-8279109 cec: bits: "0"
8279109-8281490 cec: bits: "0"
8281490-8283871 cec: bits: "0"
8283871-8286252 cec: bits: "0"
8286252-8288633 cec: bits: "0"
8288633-8291014 cec: bits: "1"
8291014-8293395 cec: bits: "0"
8293395-8295776 cec: bits: "1"
8276728-8295776 cec: bytes: "0x05"
8295776-8298157 cec: eom-0: "EOM=N"
8298157-8300538 cec: ack: "ACK"
8300538-8302919 cec: bits: "1"
8302919-8305300 cec: bits: "0"
8305300-8307680 cec: bits: "0"
8307680-8310061 cec: bits: "0"
8310061-8312442 cec: bits: "1"
8312442-8314823 cec: bits: "1"
8314823-8317204 cec: bits: "0"
8317204-8319585 cec: bits: "0"
8300538-8319585 cec: bytes: "0x8c"
8319585-8321966 cec: eom-1: "EOM=Y"
8321966-8326066 cec: ack: "ACK"
8276728-8321966 cec: frames: "05:8c"
8276728-8321966 cec: sections: "HDR: TV, AudioSystem | OPC: GIVE_DEVICE_VENDOR_ID | R: ACK"
8339488-8343995 cec: st: "ST"
8343995-8346401 cec: bits: "0"
8346401-8348807 cec: bits: "1"
8348807-8351212 cec: bits: "0"
8351212-8353619 cec: bits: "1"
8353619-8356025 cec: bits: "1"
8356025-8358431 cec: bits: "1"
8358431-8360836 cec: bits: "1"
8360836-8363242 cec: bits: "1"
8343995-8363242 cec: bytes: "0x5f"
8363242-8365648 cec: eom-0: "EOM=N"
8365648-8368054 cec: ack: "ACK"
8368054-8370460 cec: bits: "1"
8370460-8372866 cec: bits: "0"
8372866-8375272 cec: bits: "0"
8375272-8377678 cec: bits: "0"
8377678-8380084 cec: bits: "0"
8380084-8382490 cec: bits: "1"
8382490-8384896 cec: bits: "1"
8384896-8387302 cec: bits: "1"
8368054-8387302 cec: bytes: "0x87"
8387302-8389708 cec: eom-0: "EOM=N"
8389708-8392114 cec: ack: "ACK"
8392114-8394519 cec: bits: "0"
8394519-8396925 cec: bits: "0"
8396925-8399331 cec: bits: "0"
8399331-8401737 cec: bits: "0"
8401737-8404143 cec: bits: "0"
8404143-8406549 cec: bits: "0"
8406549-8408955 cec: bits: "0"
8408955-8411361 cec: bits: "0"
8392114-8411361 cec: bytes: "0x00"
8411361-8413767 cec: eom-0: "EOM=N"
8413767-8416173 cec: ack: "ACK"
8416173-8418579 cec: bits: "0"
8418579-8420985 cec: bits: "0"
8420985-8423391 cec: bits: "0"
8423391-8425797 cec: bits: "0"
8425797-8428202 cec: bits: "0"
8428202-8430608 cec: bits: "1"
8430608-8433014 cec: bits: "0"
8433014-8435420 cec: bits: "1"
8416173-8435420 cec: bytes: "0x05"
8435420-8437826 cec: eom-0: "EOM=N"
8437826-8440232 cec: ack: "ACK"
8440232-8442638 cec: bits: "1"
8442638-8445044 cec: bits: "1"
8445044-8447450 cec: bits: "0"
8447450-8449856 cec: bits: "0"
8449856-8452262 cec: bits: "1"
8452262-8454668 cec: bits: "1"
8454668-8457074 cec: bits: "0"
8457074-8459481 cec: bits: "1"
8440232-8459481 cec: bytes: "0xcd"
8459481-8461887 cec: eom-1: "EOM=Y"
8461887-8465987 cec: ack: "ACK"
8343995-8461887 cec: frames: "5f:87:00:05:cd"
8343995-8461887 cec: sections: "HDR: AudioSystem, Broadcast | OPC: DEVICE_VENDOR_ID | OPS: 0x00, 0x05, 0xcd | R: ACK"
8497527-8502034 cec: st: "ST"
8502034-8504439 cec: bits: "0"
8504439-8506845 cec: bits: "1"
8506845-8509251 cec: bits: "0"
8509251-8511657 cec: bits: "1"
8511657-8514063 cec: bits: "1"
8514063-8516469 cec: bits: "1"
8516469-8518875 cec: bits: "1"
8518875-8521281 cec: bits: "1"
8502034-8521281 cec: bytes: "0x5f"
8521281-8523687 cec: eom-0: "EOM=N"
8523687-8526093 cec: ack: "ACK"
8526093-8528499 cec: bits: "1"
8528499-8530905 cec: bits: "0"
8530905-8533311 cec: bits: "1"
8533311-8535717 cec: bits: "0"
8535717-8538122 cec: bits: "0"
8538122-8540528 cec: bits: "1"
8540528-8542934 cec: bits: "1"
8542934-8545340 cec: bits: "1"
8526093-8545340 cec: bytes: "0xa7"
8545340-8547746 cec: eom-0: "EOM=N"
8547746-8550152 cec: ack: "ACK"
8550152-8552558 cec: bits: "0"
8552558-8554964 cec: bits: "0"
8554964-8557370 cec: bits: "0"
8557370-8559776 cec: bits: "0"
8559776-8562182 cec: bits: "0"
8562182-8564588 cec: bits: "0"
8564588-8566994 cec: bits: "0"
8566994-8569400 cec: bits: "0"
8550152-8569400 cec: bytes: "0x00"
8569400-8571805 cec: eom-0: "EOM=N"
8571805-8574211 cec: ack: "ACK"
8574211-8576617 cec: bits: "0"
8576617-8579023 cec: bits: "0"
8579023-8581429 cec: bits: "0"
8581429-8583835 cec: bits: "0"
8583835-8586241 cec: bits: "0"
8586241-8588647 cec: bits: "0"
8588647-8591053 cec: bits: "0"
8591053-8593459 cec: bits: "0"
8574211-8593459 cec: bytes: "0x00"
8593459-8595865 cec: eom-1: "EOM=Y"
8595865-8599965 cec: ack: "ACK"
8502034-8595865 cec: frames: "5f:a7:00:00"
8502034-8595865 cec: sections: "HDR: AudioSystem, Broadcast | OPC: Invalid | OPS: 0x00, 0x00 | R: ACK"
8631560-8636066 cec: st: "ST"
8636066-8638472 cec: bits: "0"
8638472-8640878 cec: bits: "1"
8640878-8643284 cec: bits: "0"
8643284-8645690 cec: bits: "1"
8645690-8648096 cec: bits: "1"
8648096-8650502 cec: bits: "1"
8650502-8652908 cec: bits: "1"
8652908-8655314 cec: bits: "1"
8636066-8655314 cec: bytes: "0x5f"
8655314-8657720 cec: eom-0: "EOM=N"
8657720-8660126 cec: ack: "ACK"
8660126-8662532 cec: bits: "1"
8662532-8664938 cec: bits: "0"
8664938-8667344 cec: bits: "0"
8667344-8669749 cec: bits: "0"
8669749-8672155 cec: bits: "0"
8672155-8674561 cec: bits: "1"
8674561-8676967 cec: bits: "0"
8676967-8679373 cec: bits: "1"
8660126-8679373 cec: bytes: "0x85"
8679373-8681779 cec: eom-1: "EOM=Y"
8681779-8685879 cec: ack: "ACK"
8636066-8681779 cec: frames: "5f:85"
8636066-8681779 cec: sections: "HDR: AudioSystem, Broadcast | OPC: REQUEST_ACTIVE_SOURCE | R: ACK"
8717583-8722089 cec: st: "ST"
8722089-8724495 cec: bits: "0"
8724495-8726901 cec: bits: "1"
8726901-8729307 cec: bits: "0"
8729307-8731713 cec: bits: "1"
8731713-8734119 cec: bits: "0"
8734119-8736525 cec: bits: "0"
8736525-8738931 cec: bits: "0"
8738931-8741337 cec: bits: "0"
8722089-8741337 cec: bytes: "0x50"
8741337-8743743 cec: eom-0: "EOM=N"
8743743-8746149 cec: ack: "ACK"
8746149-8748555 cec: bits: "0"
8748555-8750960 cec: bits: "1"
8750960-8753366 cec: bits: "0"
8753366-8755772 cec: bits: "0"
8755772-8758178 cec: bits: "0"
8758178-8760584 cec: bits: "1"
8760584-8762990 cec: bits: "1"
8762990-8765396 cec: bits: "1"
8746149-8765396 cec: bytes: "0x47"
8765396-8767802 cec: eom-0: "EOM=N"
8767802-8770208 cec: ack: "ACK"
8770208-8772614 cec: bits: "0"
8772614-8775020 cec: bits: "1"
8775020-8777426 cec: bits: "0"
8777426-8779832 cec: bits: "0"
8779832-8782238 cec: bits: "0"
8782238-8784643 cec: bits: "0"
8784643-8787049 cec: bits: "0"
8787049-8789455 cec: bits: "1"
8770208-8789455 cec: bytes: "0x41"
8789455-8791861 cec: eom-0: "EOM=N"
8791861-8794267 cec: ack: "ACK"
8794267-8796673 cec: bits: "0"
8796673-8799079 cec: bits: "1"
8799079-8801485 cec: bits: "0"
8801485-8803891 cec: bits: "1"
8803891-8806297 cec: bits: "0"
8806297-8808703 cec: bits: "1"
8808703-8811109 cec: bits: "1"
8811109-8813515 cec: bits: "0"
8794267-8813515 cec: bytes: "0x56"
8813515-8815921 cec: eom-0: "EOM=N"
8815921-8818326 cec: ack: "ACK"
8818326-8820732 cec: bits: "0"
8820732-8823138 cec: bits: "1"
8823138-8825544 cec: bits: "0"
8825544-8827950 cec: bits: "1"
8827950-8830356 cec: bits: "0"
8830356-8832762 cec: bits: "0"
8832762-8835168 cec: bits: "1"
8835168-8837574 cec: bits: "0"
8818326-8837574 cec: bytes: "0x52"
8837574-8839980 cec: eom-0: "EOM=N"
8839980-8842386 cec: ack: "ACK"
8842386-8844792 cec: bits: "0"
8844792-8847198 cec: bits: "0"
8847198-8849604 cec: bits: "1"
8849604-8852010 cec: bits: "0"
8852010-8854416 cec: bits: "1"
8854416-8856822 cec: bits: "1"
8856822-8859228 cec: bits: "0"
8859228-8861633 cec: bits: "1"
8842386-8861633 cec: bytes: "0x2d"
8861633-8864039 cec: eom-0: "EOM=N"
8864039-8866445 cec: ack: "ACK"
8866445-8868851 cec: bits: "0"
8868851-8871257 cec: bits: "1"
8871257-8873663 cec: bits: "0"
8873663-8876069 cec: bits: "1"
8876069-8878475 cec: bits: "1"
8878475-8880881 cec: bits: "0"
8880881-8883287 cec: bits: "0"
8883287-8885693 cec: bits: "0"
8866445-8885693 cec: bytes: "0x58"
8885693-8888099 cec: eom-0: "EOM=N"
8888099-8890505 cec: ack: "ACK"
8890505-8892911 cec: bits: "0"
8892911-8895316 cec: bits: "0"
8895316-8897722 cec: bits: "1"
8897722-8900128 cec: bits: "1"
8900128-8902534 cec: bits: "0"
8902534-8904940 cec: bits: "0"
8904940-8907346 cec: bits: "1"
8907346-8909752 cec: bits: "1"
8890505-8909752 cec: bytes: "0x33"
8909752-8912158 cec: eom-0: "EOM=N"
8912158-8914564 cec: ack: "ACK"
8914564-8916970 cec: bits: "0"
8916970-8919376 cec: bits: "0"
8919376-8921782 cec: bits: "1"
8921782-8924188 cec: bits: "1"
8924188-8926594 cec: bits: "0"
8926594-8928999 cec: bits: "0"
8928999-8931405 cec: bits: "1"
8931405-8933811 cec: bits: "1"
8914564-8933811 cec: bytes: "0x33"
8933811-8936217 cec: eom-0: "EOM=N"
8936217-8938623 cec: ack: "ACK"
8938623-8941029 cec: bits: "0"
8941029-8943435 cec: bits: "0"
8943435-8945841 cec: bits: "1"
8945841-8948247 cec: bits: "1"
8948247-8950653 cec: bits: "0"
8950653-8953059 cec: bits: "0"
8953059-8955465 cec: bits: "0"
8955465-8957871 cec: bits: "0"
8938623-8957871 cec: bytes: "0x30"
8957871-8960277 cec: eom-0: "EOM=N"
8960277-8962682 cec: ack: "ACK"
8962682-8965088 cec: bits: "0"
8965088-8967494 cec: bits: "0"
8967494-8969900 cec: bits: "1"
8969900-8972306 cec: bits: "1"
8972306-8974712 cec: bits: "0"
8974712-8977118 cec: bits: "0"
8977118-8979524 cec: bits: "0"
8979524-8981930 cec: bits: "0"
8962682-8981930 cec: bytes: "0x30"
8981930-8984336 cec: eom-0: "EOM=N"
8984336-8986742 cec: ack: "ACK"
8986742-8989148 cec: bits: "0"
8989148-8991554 cec: bits: "1"
8991554-8993960 cec: bits: "0"
8993960-8996365 cec: bits: "1"
8996365-8998771 cec: bits: "0"
8998771-9001177 cec: bits: "1"
9001177-9003583 cec: bits: "1"
9003583-9005989 cec: bits: "1"
8986742-9005989 cec: bytes: "0x57"
9005989-9008395 cec: eom-1: "EOM=Y"
9008395-9012495 cec: ack: "ACK"
8722089-9008395 cec: frames: "50:47:41:56:52:2d:58:33:33:30:30:57"
8722089-9008395 cec: sections: "HDR: AudioSystem, TV | OPC: SET_OSD_NAME | OPS: 0x41, 0x56, 0x52, 0x2d, 0x58, 0x33, 0x33, 0x30, 0x30, 0x57 | R: ACK"
9045663-9050169 cec: st: "ST"
9050169-9052575 cec: bits: "0"
9052575-9054981 cec: bits: "1"
9054981-9057387 cec: bits: "0"
9057387-9059793 cec: bits: "1"
9059793-9062199 cec: bits: "1"
9062199-9064605 cec: bits: "1"
9064605-9067011 cec: bits: "1"
9067011-9069417 cec: bits: "1"
9050169-9069417 cec: bytes: "0x5f"
9069417-9071823 cec: eom-0: "EOM=N"
9071823-9074229 cec: ack: "ACK"
9074229-9076635 cec: bits: "1"
9076635-9079041 cec: bits: "0"
9079041-9081447 cec: bits: "0"
9081447-9083852 cec: bits: "0"
9083852-9086258 cec: bits: "0"
9086258-9088664 cec: bits: "1"
9088664-9091070 cec: bits: "1"
9091070-9093476 cec: bits: "1"
9074229-9093476 cec: bytes: "0x87"
9093476-9095882 cec: eom-0: "EOM=N"
9095882-9098288 cec: ack: "ACK"
9098288-9100694 cec: bits: "0"
9100694-9103100 cec: bits: "0"
9103100-9105506 cec: bits: "0"
9105506-9107912 cec: bits: "0"
9107912-9110318 cec: bits: "0"
9110318-9112724 cec: bits: "0"
9112724-9115130 cec: bits: "0"
9115130-9117535 cec: bits: "0"
9098288-9117535 cec: bytes: "0x00"
9117535-9119941 cec: eom-0: "EOM=N"
9119941-9122347 cec: ack: "ACK"
9122347-9124753 cec: bits: "0"
9124753-9127159 cec: bits: "0"
9127159-9129565 cec: bits: "0"
9129565-9131971 cec: bits: "0"
9131971-9134377 cec: bits: "0"
9134377-9136783 cec: bits: "1"
9136783-9139189 cec: bits: "0"
9139189-9141595 cec: bits: "1"
9122347-9141595 cec: bytes: "0x05"
9141595-9144001 cec: eom-0: "EOM=N"
9144001-9146407 cec: ack: "ACK"
9146407-9148813 cec: bits: "1"
9148813-9151218 cec: bits: "1"
9151218-9153624 cec: bits: "0"
9153624-9156030 cec: bits: "0"
9156030-9158436 cec: bits: "1"
9158436-9160842 cec: bits: "1"
9160842-9163248 cec: bits: "0"
9163248-9165655 cec: bits: "1"
9146407-9165655 cec: bytes: "0xcd"
9165655-9168061 cec: eom-1: "EOM=Y"
9168061-9172161 cec: ack: "ACK"
9050169-9168061 cec: frames: "5f:87:00:05:cd"
9050169-9168061 cec: sections: "HDR: AudioSystem, Broadcast | OPC: DEVICE_VENDOR_ID | OPS: 0x00, 0x05, 0xcd | R: ACK"
11819916-11824404 cec: st: "ST"
11824404-11826785 cec: bits: "0"
11826785-11829166 cec: bits: "0"
11829166-11831547 cec: bits: "0"
11831547-11833928 cec: bits: "0"
11833928-11836309 cec: bits: "0"
11836309-11838690 cec: bits: "0"
11838690-11841070 cec: bits: "0"
11841070-11843451 cec: bits: "1"
11824404-11843451 cec: bytes: "0x01"
11843451-11845832 cec: eom-1: "EOM=Y"
11845832-11849932 cec: nack: "NACK"
11824404-11845832 cec: frames: "01"
11824404-11845832 cec: sections: "HDR: TV, Recording_1 | OPC: PING | R: NACK"
11855478-11859966 cec: st: "ST"
11859966-11862347 cec: bits: "0"
11862347-11864728 cec: bits: "0"
11864728-11867109 cec: bits: "0"
11867109-11869489 cec: bits: "0"
11869489-11871870 cec: bits: "0"
11871870-11874251 cec: bits: "0"
11874251-11876632 cec: bits: "0"
11876632-11879013 cec: bits: "1"
11859966-11879013 cec: bytes: "0x01"
11879013-11881394 cec: eom-1: "EOM=Y"
11881394-11885494 cec: nack: "NACK"
11859966-11881394 cec: frames: "01"
11859966-11881394 cec: sections: "HDR: TV, Recording_1 | OPC: PING | R: NACK"
11900656-11905143 cec: st: "ST"
11905143-11907524 cec: bits: "0"
11907524-11909905 cec: bits: "0"
11909905-11912286 cec: bits: "0"
11912286-11914667 cec: bits: "0"
11914667-11917048 cec: bits: "0"
11917048-11919429 cec: bits: "0"
11919429-11921810 cec: bits: "1"
11921810-11924191 cec: bits: "0"
11905143-11924191 cec: bytes: "0x02"
11924191-11926572 cec: eom-1: "EOM=Y"
11926572-11930672 cec: nack: "NACK"
11905143-11926572 cec: frames: "02"
11905143-11926572 cec: sections: "HDR: TV, Recording_2 | OPC: PING | R: NACK"
11936218-11940705 cec: st: "ST"
11940705-11943086 cec: bits: "0"
11943086-11945467 cec: bits: "0"
11945467-11947848 cec: bits: "0"
11947848-11950229 cec: bits: "0"
11950229-11952610 cec: bits: "0"
11952610-11954991 cec: bits: "0"
11954991-11957372 cec: bits: "1"
11957372-11959753 cec: bits: "0"
11940705-11959753 cec: bytes: "0x02"
11959753-11962134 cec: eom-1: "EOM=Y"
11962134-11966234 cec: nack: "NACK"
11940705-11962134 cec: frames: "02"
11940705-11962134 cec: sections: "HDR: TV, Recording_2 | OPC: PING | R: NACK"
11981395-11985882 cec: st: "ST"
11985882-11988263 cec: bits: "0"
11988263-11990644 cec: bits: "0"
11990644-11993025 cec: bits: "0"
11993025-11995406 cec: bits: "0"
11995406-11997787 cec: bits: "0"
11997787-12000168 cec: bits: "0"
12000168-12002549 cec: bits: "1"
12002549-12004930 cec: bits: "1"
11985882-12004930 cec: bytes: "0x03"
12004930-12007311 cec: eom-1: "EOM=Y"
12007311-12011411 cec: nack: "NACK"
11985882-12007311 cec: frames: "03"
11985882-12007311 cec: sections: "HDR: TV, Tuner_1 | OPC: PING | R: NACK"
12016957-12021444 cec: st: "ST"
12021444-12023825 cec: bits: "0"
12023825-12026206 cec: bits: "0"
12026206-12028587 cec: bits: "0"
12028587-12030968 cec: bits: "0"
12030968-12033349 cec: bits: "0"
12033349-12035730 cec: bits: "0"
12035730-12038111 cec: bits: "1"
12038111-12040492 cec: bits: "1"
12021444-12040492 cec: bytes: "0x03"
12040492-12042873 cec: eom-1: "EOM=Y"
12042873-12046973 cec: nack: "NACK"
12021444-12042873 cec: frames: "03"
12021444-12042873 cec: sections: "HDR: TV, Tuner_1 | OPC: PING | R: NACK"
12062134-12066622 cec: st: "ST"
12066622-12069003 cec: bits: "0"
12069003-12071384 cec: bits: "0"
12071384-12073765 cec: bits: "0"
12073765-12076145 cec: bits: "0"
12076145-12078526 cec: bits: "0"
12078526-12080907 cec: bits: "1"
12080907-12083288 cec: bits: "0"
12083288-12085669 cec: bits: "0"
12066622-12085669 cec: bytes: "0x04"
12085669-12088050 cec: eom-1: "EOM=Y"
12088050-12092150 cec: nack: "NACK"
12066622-12088050 cec: frames: "04"
12066622-12088050 cec: sections: "HDR: TV, Playback_1 | OPC: PING | R: NACK"
12097696-12102184 cec: st: "ST"
12102184-12104564 cec: bits: "0"
12104564-12106945 cec: bits: "0"
12106945-12109326 cec: bits: "0"
12109326-12111707 cec: bits: "0"
12111707-12114088 cec: bits: "0"
12114088-12116469 cec: bits: "1"
12116469-12118850 cec: bits: "0"
12118850-12121231 cec: bits: "0"
12102184-12121231 cec: bytes: "0x04"
12121231-12123612 cec: eom-1: "EOM=Y"
12123612-12127712 cec: nack: "NACK"
12102184-12123612 cec: frames: "04"
12102184-12123612 cec: sections: "HDR: TV, Playback_1 | OPC: PING | R: NACK"
12142874-12147361 cec: st: "ST"
12147361-12149742 cec: bits: "0"
12149742-12152123 cec: bits: "0"
12152123-12154504 cec: bits: "0"
12154504-12156885 cec: bits: "0"
12156885-12159266 cec: bits: "0"
12159266-12161647 cec: bits: "1"
12161647-12164028 cec: bits: "0"
12164028-12166409 cec: bits: "1"
12147361-12166409 cec: bytes: "0x05"
12166409-12168790 cec: eom-1: "EOM=Y"
12168790-12172890 cec: ack: "ACK"
12147361-12168790 cec: frames: "05"
12147361-12168790 cec: sections: "HDR: TV, AudioSystem | OPC: PING | R: ACK"
12188051-12192538 cec: st: "ST"
12192538-12194919 cec: bits: "0"
12194919-12197300 cec: bits: "0"
12197300-12199681 cec: bits: "0"
12199681-12202062 cec: bits: "0"
12202062-12204443 cec: bits: "0"
12204443-12206824 cec: bits: "1"
12206824-12209205 cec: bits: "1"
12209205-12211586 cec: bits: "0"
12192538-12211586 cec: bytes: "0x06"
12211586-12213967 cec: eom-1: "EOM=Y"
12213967-12218067 cec: nack: "NACK"
12192538-12213967 cec: frames: "06"
12192538-12213967 cec: sections: "HDR: TV, Tuner2 | OPC: PING | R: NACK"
12223613-12228100 cec: st: "ST"
12228100-12230481 cec: bits: "0"
12230481-12232862 cec: bits: "0"
12232862-12235243 cec: bits: "0"
12235243-12237624 cec: bits: "0"
12237624-12240005 cec: bits: "0"
12240005-12242386 cec: bits: "1"
12242386-12244767 cec: bits: "1"
12244767-12247148 cec: bits: "0"
12228100-12247148 cec: bytes: "0x06"
12247148-12249529 cec: eom-1: "EOM=Y"
12249529-12253629 cec: nack: "NACK"
12228100-12249529 cec: frames: "06"
12228100-12249529 cec: sections: "HDR: TV, Tuner2 | OPC: PING | R: NACK"
12268790-12273278 cec: st: "ST"
12273278-12275659 cec: bits: "0"
12275659-12278040 cec: bits: "0"
12278040-12280420 cec: bits: "0"
12280420-12282801 cec: bits: "0"
12282801-12285182 cec: bits: "0"
12285182-12287563 cec: bits: "1"
12287563-12289944 cec: bits: "1"
12289944-12292325 cec: bits: "1"
12273278-12292325 cec: bytes: "0x07"
12292325-12294706 cec: eom-1: "EOM=Y"
12294706-12298806 cec: nack: "NACK"
12273278-12294706 cec: frames: "07"
12273278-12294706 cec: sections: "HDR: TV, Tuner3 | OPC: PING | R: NACK"
12304352-12308840 cec: st: "ST"
12308840-12311220 cec: bits: "0"
12311220-12313601 cec: bits: "0"
12313601-12315982 cec: bits: "0"
12315982-12318363 cec: bits: "0"
12318363-12320744 cec: bits: "0"
12320744-12323125 cec: bits: "1"
12323125-12325506 cec: bits: "1"
12325506-12327887 cec: bits: "1"
12308840-12327887 cec: bytes: "0x07"
12327887-12330268 cec: eom-1: "EOM=Y"
12330268-12334368 cec: nack: "NACK"
12308840-12330268 cec: frames: "07"
12308840-12330268 cec: sections: "HDR: TV, Tuner3 | OPC: PING | R: NACK"
12349530-12354017 cec: st: "ST"
12354017-12356398 cec: bits: "0"
12356398-12358779 cec: bits: "0"
12358779-12361160 cec: bits: "0"
12361160-12363541 cec: bits: "0"
12363541-12365922 cec: bits: "1"
12365922-12368303 cec: bits: "0"
12368303-12370684 cec: bits: "0"
12370684-12373065 cec: bits: "0"
12354017-12373065 cec: bytes: "0x08"
12373065-12375446 cec: eom-1: "EOM=Y"
12375446-12379546 cec: nack: "NACK"
12354017-12375446 cec: frames: "08"
12354017-12375446 cec: sections: "HDR: TV, Playback_2 | OPC: PING | R: NACK"
12385092-12389579 cec: st: "ST"
12389579-12391960 cec: bits: "0"
12391960-12394341 cec: bits: "0"
12394341-12396722 cec: bits: "0"
12396722-12399103 cec: bits: "0"
12399103-12401484 cec: bits: "1"
12401484-12403865 cec: bits: "0"
12403865-12406246 cec: bits: "0"
12406246-12408627 cec: bits: "0"
12389579-12408627 cec: bytes: "0x08"
12408627-12411008 cec: eom-1: "EOM=Y"
12411008-12415108 cec: nack: "NACK"
12389579-12411008 cec: frames: "08"
12389579-12411008 cec: sections: "HDR: TV, Playback_2 | OPC: PING | R: NACK"
12430269-12434756 cec: st: "ST"
12434756-12437137 cec: bits: "0"
12437137-12439518 cec: bits: "0"
12439518-12441899 cec: bits: "0"
12441899-12444280 cec: bits: "0"
12444280-12446661 cec: bits: "1"
12446661-12449042 cec: bits: "0"
12449042-12451423 cec: bits: "0"
12451423-12453804 cec: bits: "1"
12434756-12453804 cec: bytes: "0x09"
12453804-12456185 cec: eom-1: "EOM=Y"
12456185-12460285 cec: nack: "NACK"
12434756-12456185 cec: frames: "09"
12434756-12456185 cec: sections: "HDR: TV, Recording_3 | OPC: PING | R: NACK"
12465831-12470318 cec: st: "ST"
12470318-12472699 cec: bits: "0"
12472699-12475080 cec: bits: "0"
12475080-12477461 cec: bits: "0"
12477461-12479842 cec: bits: "0"
12479842-12482223 cec: bits: "1"
12482223-12484604 cec: bits: "0"
12484604-12486985 cec: bits: "0"
12486985-12489366 cec: bits: "1"
12470318-12489366 cec: bytes: "0x09"
12489366-12491747 cec: eom-1: "EOM=Y"
12491747-12495847 cec: nack: "NACK"
12470318-12491747 cec: frames: "09"
12470318-12491747 cec: sections: "HDR: TV, Recording_3 | OPC: PING | R: NACK"
12511008-12515496 cec: st: "ST"
12515496-12517876 cec: bits: "0"
12517876-12520257 cec: bits: "0"
12520257-12522638 cec: bits: "0"
12522638-12525019 cec: bits: "0"
12525019-12527400 cec: bits: "1"
12527400-12529781 cec: bits: "0"
12529781-12532162 cec: bits: "1"
12532162-12534543 cec: bits: "0"
12515496-12534543 cec: bytes: "0x0a"
12534543-12536924 cec: eom-1: "EOM=Y"
12536924-12541024 cec: nack: "NACK"
12515496-12536924 cec: frames: "0a"
12515496-12536924 cec: sections: "HDR: TV, Tuner_4 | OPC: PING | R: NACK"
12546570-12551057 cec: st: "ST"
12551057-12553438 cec: bits: "0"
12553438-12555819 cec: bits: "0"
12555819-12558200 cec: bits: "0"
12558200-12560581 cec: bits: "0"
12560581-12562962 cec: bits: "1"
12562962-12565343 cec: bits: "0"
12565343-12567724 cec: bits: "1"
12567724-12570105 cec: bits: "0"
12551057-12570105 cec: bytes: "0x0a"
12570105-12572486 cec: eom-1: "EOM=Y"
12572486-12576586 cec: nack: "NACK"
12551057-12572486 cec: frames: "0a"
12551057-12572486 cec: sections: "HDR: TV, Tuner_4 | OPC: PING | R: NACK"
12591748-12596235 cec: st: "ST"
12596235-12598616 cec: bits: "0"
12598616-12600997 cec: bits: "0"
12600997-12603378 cec: bits: "0"
12603378-12605759 cec: bits: "0"
12605759-12608140 cec: bits: "1"
12608140-12610521 cec: bits: "0"
12610521-12612902 cec: bits: "1"
12612902-12615283 cec: bits: "1"
12596235-12615283 cec: bytes: "0x0b"
12615283-12617664 cec: eom-1: "EOM=Y"
12617664-12621764 cec: nack: "NACK"
12596235-12617664 cec: frames: "0b"
12596235-12617664 cec: sections: "HDR: TV, Playback_3 | OPC: PING | R: NACK"
12627310-12631797 cec: st: "ST"
12631797-12634178 cec: bits: "0"
12634178-12636559 cec: bits: "0"
12636559-12638940 cec: bits: "0"
12638940-12641321 cec: bits: "0"
12641321-12643702 cec: bits: "1"
12643702-12646083 cec: bits: "0"
12646083-12648464 cec: bits: "1"
12648464-12650844 cec: bits: "1"
12631797-12650844 cec: bytes: "0x0b"
12650844-12653225 cec: eom-1: "EOM=Y"
12653225-12657325 cec: nack: "NACK"
12631797-12653225 cec: frames: "0b"
12631797-12653225 cec: sections: "HDR: TV, Playback_3 | OPC: PING | R: NACK"
12672487-12676974 cec: st: "ST"
12676974-12679355 cec: bits: "0"
12679355-12681736 cec: bits: "0"
12681736-12684117 cec: bits: "0"
12684117-12686498 cec: bits: "0"
12686498-12688879 cec: bits: "1"
12688879-12691260 cec: bits: "1"
12691260-12693641 cec: bits: "0"
12693641-12696022 cec: bits: "0"
12676974-12696022 cec: bytes: "0x0c"
12696022-12698403 cec: eom-1: "EOM=Y"
12698403-12702503 cec: nack: "NACK"
12676974-12698403 cec: frames: "0c"
12676974-12698403 cec: sections: "HDR: TV, Backup_1 | OPC: PING | R: NACK"
12708049-12712536 cec: st: "ST"
12712536-12714917 cec: bits: "0"
12714917-12717298 cec: bits: "0"
12717298-12719679 cec: bits: "0"
12719679-12722060 cec: bits: "0"
12722060-12724441 cec: bits: "1"
12724441-12726822 cec: bits: "1"
12726822-12729203 cec: bits: "0"
12729203-12731584 cec: bits: "0"
12712536-12731584 cec: bytes: "0x0c"
12731584-12733965 cec: eom-1: "EOM=Y"
12733965-12738065 cec: nack: "NACK"
12712536-12733965 cec: frames: "0c"
12712536-12733965 cec: sections: "HDR: TV, Backup_1 | OPC: PING | R: NACK"
12753226-12757713 cec: st: "ST"
12757713-12760094 cec: bits: "0"
12760094-12762475 cec: bits: "0"
12762475-12764856 cec: bits: "0"
12764856-12767237 cec: bits: "0"
12767237-12769618 cec: bits: "1"
12769618-12771999 cec: bits: "1"
12771999-12774380 cec: bits: "0"
12774380-12776761 cec: bits: "1"
12757713-12776761 cec: bytes: "0x0d"
12776761-12779142 cec: eom-1: "EOM=Y"
12779142-12783242 cec: nack: "NACK"
12757713-12779142 cec: frames: "0d"
12757713-12779142 cec: sections: "HDR: TV, Backup_2 | OPC: PING | R: NACK"
12788788-12793275 cec: st: "ST"
12793275-12795656 cec: bits: "0"
12795656-12798037 cec: bits: "0"
12798037-12800418 cec: bits: "0"
12800418-12802799 cec: bits: "0"
12802799-12805180 cec: bits: "1"
12805180-12807561 cec: bits: "1"
12807561-12809942 cec: bits: "0"
12809942-12812323 cec: bits: "1"
12793275-12812323 cec: bytes: "0x0d"
12812323-12814704 cec: eom-1: "EOM=Y"
12814704-12818804 cec: nack: "NACK"
12793275-12814704 cec: frames: "0d"
12793275-12814704 cec: sections: "HDR: TV, Backup_2 | OPC: PING | R: NACK"
12833966-12838453 cec: st: "ST"
12838453-12840834 cec: bits: "0"
12840834-12843215 cec: bits: "0"
12843215-12845596 cec: bits: "0"
12845596-12847977 cec: bits: "0"
12847977-12850358 cec: bits: "1"
12850358-12852739 cec: bits: "1"
12852739-12855120 cec: bits: "1"
12855120-12857500 cec: bits: "1"
12838453-12857500 cec: bytes: "0x0f"
12857500-12859881 cec: eom-0: "EOM=N"
12859881-12862262 cec: ack: "ACK"
12862262-12864643 cec: bits: "1"
12864643-12867024 cec: bits: "0"
12867024-12869405 cec: bits: "1"
12869405-12871786 cec: bits: "0"
12871786-12874167 cec: bits: "0"
12874167-12876548 cec: bits: "0"
12876548-12878929 cec: bits: "0"
12878929-12881310 cec: bits: "0"
12862262-12881310 cec: bytes: "0xa0"
12881310-12883691 cec: eom-0: "EOM=N"
12883691-12886072 cec: ack: "ACK"
12886072-12888453 cec: bits: "0"
12888453-12890834 cec: bits: "0"
12890834-12893215 cec: bits: "0"
12893215-12895596 cec: bits: "0"
12895596-12897977 cec: bits: "1"
12897977-12900358 cec: bits: "0"
12900358-12902739 cec: bits: "0"
12902739-12905120 cec: bits: "0"
12886072-12905120 cec: bytes: "0x08"
12905120-12907501 cec: eom-0: "EOM=N"
12907501-12909882 cec: ack: "ACK"
12909882-12912263 cec: bits: "0"
12912263-12914644 cec: bits: "0"
12914644-12917025 cec: bits: "0"
12917025-12919406 cec: bits: "0"
12919406-12921787 cec: bits: "0"
12921787-12924168 cec: bits: "0"
12924168-12926549 cec: bits: "0"
12926549-12928930 cec: bits: "0"
12909882-12928930 cec: bytes: "0x00"
12928930-12931311 cec: eom-0: "EOM=N"
12931311-12933692 cec: ack: "ACK"
12933692-12936072 cec: bits: "0"
12936072-12938453 cec: bits: "1"
12938453-12940834 cec: bits: "0"
12940834-12943215 cec: bits: "0"
12943215-12945596 cec: bits: "0"
12945596-12947977 cec: bits: "1"
12947977-12950358 cec: bits: "1"
12950358-12952739 cec: bits: "0"
12933692-12952739 cec: bytes: "0x46"
12952739-12955120 cec: eom-0: "EOM=N"
12955120-12957501 cec: ack: "ACK"
12957501-12959882 cec: bits: "1"
12959882-12962263 cec: bits: "1"
12962263-12964644 cec: bits: "1"
12964644-12967025 cec: bits: "1"
12967025-12969406 cec: bits: "0"
12969406-12971787 cec: bits: "0"
12971787-12974168 cec: bits: "0"
12974168-12976549 cec: bits: "0"
12957501-12976549 cec: bytes: "0xf0"
12976549-12978930 cec: eom-0: "EOM=N"
12978930-12981311 cec: ack: "ACK"
12981311-12983692 cec: bits: "0"
12983692-12986073 cec: bits: "0"
12986073-12988454 cec: bits: "0"
12988454-12990835 cec: bits: "0"
12990835-12993216 cec: bits: "0"
12993216-12995597 cec: bits: "0"
12995597-12997978 cec: bits: "0"
12997978-13000359 cec: bits: "0"
12981311-13000359 cec: bytes: "0x00"
13000359-13002740 cec: eom-0: "EOM=N"
13002740-13005121 cec: ack: "ACK"
13005121-13007502 cec: bits: "0"
13007502-13009883 cec: bits: "0"
13009883-13012264 cec: bits: "0"
13012264-13014645 cec: bits: "0"
13014645-13017025 cec: bits: "0"
13017025-13019406 cec: bits: "0"
13019406-13021787 cec: bits: "0"
13021787-13024168 cec: bits: "0"
13005121-13024168 cec: bytes: "0x00"
13024168-13026549 cec: eom-1: "EOM=Y"
13026549-13030649 cec: ack: "ACK"
12838453-13026549 cec: frames: "0f:a0:08:00:46:f0:00:00"
12838453-13026549 cec: sections: "HDR: TV, Broadcast | OPC: VENDOR_COMMAND_WITH_ID | OPS: 0x08, 0x00, 0x46, 0xf0, 0x00, 0x00 | R: ACK"
13042652-13047159 cec: st: "ST"
13047159-13049565 cec: bits: "0"
13049565-13051971 cec: bits: "1"
13051971-13054377 cec: bits: "0"
13054377-13056783 cec: bits: "1"
13056783-13059188 cec: bits: "0"
13059188-13061594 cec: bits: "0"
13061594-13064000 cec: bits: "0"
13064000-13066406 cec: bits: "0"
13047159-13066406 cec: bytes: "0x50"
13066406-13068812 cec: eom-0: "EOM=N"
13068812-13071218 cec: ack: "ACK"
13071218-13073624 cec: bits: "0"
13073624-13076030 cec: bits: "0"
13076030-13078436 cec: bits: "0"
13078436-13080842 cec: bits: "0"
13080842-13083248 cec: bits: "0"
13083248-13085654 cec: bits: "0"
13085654-13088060 cec: bits: "0"
13088060-13090466 cec: bits: "0"
13071218-13090466 cec: bytes: "0x00"
13090466-13092872 cec: eom-0: "EOM=N"
13092872-13095278 cec: ack: "ACK"
13095278-13097684 cec: bits: "1"
13097684-13100090 cec: bits: "0"
13100090-13102495 cec: bits: "1"
13102495-13104901 cec: bits: "0"
13104901-13107307 cec: bits: "0"
13107307-13109713 cec: bits: "0"
13109713-13112119 cec: bits: "0"
13112119-13114525 cec: bits: "0"
13095278-13114525 cec: bytes: "0xa0"
13114525-13116931 cec: eom-0: "EOM=N"
13116931-13119337 cec: ack: "ACK"
13119337-13121743 cec: bits: "0"
13121743-13124149 cec: bits: "0"
13124149-13126556 cec: bits: "0"
13126556-13128963 cec: bits: "0"
13128963-13131368 cec: bits: "0"
13131368-13133774 cec: bits: "0"
13133774-13136180 cec: bits: "0"
13136180-13138586 cec: bits: "0"
13119337-13138586 cec: bytes: "0x00"
13138586-13140992 cec: eom-1: "EOM=Y"
13140992-13145092 cec: ack: "ACK"
13047159-13140992 cec: frames: "50:00:a0:00"
13047159-13140992 cec: sections: "HDR: AudioSystem, TV | OPC: FEATURE_ABORT | OPS: 0xa0, 0x00 | R: ACK"
13155427-13159914 cec: st: "ST"
13159914-13162295 cec: bits: "0"
13162295-13164676 cec: bits: "0"
13164676-13167057 cec: bits: "0"
13167057-13169438 cec: bits: "0"
13169438-13171819 cec: bits: "1"
13171819-13174200 cec: bits: "1"
13174200-13176581 cec: bits: "1"
13176581-13178962 cec: bits: "0"
13159914-13178962 cec: bytes: "0x0e"
13178962-13181343 cec: eom-1: "EOM=Y"
13181343-13185443 cec: nack: "NACK"
13159914-13181343 cec: frames: "0e"
13159914-13181343 cec: sections: "HDR: TV, FreeUse | OPC: PING | R: NACK"
13190989-13195476 cec: st: "ST"
13195476-13197857 cec: bits: "0"
13197857-13200238 cec: bits: "0"
13200238-13202619 cec: bits: "0"
13202619-13205000 cec: bits: "0"
13205000-13207381 cec: bits: "1"
13207381-13209762 cec: bits: "1"
13209762-13212143 cec: bits: "1"
13212143-13214524 cec: bits: "0"
13195476-13214524 cec: bytes: "0x0e"
13214524-13216905 cec: eom-1: "EOM=Y"
13216905-13221005 cec: nack: "NACK"
13195476-13216905 cec: frames: "0e"
13195476-13216905 cec: sections: "HDR: TV, FreeUse | OPC: PING | R: NACK"
