694243-698730 cec: st: "ST"
698730-701111 cec: bits: "0"
701111-703492 cec: bits: "0"
703492-705873 cec: bits: "0"
705873-708254 cec: bits: "0"
708254-710635 cec: bits: "0"
710635-713016 cec: bits: "1"
713016-715397 cec: bits: "0"
715397-717778 cec: bits: "1"
698730-717778 cec: bytes: "0x05"
717778-720159 cec: eom-0: "EOM=N"
720159-722540 cec: ack: "ACK"
722540-724921 cec: bits: "1"
724921-727302 cec: bits: "0"
727302-729683 cec: bits: "1"
729683-732064 cec: bits: "0"
732064-734445 cec: bits: "0"
734445-736826 cec: bits: "0"
736826-739207 cec: bits: "0"
739207-741588 cec: bits: "0"
722540-741588 cec: bytes: "0xa0"
741588-743969 cec: eom-0: "EOM=N"
743969-746350 cec: ack: "ACK"
746350-748731 cec: bits: "0"
748731-751112 cec: bits: "0"
751112-753493 cec: bits: "0"
753493-755874 cec: bits: "0"
755874-758255 cec: bits: "1"
758255-760636 cec: bits: "0"
760636-763017 cec: bits: "0"
763017-765398 cec: bits: "0"
746350-765398 cec: bytes: "0x08"
765398-767779 cec: eom-0: "EOM=N"
767779-770160 cec: ack: "ACK"
770160-772541 cec: bits: "0"
772541-774922 cec: bits: "0"
774922-777303 cec: bits: "0"
777303-779683 cec: bits: "0"
779683-782064 cec: bits: "0"
782064-784445 cec: bits: "0"
784445-786826 cec: bits: "0"
786826-789207 cec: bits: "0"
770160-789207 cec: bytes: "0x00"
789207-791588 cec: eom-0: "EOM=N"
791588-793969 cec: ack: "ACK"
793969-796350 cec: bits: "0"
796350-798731 cec: bits: "1"
798731-801112 cec: bits: "0"
801112-803493 cec: bits: "0"
803493-805874 cec: bits: "0"
805874-808255 cec: bits: "1"
808255-810636 cec: bits: "1"
810636-813017 cec: bits: "0"
793969-813017 cec: bytes: "0x46"
813017-815398 cec: eom-0: "EOM=N"
815398-817779 cec: ack: "ACK"
817779-820160 cec: bits: "0"
820160-822541 cec: bits: "0"
822541-824922 cec: bits: "0"
824922-827303 cec: bits: "0"
827303-829684 cec: bits: "0"
829684-832065 cec: bits: "0"
832065-834446 cec: bits: "0"
834446-836827 cec: bits: "0"
817779-836827 cec: bytes: "0x00"
836827-839208 cec: eom-0: "EOM=N"
839208-841589 cec: ack: "ACK"
841589-843970 cec: bits: "0"
843970-846351 cec: bits: "0"
846351-848732 cec: bits: "0"
848732-851113 cec: bits: "0"
851113-853494 cec: bits: "1"
853494-855875 cec: bits: "1"
855875-858256 cec: bits: "0"
858256-860636 cec: bits: "0"
841589-860636 cec: bytes: "0x0c"
860636-863017 cec: eom-0: "EOM=N"
863017-865398 cec: ack: "ACK"
865398-867779 cec: bits: "0"
867779-870160 cec: bits: "0"
870160-872541 cec: bits: "0"
872541-874922 cec: bits: "0"
874922-877303 cec: bits: "0"
877303-879684 cec: bits: "0"
879684-882065 cec: bits: "0"
882065-884446 cec: bits: "0"
865398-884446 cec: bytes: "0x00"
884446-886827 cec: eom-0: "EOM=N"
886827-889208 cec: ack: "ACK"
889208-891589 cec: bits: "1"
891589-893970 cec: bits: "1"
893970-896351 cec: bits: "1"
896351-898732 cec: bits: "1"
898732-901113 cec: bits: "1"
901113-903494 cec: bits: "1"
903494-905875 cec: bits: "1"
905875-908256 cec: bits: "1"
889208-908256 cec: bytes: "0xff"
908256-910637 cec: eom-1: "EOM=Y"
910637-914737 cec: ack: "ACK"
698730-910637 cec: frames: "05:a0:08:00:46:00:0c:00:ff"
698730-910637 cec: sections: "HDR: TV, AudioSystem | OPC: VENDOR_COMMAND_WITH_ID | OPS: 0x08, 0x00, 0x46, 0x00, 0x0c, 0x00, 0xff | R: ACK"
929898-934385 cec: st: "ST"
934385-936766 cec: bits: "0"
936766-939147 cec: bits: "0"
939147-941528 cec: bits: "0"
941528-943909 cec: bits: "0"
943909-946290 cec: bits: "0"
946290-948671 cec: bits: "0"
948671-951052 cec: bits: "0"
951052-953433 cec: bits: "0"
934385-953433 cec: bytes: "0x00"
953433-955814 cec: eom-1: "EOM=Y"
955814-959914 cec: nack: "NACK"
934385-955814 cec: frames: "00"
934385-955814 cec: sections: "HDR: TV, TV | OPC: PING | R: NACK"
965460-969947 cec: st: "ST"
969947-972328 cec: bits: "0"
972328-974709 cec: bits: "0"
974709-977090 cec: bits: "0"
977090-979471 cec: bits: "0"
979471-981852 cec: bits: "0"
981852-984233 cec: bits: "0"
984233-986614 cec: bits: "0"
986614-988995 cec: bits: "0"
969947-988995 cec: bytes: "0x00"
988995-991376 cec: eom-1: "EOM=Y"
991376-995476 cec: nack: "NACK"
969947-991376 cec: frames: "00"
969947-991376 cec: sections: "HDR: TV, TV | OPC: PING | R: NACK"
1010638-1015125 cec: st: "ST"
1015125-1017506 cec: bits: "0"
1017506-1019887 cec: bits: "0"
1019887-1022268 cec: bits: "0"
1022268-1024649 cec: bits: "0"
1024649-1027030 cec: bits: "0"
1027030-1029411 cec: bits: "0"
1029411-1031792 cec: bits: "0"
1031792-1034173 cec: bits: "0"
1015125-1034173 cec: bytes: "0x00"
1034173-1036554 cec: eom-1: "EOM=Y"
1036554-1040654 cec: nack: "NACK"
1015125-1036554 cec: frames: "00"
1015125-1036554 cec: sections: "HDR: TV, TV | OPC: PING | R: NACK"
1046200-1050687 cec: st: "ST"
1050687-1053068 cec: bits: "0"
1053068-1055449 cec: bits: "0"
1055449-1057830 cec: bits: "0"
1057830-1060211 cec: bits: "0"
1060211-1062592 cec: bits: "0"
1062592-1064973 cec: bits: "0"
1064973-1067354 cec: bits: "0"
1067354-1069735 cec: bits: "0"
1050687-1069735 cec: bytes: "0x00"
1069735-1072115 cec: eom-1: "EOM=Y"
1072115-1076215 cec: nack: "NACK"
1050687-1072115 cec: frames: "00"
1050687-1072115 cec: sections: "HDR: TV, TV | OPC: PING | R: NACK"
1091377-1095864 cec: st: "ST"
1095864-1098245 cec: bits: "0"
1098245-1100626 cec: bits: "0"
1100626-1103007 cec: bits: "0"
1103007-1105388 cec: bits: "0"
1105388-1107769 cec: bits: "0"
1107769-1110150 cec: bits: "0"
1110150-1112531 cec: bits: "0"
1112531-1114912 cec: bits: "0"
1095864-1114912 cec: bytes: "0x00"
1114912-1117293 cec: eom-1: "EOM=Y"
1117293-1121393 cec: nack: "NACK"
1095864-1117293 cec: frames: "00"
1095864-1117293 cec: sections: "HDR: TV, TV | OPC: PING | R: NACK"
1126939-1131426 cec: st: "ST"
1131426-1133807 cec: bits: "0"
1133807-1136188 cec: bits: "0"
1136188-1138569 cec: bits: "0"
1138569-1140950 cec: bits: "0"
1140950-1143331 cec: bits: "0"
1143331-1145712 cec: bits: "0"
1145712-1148093 cec: bits: "0"
1148093-1150474 cec: bits: "0"
1131426-1150474 cec: bytes: "0x00"
1150474-1152855 cec: eom-1: "EOM=Y"
1152855-1156955 cec: nack: "NACK"
1131426-1152855 cec: frames: "00"
1131426-1152855 cec: sections: "HDR: TV, TV | OPC: PING | R: NACK"
1172116-1176603 cec: st: "ST"
1176603-1178984 cec: bits: "0"
1178984-1181365 cec: bits: "0"
1181365-1183746 cec: bits: "0"
1183746-1186127 cec: bits: "0"
1186127-1188508 cec: bits: "1"
1188508-1190889 cec: bits: "1"
1190889-1193270 cec: bits: "1"
1193270-1195651 cec: bits: "1"
1176603-1195651 cec: bytes: "0x0f"
1195651-1198032 cec: eom-0: "EOM=N"
1198032-1200413 cec: ack: "ACK"
1200413-1202794 cec: bits: "1"
1202794-1205175 cec: bits: "0"
1205175-1207556 cec: bits: "0"
1207556-1209937 cec: bits: "0"
1209937-1212318 cec: bits: "0"
1212318-1214699 cec: bits: "1"
1214699-1217080 cec: bits: "0"
1217080-1219461 cec: bits: "0"
1200413-1219461 cec: bytes: "0x84"
1219461-1221842 cec: eom-0: "EOM=N"
1221842-1224223 cec: ack: "ACK"
1224223-1226604 cec: bits: "0"
1226604-1228985 cec: bits: "0"
1228985-1231366 cec: bits: "0"
1231366-1233747 cec: bits: "0"
1233747-1236128 cec: bits: "0"
1236128-1238509 cec: bits: "0"
1238509-1240890 cec: bits: "0"
1240890-1243271 cec: bits: "0"
1224223-1243271 cec: bytes: "0x00"
1243271-1245652 cec: eom-0: "EOM=N"
1245652-1248033 cec: ack: "ACK"
1248033-1250414 cec: bits: "0"
1250414-1252794 cec: bits: "0"
1252794-1255175 cec: bits: "0"
1255175-1257556 cec: bits: "0"
1257556-1259937 cec: bits: "0"
1259937-1262318 cec: bits: "0"
1262318-1264699 cec: bits: "0"
1264699-1267080 cec: bits: "0"
1248033-1267080 cec: bytes: "0x00"
1267080-1269461 cec: eom-0: "EOM=N"
1269461-1271842 cec: ack: "ACK"
1271842-1274223 cec: bits: "0"
1274223-1276604 cec: bits: "0"
1276604-1278985 cec: bits: "0"
1278985-1281366 cec: bits: "0"
1281366-1283747 cec: bits: "0"
1283747-1286128 cec: bits: "0"
1286128-1288509 cec: bits: "0"
1288509-1290890 cec: bits: "0"
1271842-1290890 cec: bytes: "0x00"
1290890-1293271 cec: eom-1: "EOM=Y"
1293271-1297371 cec: ack: "ACK"
1176603-1293271 cec: frames: "0f:84:00:00:00"
1176603-1293271 cec: sections: "HDR: TV, Broadcast | OPC: REPORT_PHYSICAL_ADDRESS | OPS: 0x00, 0x00, 0x00 | R: ACK"
1312532-1317020 cec: st: "ST"
1317020-1319401 cec: bits: "0"
1319401-1321782 cec: bits: "0"
1321782-1324163 cec: bits: "0"
1324163-1326544 cec: bits: "0"
1326544-1328925 cec: bits: "1"
1328925-1331305 cec: bits: "1"
1331305-1333686 cec: bits: "1"
1333686-1336067 cec: bits: "1"
1317020-1336067 cec: bytes: "0x0f"
1336067-1338448 cec: eom-0: "EOM=N"
1338448-1340829 cec: ack: "ACK"
1340829-1343210 cec: bits: "1"
1343210-1345591 cec: bits: "0"
1345591-1347972 cec: bits: "0"
1347972-1350353 cec: bits: "0"
1350353-1352734 cec: bits: "0"
1352734-1355115 cec: bits: "1"
1355115-1357496 cec: bits: "1"
1357496-1359877 cec: bits: "1"
1340829-1359877 cec: bytes: "0x87"
1359877-1362258 cec: eom-0: "EOM=N"
1362258-1364639 cec: ack: "ACK"
1364639-1367020 cec: bits: "0"
1367020-1369401 cec: bits: "0"
1369401-1371782 cec: bits: "0"
1371782-1374163 cec: bits: "0"
1374163-1376544 cec: bits: "1"
1376544-1378925 cec: bits: "0"
1378925-1381306 cec: bits: "0"
1381306-1383687 cec: bits: "0"
1364639-1383687 cec: bytes: "0x08"
1383687-1386068 cec: eom-0: "EOM=N"
1386068-1388449 cec: ack: "ACK"
1388449-1390830 cec: bits: "0"
1390830-1393211 cec: bits: "0"
1393211-1395592 cec: bits: "0"
1395592-1397973 cec: bits: "0"
1397973-1400354 cec: bits: "0"
1400354-1402735 cec: bits: "0"
1402735-1405116 cec: bits: "0"
1405116-1407497 cec: bits: "0"
1388449-1407497 cec: bytes: "0x00"
1407497-1409877 cec: eom-0: "EOM=N"
1409877-1412258 cec: ack: "ACK"
1412258-1414639 cec: bits: "0"
1414639-1417020 cec: bits: "1"
1417020-1419401 cec: bits: "0"
1419401-1421782 cec: bits: "0"
1421782-1424163 cec: bits: "0"
1424163-1426544 cec: bits: "1"
1426544-1428925 cec: bits: "1"
1428925-1431306 cec: bits: "0"
1412258-1431306 cec: bytes: "0x46"
1431306-1433687 cec: eom-1: "EOM=Y"
1433687-1437787 cec: ack: "ACK"
1317020-1433687 cec: frames: "0f:87:08:00:46"
1317020-1433687 cec: sections: "HDR: TV, Broadcast | OPC: DEVICE_VENDOR_ID | OPS: 0x08, 0x00, 0x46 | R: ACK"
1452949-1457436 cec: st: "ST"
1457436-1459817 cec: bits: "0"
1459817-1462198 cec: bits: "0"
1462198-1464579 cec: bits: "0"
1464579-1466960 cec: bits: "0"
1466960-1469341 cec: bits: "1"
1469341-1471722 cec: bits: "1"
1471722-1474103 cec: bits: "1"
1474103-1476484 cec: bits: "1"
1457436-1476484 cec: bytes: "0x0f"
1476484-1478865 cec: eom-0: "EOM=N"
1478865-1481246 cec: ack: "ACK"
1481246-1483627 cec: bits: "1"
1483627-1486007 cec: bits: "0"
1486007-1488388 cec: bits: "1"
1488388-1490769 cec: bits: "0"
1490769-1493150 cec: bits: "0"
1493150-1495531 cec: bits: "0"
1495531-1497912 cec: bits: "0"
1497912-1500293 cec: bits: "0"
1481246-1500293 cec: bytes: "0xa0"
1500293-1502674 cec: eom-0: "EOM=N"
1502674-1505055 cec: ack: "ACK"
1505055-1507436 cec: bits: "0"
1507436-1509817 cec: bits: "0"
1509817-1512198 cec: bits: "0"
1512198-1514579 cec: bits: "0"
1514579-1516960 cec: bits: "1"
1516960-1519341 cec: bits: "0"
1519341-1521722 cec: bits: "0"
1521722-1524103 cec: bits: "0"
1505055-1524103 cec: bytes: "0x08"
1524103-1526484 cec: eom-0: "EOM=N"
1526484-1528865 cec: ack: "ACK"
1528865-1531246 cec: bits: "0"
1531246-1533627 cec: bits: "0"
1533627-1536008 cec: bits: "0"
1536008-1538389 cec: bits: "0"
1538389-1540770 cec: bits: "0"
1540770-1543151 cec: bits: "0"
1543151-1545532 cec: bits: "0"
1545532-1547913 cec: bits: "0"
1528865-1547913 cec: bytes: "0x00"
1547913-1550294 cec: eom-0: "EOM=N"
1550294-1552675 cec: ack: "ACK"
1552675-1555056 cec: bits: "0"
1555056-1557437 cec: bits: "1"
1557437-1559818 cec: bits: "0"
1559818-1562199 cec: bits: "0"
1562199-1564580 cec: bits: "0"
1564580-1566960 cec: bits: "1"
1566960-1569341 cec: bits: "1"
1569341-1571722 cec: bits: "0"
1552675-1571722 cec: bytes: "0x46"
1571722-1574103 cec: eom-0: "EOM=N"
1574103-1576484 cec: ack: "ACK"
1576484-1578865 cec: bits: "0"
1578865-1581246 cec: bits: "0"
1581246-1583627 cec: bits: "0"
1583627-1586008 cec: bits: "0"
1586008-1588389 cec: bits: "0"
1588389-1590770 cec: bits: "0"
1590770-1593151 cec: bits: "0"
1593151-1595532 cec: bits: "0"
1576484-1595532 cec: bytes: "0x00"
1595532-1597913 cec: eom-0: "EOM=N"
1597913-1600294 cec: ack: "ACK"
1600294-1602675 cec: bits: "0"
1602675-1605056 cec: bits: "0"
1605056-1607437 cec: bits: "0"
1607437-1609818 cec: bits: "0"
1609818-1612199 cec: bits: "0"
1612199-1614580 cec: bits: "1"
1614580-1616961 cec: bits: "0"
1616961-1619342 cec: bits: "0"
1600294-1619342 cec: bytes: "0x04"
1619342-1621723 cec: eom-0: "EOM=N"
1621723-1624104 cec: ack: "ACK"
1624104-1626485 cec: bits: "0"
1626485-1628866 cec: bits: "0"
1628866-1631247 cec: bits: "0"
1631247-1633628 cec: bits: "0"
1633628-1636009 cec: bits: "0"
1636009-1638390 cec: bits: "0"
1638390-1640771 cec: bits: "0"
1640771-1643152 cec: bits: "0"
1624104-1643152 cec: bytes: "0x00"
1643152-1645533 cec: eom-0: "EOM=N"
1645533-1647913 cec: ack: "ACK"
1647913-1650294 cec: bits: "0"
1650294-1652675 cec: bits: "0"
1652675-1655056 cec: bits: "0"
1655056-1657437 cec: bits: "0"
1657437-1659818 cec: bits: "0"
1659818-1662199 cec: bits: "0"
1662199-1664580 cec: bits: "0"
1664580-1666961 cec: bits: "1"
1647913-1666961 cec: bytes: "0x01"
1666961-1669342 cec: eom-1: "EOM=Y"
1669342-1673442 cec: ack: "ACK"
1457436-1669342 cec: frames: "0f:a0:08:00:46:00:04:00:01"
1457436-1669342 cec: sections: "HDR: TV, Broadcast | OPC: VENDOR_COMMAND_WITH_ID | OPS: 0x08, 0x00, 0x46, 0x00, 0x04, 0x00, 0x01 | R: ACK"
1688604-1693091 cec: st: "ST"
1693091-1695472 cec: bits: "0"
1695472-1697853 cec: bits: "0"
1697853-1700234 cec: bits: "0"
1700234-1702615 cec: bits: "0"
1702615-1704996 cec: bits: "1"
1704996-1707377 cec: bits: "1"
1707377-1709758 cec: bits: "1"
1709758-1712139 cec: bits: "1"
1693091-1712139 cec: bytes: "0x0f"
1712139-1714520 cec: eom-0: "EOM=N"
1714520-1716901 cec: ack: "ACK"
1716901-1719282 cec: bits: "1"
1719282-1721663 cec: bits: "0"
1721663-1724043 cec: bits: "0"
1724043-1726424 cec: bits: "0"
1726424-1728805 cec: bits: "0"
1728805-1731186 cec: bits: "0"
1731186-1733567 cec: bits: "0"
1733567-1735948 cec: bits: "0"
1716901-1735948 cec: bytes: "0x80"
1735948-1738329 cec: eom-0: "EOM=N"
1738329-1740710 cec: ack: "ACK"
1740710-1743091 cec: bits: "0"
1743091-1745472 cec: bits: "0"
1745472-1747853 cec: bits: "0"
1747853-1750234 cec: bits: "0"
1750234-1752615 cec: bits: "0"
1752615-1754996 cec: bits: "0"
1754996-1757377 cec: bits: "0"
1757377-1759758 cec: bits: "0"
1740710-1759758 cec: bytes: "0x00"
1759758-1762139 cec: eom-0: "EOM=N"
1762139-1764520 cec: ack: "ACK"
1764520-1766901 cec: bits: "0"
1766901-1769282 cec: bits: "0"
1769282-1771663 cec: bits: "0"
1771663-1774044 cec: bits: "0"
1774044-1776425 cec: bits: "0"
1776425-1778806 cec: bits: "0"
1778806-1781187 cec: bits: "0"
1781187-1783568 cec: bits: "0"
1764520-1783568 cec: bytes: "0x00"
1783568-1785949 cec: eom-0: "EOM=N"
1785949-1788330 cec: ack: "ACK"
1788330-1790711 cec: bits: "0"
1790711-1793092 cec: bits: "0"
1793092-1795473 cec: bits: "1"
1795473-1797854 cec: bits: "1"
1797854-1800235 cec: bits: "0"
1800235-1802616 cec: bits: "0"
1802616-1804997 cec: bits: "0"
1804997-1807377 cec: bits: "0"
1788330-1807377 cec: bytes: "0x30"
1807377-1809758 cec: eom-0: "EOM=N"
1809758-1812139 cec: ack: "ACK"
1812139-1814520 cec: bits: "0"
1814520-1816901 cec: bits: "0"
1816901-1819282 cec: bits: "0"
1819282-1821663 cec: bits: "0"
1821663-1824044 cec: bits: "0"
1824044-1826425 cec: bits: "0"
1826425-1828806 cec: bits: "0"
1828806-1831187 cec: bits: "0"
1812139-1831187 cec: bytes: "0x00"
1831187-1833568 cec: eom-1: "EOM=Y"
1833568-1837668 cec: ack: "ACK"
1693091-1833568 cec: frames: "0f:80:00:00:30:00"
1693091-1833568 cec: sections: "HDR: TV, Broadcast | OPC: ROUTING_CHANGE | OPS: 0x00, 0x00, 0x30, 0x00 | R: ACK"
1852830-1857317 cec: st: "ST"
1857317-1859698 cec: bits: "0"
1859698-1862079 cec: bits: "0"
1862079-1864460 cec: bits: "0"
1864460-1866841 cec: bits: "0"
1866841-1869222 cec: bits: "1"
1869222-1871603 cec: bits: "1"
1871603-1873984 cec: bits: "1"
1873984-1876365 cec: bits: "0"
1857317-1876365 cec: bytes: "0x0e"
1876365-1878746 cec: eom-1: "EOM=Y"
1878746-1882846 cec: nack: "NACK"
1857317-1878746 cec: frames: "0e"
1857317-1878746 cec: sections: "HDR: TV, FreeUse | OPC: PING | R: NACK"
1888392-1892879 cec: st: "ST"
1892879-1895260 cec: bits: "0"
1895260-1897641 cec: bits: "0"
1897641-1900022 cec: bits: "0"
1900022-1902403 cec: bits: "0"
1902403-1904784 cec: bits: "1"
1904784-1907165 cec: bits: "1"
1907165-1909546 cec: bits: "1"
1909546-1911927 cec: bits: "0"
1892879-1911927 cec: bytes: "0x0e"
1911927-1914308 cec: eom-1: "EOM=Y"
1914308-1918408 cec: nack: "NACK"
1892879-1914308 cec: frames: "0e"
1892879-1914308 cec: sections: "HDR: TV, FreeUse | OPC: PING | R: NACK"
1933569-1938056 cec: st: "ST"
1938056-1940437 cec: bits: "0"
1940437-1942818 cec: bits: "0"
1942818-1945199 cec: bits: "0"
1945199-1947580 cec: bits: "0"
1947580-1949961 cec: bits: "1"
1949961-1952342 cec: bits: "1"
1952342-1954723 cec: bits: "1"
1954723-1957104 cec: bits: "1"
1938056-1957104 cec: bytes: "0x0f"
1957104-1959485 cec: eom-0: "EOM=N"
1959485-1961866 cec: ack: "ACK"
1961866-1964247 cec: bits: "1"
1964247-1966628 cec: bits: "0"
1966628-1969009 cec: bits: "1"
1969009-1971390 cec: bits: "0"
1971390-1973771 cec: bits: "0"
1973771-1976152 cec: bits: "0"
1976152-1978533 cec: bits: "0"
1978533-1980914 cec: bits: "0"
1961866-1980914 cec: bytes: "0xa0"
1980914-1983295 cec: eom-0: "EOM=N"
1983295-1985676 cec: ack: "ACK"
1985676-1988057 cec: bits: "0"
1988057-1990438 cec: bits: "0"
1990438-1992819 cec: bits: "0"
1992819-1995199 cec: bits: "0"
1995199-1997580 cec: bits: "1"
1997580-1999961 cec: bits: "0"
1999961-2002342 cec: bits: "0"
2002342-2004723 cec: bits: "0"
1985676-2004723 cec: bytes: "0x08"
2004723-2007104 cec: eom-0: "EOM=N"
2007104-2009485 cec: ack: "ACK"
2009485-2011866 cec: bits: "0"
2011866-2014247 cec: bits: "0"
2014247-2016628 cec: bits: "0"
2016628-2019009 cec: bits: "0"
2019009-2021390 cec: bits: "0"
2021390-2023771 cec: bits: "0"
2023771-2026152 cec: bits: "0"
2026152-2028533 cec: bits: "0"
2009485-2028533 cec: bytes: "0x00"
2028533-2030914 cec: eom-0: "EOM=N"
2030914-2033295 cec: ack: "ACK"
2033295-2035676 cec: bits: "0"
2035676-2038057 cec: bits: "1"
2038057-2040438 cec: bits: "0"
2040438-2042819 cec: bits: "0"
2042819-2045200 cec: bits: "0"
2045200-2047581 cec: bits: "1"
2047581-2049962 cec: bits: "1"
2049962-2052343 cec: bits: "0"
2033295-2052343 cec: bytes: "0x46"
2052343-2054724 cec: eom-0: "EOM=N"
2054724-2057105 cec: ack: "ACK"
2057105-2059486 cec: bits: "0"
2059486-2061867 cec: bits: "0"
2061867-2064248 cec: bits: "0"
2064248-2066629 cec: bits: "0"
2066629-2069010 cec: bits: "0"
2069010-2071391 cec: bits: "0"
2071391-2073772 cec: bits: "0"
2073772-2076152 cec: bits: "0"
2057105-2076152 cec: bytes: "0x00"
2076152-2078533 cec: eom-0: "EOM=N"
2078533-2080914 cec: ack: "ACK"
2080914-2083295 cec: bits: "0"
2083295-2085676 cec: bits: "0"
2085676-2088057 cec: bits: "0"
2088057-2090438 cec: bits: "1"
2090438-2092819 cec: bits: "0"
2092819-2095200 cec: bits: "1"
2095200-2097581 cec: bits: "1"
2097581-2099962 cec: bits: "1"
2080914-2099962 cec: bytes: "0x17"
2099962-2102343 cec: eom-0: "EOM=N"
2102343-2104724 cec: ack: "ACK"
2104724-2107105 cec: bits: "0"
2107105-2109486 cec: bits: "0"
2109486-2111867 cec: bits: "0"
2111867-2114248 cec: bits: "0"
2114248-2116629 cec: bits: "0"
2116629-2119010 cec: bits: "0"
2119010-2121391 cec: bits: "0"
2121391-2123772 cec: bits: "0"
2104724-2123772 cec: bytes: "0x00"
2123772-2126153 cec: eom-0: "EOM=N"
2126153-2128534 cec: ack: "ACK"
2128534-2130915 cec: bits: "1"
2130915-2133296 cec: bits: "0"
2133296-2135677 cec: bits: "0"
2135677-2138058 cec: bits: "0"
2138058-2140439 cec: bits: "0"
2140439-2142820 cec: bits: "0"
2142820-2145201 cec: bits: "0"
2145201-2147582 cec: bits: "0"
2128534-2147582 cec: bytes: "0x80"
2147582-2149963 cec: eom-1: "EOM=Y"
2149963-2154063 cec: ack: "ACK"
1938056-2149963 cec: frames: "0f:a0:08:00:46:00:17:00:80"
1938056-2149963 cec: sections: "HDR: TV, Broadcast | OPC: VENDOR_COMMAND_WITH_ID | OPS: 0x08, 0x00, 0x46, 0x00, 0x17, 0x00, 0x80 | R: ACK"
2170414-2174902 cec: st: "ST"
2174902-2177283 cec: bits: "0"
2177283-2179664 cec: bits: "0"
2179664-2182045 cec: bits: "0"
2182045-2184426 cec: bits: "0"
2184426-2186807 cec: bits: "1"
2186807-2189188 cec: bits: "1"
2189188-2191569 cec: bits: "0"
2191569-2193950 cec: bits: "1"
2174902-2193950 cec: bytes: "0x0d"
2193950-2196330 cec: eom-1: "EOM=Y"
2196330-2200430 cec: nack: "NACK"
2174902-2196330 cec: frames: "0d"
2174902-2196330 cec: sections: "HDR: TV, Backup_2 | OPC: PING | R: NACK"
2205976-2210464 cec: st: "ST"
2210464-2212845 cec: bits: "0"
2212845-2215226 cec: bits: "0"
2215226-2217607 cec: bits: "0"
2217607-2219988 cec: bits: "0"
2219988-2222369 cec: bits: "1"
2222369-2224750 cec: bits: "1"
2224750-2227130 cec: bits: "0"
2227130-2229511 cec: bits: "1"
2210464-2229511 cec: bytes: "0x0d"
2229511-2231892 cec: eom-1: "EOM=Y"
2231892-2235992 cec: nack: "NACK"
2210464-2231892 cec: frames: "0d"
2210464-2231892 cec: sections: "HDR: TV, Backup_2 | OPC: PING | R: NACK"
2251154-2255641 cec: st: "ST"
2255641-2258022 cec: bits: "0"
2258022-2260403 cec: bits: "0"
2260403-2262784 cec: bits: "0"
2262784-2265165 cec: bits: "0"
2265165-2267546 cec: bits: "1"
2267546-2269927 cec: bits: "1"
2269927-2272308 cec: bits: "1"
2272308-2274689 cec: bits: "1"
2255641-2274689 cec: bytes: "0x0f"
2274689-2277070 cec: eom-0: "EOM=N"
2277070-2279451 cec: ack: "ACK"
2279451-2281832 cec: bits: "1"
2281832-2284213 cec: bits: "0"
2284213-2286594 cec: bits: "1"
2286594-2288975 cec: bits: "0"
2288975-2291356 cec: bits: "0"
2291356-2293737 cec: bits: "0"
2293737-2296118 cec: bits: "0"
2296118-2298499 cec: bits: "0"
2279451-2298499 cec: bytes: "0xa0"
2298499-2300880 cec: eom-0: "EOM=N"
2300880-2303260 cec: ack: "ACK"
2303260-2305641 cec: bits: "0"
2305641-2308022 cec: bits: "0"
2308022-2310403 cec: bits: "0"
2310403-2312784 cec: bits: "0"
2312784-2315165 cec: bits: "1"
2315165-2317546 cec: bits: "0"
2317546-2319927 cec: bits: "0"
2319927-2322308 cec: bits: "0"
2303260-2322308 cec: bytes: "0x08"
2322308-2324689 cec: eom-0: "EOM=N"
2324689-2327070 cec: ack: "ACK"
2327070-2329451 cec: bits: "0"
2329451-2331832 cec: bits: "0"
2331832-2334213 cec: bits: "0"
2334213-2336594 cec: bits: "0"
2336594-2338975 cec: bits: "0"
2338975-2341356 cec: bits: "0"
2341356-2343737 cec: bits: "0"
2343737-2346118 cec: bits: "0"
2327070-2346118 cec: bytes: "0x00"
2346118-2348499 cec: eom-0: "EOM=N"
2348499-2350880 cec: ack: "ACK"
2350880-2353261 cec: bits: "0"
2353261-2355642 cec: bits: "1"
2355642-2358023 cec: bits: "0"
2358023-2360404 cec: bits: "0"
2360404-2362785 cec: bits: "0"
2362785-2365166 cec: bits: "1"
2365166-2367547 cec: bits: "1"
2367547-2369928 cec: bits: "0"
2350880-2369928 cec: bytes: "0x46"
2369928-2372309 cec: eom-0: "EOM=N"
2372309-2374690 cec: ack: "ACK"
2374690-2377071 cec: bits: "0"
2377071-2379452 cec: bits: "0"
2379452-2381833 cec: bits: "0"
2381833-2384213 cec: bits: "0"
2384213-2386594 cec: bits: "0"
2386594-2388975 cec: bits: "0"
2388975-2391356 cec: bits: "0"
2391356-2393737 cec: bits: "0"
2374690-2393737 cec: bytes: "0x00"
2393737-2396118 cec: eom-0: "EOM=N"
2396118-2398499 cec: ack: "ACK"
2398499-2400880 cec: bits: "0"
2400880-2403261 cec: bits: "0"
2403261-2405642 cec: bits: "0"
2405642-2408023 cec: bits: "1"
2408023-2410404 cec: bits: "0"
2410404-2412785 cec: bits: "0"
2412785-2415166 cec: bits: "1"
2415166-2417547 cec: bits: "1"
2398499-2417547 cec: bytes: "0x13"
2417547-2419928 cec: eom-0: "EOM=N"
2419928-2422309 cec: ack: "ACK"
2422309-2424690 cec: bits: "0"
2424690-2427071 cec: bits: "0"
2427071-2429452 cec: bits: "0"
2429452-2431833 cec: bits: "0"
2431833-2434214 cec: bits: "0"
2434214-2436595 cec: bits: "0"
2436595-2438976 cec: bits: "0"
2438976-2441357 cec: bits: "0"
2422309-2441357 cec: bytes: "0x00"
2441357-2443738 cec: eom-0: "EOM=N"
2443738-2446119 cec: ack: "ACK"
2446119-2448500 cec: bits: "0"
2448500-2450881 cec: bits: "0"
2450881-2453262 cec: bits: "0"
2453262-2455643 cec: bits: "1"
2455643-2458024 cec: bits: "0"
2458024-2460405 cec: bits: "0"
2460405-2462785 cec: bits: "0"
2462785-2465166 cec: bits: "0"
2446119-2465166 cec: bytes: "0x10"
2465166-2467547 cec: eom-0: "EOM=N"
2467547-2469928 cec: ack: "ACK"
2469928-2472309 cec: bits: "1"
2472309-2474690 cec: bits: "0"
2474690-2477071 cec: bits: "0"
2477071-2479452 cec: bits: "0"
2479452-2481833 cec: bits: "0"
2481833-2484214 cec: bits: "0"
2484214-2486595 cec: bits: "0"
2486595-2488976 cec: bits: "0"
2469928-2488976 cec: bytes: "0x80"
2488976-2491357 cec: eom-0: "EOM=N"
2491357-2493738 cec: ack: "ACK"
2493738-2496119 cec: bits: "0"
2496119-2498500 cec: bits: "0"
2498500-2500881 cec: bits: "0"
2500881-2503262 cec: bits: "0"
2503262-2505643 cec: bits: "0"
2505643-2508024 cec: bits: "0"
2508024-2510405 cec: bits: "0"
2510405-2512786 cec: bits: "0"
2493738-2512786 cec: bytes: "0x00"
2512786-2515167 cec: eom-0: "EOM=N"
2515167-2517548 cec: ack: "ACK"
2517548-2519929 cec: bits: "0"
2519929-2522310 cec: bits: "0"
2522310-2524691 cec: bits: "0"
2524691-2527072 cec: bits: "0"
2527072-2529453 cec: bits: "0"
2529453-2531834 cec: bits: "0"
2531834-2534215 cec: bits: "0"
2534215-2536596 cec: bits: "1"
2517548-2536596 cec: bytes: "0x01"
2536596-2538977 cec: eom-0: "EOM=N"
2538977-2541358 cec: ack: "ACK"
2541358-2543738 cec: bits: "0"
2543738-2546119 cec: bits: "0"
2546119-2548500 cec: bits: "0"
2548500-2550881 cec: bits: "0"
2550881-2553262 cec: bits: "0"
2553262-2555643 cec: bits: "0"
2555643-2558024 cec: bits: "0"
2558024-2560405 cec: bits: "0"
2541358-2560405 cec: bytes: "0x00"
2560405-2562786 cec: eom-0: "EOM=N"
2562786-2565167 cec: ack: "ACK"
2565167-2567548 cec: bits: "0"
2567548-2569929 cec: bits: "0"
2569929-2572310 cec: bits: "0"
2572310-2574691 cec: bits: "0"
2574691-2577072 cec: bits: "0"
2577072-2579453 cec: bits: "0"
2579453-2581834 cec: bits: "0"
2581834-2584215 cec: bits: "0"
2565167-2584215 cec: bytes: "0x00"
2584215-2586596 cec: eom-0: "EOM=N"
2586596-2588977 cec: ack: "ACK"
2588977-2591358 cec: bits: "0"
2591358-2593739 cec: bits: "0"
2593739-2596120 cec: bits: "0"
2596120-2598501 cec: bits: "0"
2598501-2600882 cec: bits: "0"
2600882-2603263 cec: bits: "0"
2603263-2605644 cec: bits: "0"
2605644-2608025 cec: bits: "0"
2588977-2608025 cec: bytes: "0x00"
2608025-2610406 cec: eom-0: "EOM=N"
2610406-2612787 cec: ack: "ACK"
2612787-2615168 cec: bits: "0"
2615168-2617549 cec: bits: "0"
2617549-2619930 cec: bits: "0"
2619930-2622311 cec: bits: "0"
2622311-2624691 cec: bits: "0"
2624691-2627072 cec: bits: "0"
2627072-2629453 cec: bits: "0"
2629453-2631834 cec: bits: "0"
2612787-2631834 cec: bytes: "0x00"
2631834-2634215 cec: eom-1: "EOM=Y"
2634215-2638315 cec: ack: "ACK"
2255641-2634215 cec: frames: "0f:a0:08:00:46:00:13:00:10:80:00:01:00:00:00:00"
2255641-2634215 cec: sections: "HDR: TV, Broadcast | OPC: VENDOR_COMMAND_WITH_ID | OPS: 0x08, 0x00, 0x46, 0x00, 0x13, 0x00, 0x10, 0x80, 0x00, 0x01, 0x00, 0x00, 0x00, 0x00 | R: ACK"
2653477-2657964 cec: st: "ST"
2657964-2660345 cec: bits: "0"
2660345-2662726 cec: bits: "0"
2662726-2665107 cec: bits: "0"
2665107-2667488 cec: bits: "0"
2667488-2669869 cec: bits: "1"
2669869-2672250 cec: bits: "1"
2672250-2674631 cec: bits: "0"
2674631-2677012 cec: bits: "0"
2657964-2677012 cec: bytes: "0x0c"
2677012-2679393 cec: eom-1: "EOM=Y"
2679393-2683493 cec: nack: "NACK"
2657964-2679393 cec: frames: "0c"
2657964-2679393 cec: sections: "HDR: TV, Backup_1 | OPC: PING | R: NACK"
2689039-2693526 cec: st: "ST"
2693526-2695907 cec: bits: "0"
2695907-2698288 cec: bits: "0"
2698288-2700669 cec: bits: "0"
2700669-2703050 cec: bits: "0"
2703050-2705431 cec: bits: "1"
2705431-2707812 cec: bits: "1"
2707812-2710193 cec: bits: "0"
2710193-2712574 cec: bits: "0"
2693526-2712574 cec: bytes: "0x0c"
2712574-2714955 cec: eom-1: "EOM=Y"
2714955-2719055 cec: nack: "NACK"
2693526-2714955 cec: frames: "0c"
2693526-2714955 cec: sections: "HDR: TV, Backup_1 | OPC: PING | R: NACK"
2734216-2738703 cec: st: "ST"
2738703-2741084 cec: bits: "0"
2741084-2743465 cec: bits: "0"
2743465-2745846 cec: bits: "0"
2745846-2748227 cec: bits: "0"
2748227-2750608 cec: bits: "1"
2750608-2752989 cec: bits: "1"
2752989-2755370 cec: bits: "1"
2755370-2757751 cec: bits: "1"
2738703-2757751 cec: bytes: "0x0f"
2757751-2760132 cec: eom-0: "EOM=N"
2760132-2762513 cec: ack: "ACK"
2762513-2764894 cec: bits: "1"
2764894-2767275 cec: bits: "0"
2767275-2769656 cec: bits: "1"
2769656-2772037 cec: bits: "0"
2772037-2774418 cec: bits: "0"
2774418-2776799 cec: bits: "0"
2776799-2779180 cec: bits: "0"
2779180-2781561 cec: bits: "0"
2762513-2781561 cec: bytes: "0xa0"
2781561-2783942 cec: eom-0: "EOM=N"
2783942-2786323 cec: ack: "ACK"
2786323-2788704 cec: bits: "0"
2788704-2791085 cec: bits: "0"
2791085-2793466 cec: bits: "0"
2793466-2795847 cec: bits: "0"
2795847-2798228 cec: bits: "1"
2798228-2800609 cec: bits: "0"
2800609-2802990 cec: bits: "0"
2802990-2805371 cec: bits: "0"
2786323-2805371 cec: bytes: "0x08"
2805371-2807751 cec: eom-0: "EOM=N"
2807751-2810132 cec: ack: "ACK"
2810132-2812513 cec: bits: "0"
2812513-2814894 cec: bits: "0"
2814894-2817275 cec: bits: "0"
2817275-2819656 cec: bits: "0"
2819656-2822037 cec: bits: "0"
2822037-2824418 cec: bits: "0"
2824418-2826799 cec: bits: "0"
2826799-2829180 cec: bits: "0"
2810132-2829180 cec: bytes: "0x00"
2829180-2831561 cec: eom-0: "EOM=N"
2831561-2833942 cec: ack: "ACK"
2833942-2836323 cec: bits: "0"
2836323-2838704 cec: bits: "1"
2838704-2841085 cec: bits: "0"
2841085-2843466 cec: bits: "0"
2843466-2845847 cec: bits: "0"
2845847-2848228 cec: bits: "1"
2848228-2850609 cec: bits: "1"
2850609-2852990 cec: bits: "0"
2833942-2852990 cec: bytes: "0x46"
2852990-2855371 cec: eom-0: "EOM=N"
2855371-2857752 cec: ack: "ACK"
2857752-2860133 cec: bits: "0"
2860133-2862514 cec: bits: "0"
2862514-2864895 cec: bits: "0"
2864895-2867276 cec: bits: "0"
2867276-2869657 cec: bits: "0"
2869657-2872038 cec: bits: "0"
2872038-2874419 cec: bits: "0"
2874419-2876800 cec: bits: "0"
2857752-2876800 cec: bytes: "0x00"
2876800-2879181 cec: eom-0: "EOM=N"
2879181-2881562 cec: ack: "ACK"
2881562-2883943 cec: bits: "0"
2883943-2886324 cec: bits: "0"
2886324-2888704 cec: bits: "0"
2888704-2891085 cec: bits: "0"
2891085-2893466 cec: bits: "1"
2893466-2895847 cec: bits: "0"
2895847-2898228 cec: bits: "0"
2898228-2900609 cec: bits: "0"
2881562-2900609 cec: bytes: "0x08"
2900609-2902990 cec: eom-0: "EOM=N"
2902990-2905371 cec: ack: "ACK"
2905371-2907752 cec: bits: "0"
2907752-2910133 cec: bits: "0"
2910133-2912514 cec: bits: "0"
2912514-2914895 cec: bits: "0"
2914895-2917276 cec: bits: "0"
2917276-2919657 cec: bits: "0"
2919657-2922038 cec: bits: "0"
2922038-2924419 cec: bits: "0"
2905371-2924419 cec: bytes: "0x00"
2924419-2926800 cec: eom-0: "EOM=N"
2926800-2929181 cec: ack: "ACK"
2929181-2931562 cec: bits: "0"
2931562-2933943 cec: bits: "0"
2933943-2936324 cec: bits: "0"
2936324-2938705 cec: bits: "0"
2938705-2941086 cec: bits: "0"
2941086-2943467 cec: bits: "0"
2943467-2945848 cec: bits: "0"
2945848-2948229 cec: bits: "0"
2929181-2948229 cec: bytes: "0x00"
2948229-2950610 cec: eom-1: "EOM=Y"
2950610-2954710 cec: ack: "ACK"
2738703-2950610 cec: frames: "0f:a0:08:00:46:00:08:00:00"
2738703-2950610 cec: sections: "HDR: TV, Broadcast | OPC: VENDOR_COMMAND_WITH_ID | OPS: 0x08, 0x00, 0x46, 0x00, 0x08, 0x00, 0x00 | R: ACK"
2969871-2974358 cec: st: "ST"
2974358-2976739 cec: bits: "0"
2976739-2979120 cec: bits: "0"
2979120-2981501 cec: bits: "0"
2981501-2983882 cec: bits: "0"
2983882-2986263 cec: bits: "1"
2986263-2988644 cec: bits: "0"
2988644-2991025 cec: bits: "1"
2991025-2993406 cec: bits: "1"
2974358-2993406 cec: bytes: "0x0b"
2993406-2995787 cec: eom-1: "EOM=Y"
2995787-2999887 cec: nack: "NACK"
2974358-2995787 cec: frames: "0b"
2974358-2995787 cec: sections: "HDR: TV, Playback_3 | OPC: PING | R: NACK"
3005433-3009920 cec: st: "ST"
3009920-3012301 cec: bits: "0"
3012301-3014682 cec: bits: "0"
3014682-3017063 cec: bits: "0"
3017063-3019444 cec: bits: "0"
3019444-3021825 cec: bits: "1"
3021825-3024206 cec: bits: "0"
3024206-3026587 cec: bits: "1"
3026587-3028968 cec: bits: "1"
3009920-3028968 cec: bytes: "0x0b"
3028968-3031349 cec: eom-1: "EOM=Y"
3031349-3035449 cec: nack: "NACK"
3009920-3031349 cec: frames: "0b"
3009920-3031349 cec: sections: "HDR: TV, Playback_3 | OPC: PING | R: NACK"
3050610-3055098 cec: st: "ST"
3055098-3057479 cec: bits: "0"
3057479-3059860 cec: bits: "0"
3059860-3062241 cec: bits: "0"
3062241-3064622 cec: bits: "0"
3064622-3067003 cec: bits: "0"
3067003-3069383 cec: bits: "1"
3069383-3071764 cec: bits: "0"
3071764-3074145 cec: bits: "1"
3055098-3074145 cec: bytes: "0x05"
3074145-3076526 cec: eom-0: "EOM=N"
3076526-3078907 cec: ack: "ACK"
3078907-3081288 cec: bits: "1"
3081288-3083669 cec: bits: "0"
3083669-3086050 cec: bits: "0"
3086050-3088431 cec: bits: "1"
3088431-3090812 cec: bits: "0"
3090812-3093193 cec: bits: "0"
3093193-3095574 cec: bits: "0"
3095574-3097955 cec: bits: "0"
3078907-3097955 cec: bytes: "0x90"
3097955-3100336 cec: eom-0: "EOM=N"
3100336-3102717 cec: ack: "ACK"
3102717-3105098 cec: bits: "0"
3105098-3107479 cec: bits: "0"
3107479-3109860 cec: bits: "0"
3109860-3112241 cec: bits: "0"
3112241-3114622 cec: bits: "0"
3114622-3117003 cec: bits: "0"
3117003-3119384 cec: bits: "0"
3119384-3121765 cec: bits: "0"
3102717-3121765 cec: bytes: "0x00"
3121765-3124146 cec: eom-1: "EOM=Y"
3124146-3128246 cec: ack: "ACK"
3055098-3124146 cec: frames: "05:90:00"
3055098-3124146 cec: sections: "HDR: TV, AudioSystem | OPC: REPORT_POWER_STATUS | OPS: 0x00 | R: ACK"
3143407-3147894 cec: st: "ST"
3147894-3150275 cec: bits: "0"
3150275-3152656 cec: bits: "0"
3152656-3155037 cec: bits: "0"
3155037-3157418 cec: bits: "0"
3157418-3159799 cec: bits: "0"
3159799-3162180 cec: bits: "1"
3162180-3164561 cec: bits: "0"
3164561-3166942 cec: bits: "1"
3147894-3166942 cec: bytes: "0x05"
3166942-3169323 cec: eom-0: "EOM=N"
3169323-3171704 cec: ack: "ACK"
3171704-3174085 cec: bits: "0"
3174085-3176466 cec: bits: "1"
3176466-3178847 cec: bits: "1"
3178847-3181228 cec: bits: "1"
3181228-3183609 cec: bits: "0"
3183609-3185990 cec: bits: "0"
3185990-3188371 cec: bits: "0"
3188371-3190752 cec: bits: "0"
3171704-3190752 cec: bytes: "0x70"
3190752-3193133 cec: eom-0: "EOM=N"
3193133-3195514 cec: ack: "ACK"
3195514-3197895 cec: bits: "0"
3197895-3200276 cec: bits: "0"
3200276-3202657 cec: bits: "1"
3202657-3205038 cec: bits: "1"
3205038-3207419 cec: bits: "0"
3207419-3209800 cec: bits: "0"
3209800-3212181 cec: bits: "0"
3212181-3214562 cec: bits: "0"
3195514-3214562 cec: bytes: "0x30"
3214562-3216943 cec: eom-0: "EOM=N"
3216943-3219324 cec: ack: "ACK"
3219324-3221705 cec: bits: "0"
3221705-3224086 cec: bits: "0"
3224086-3226466 cec: bits: "0"
3226466-3228847 cec: bits: "0"
3228847-3231228 cec: bits: "0"
3231228-3233609 cec: bits: "0"
3233609-3235990 cec: bits: "0"
3235990-3238371 cec: bits: "0"
3219324-3238371 cec: bytes: "0x00"
3238371-3240752 cec: eom-1: "EOM=Y"
3240752-3244852 cec: ack: "ACK"
3147894-3240752 cec: frames: "05:70:30:00"
3147894-3240752 cec: sections: "HDR: TV, AudioSystem | OPC: SYSTEM_AUDIO_MODE_REQUEST | OPS: 0x30, 0x00 | R: ACK"
3255219-3258589 cec: warnings: "Invalid pulse: Wrong timing"
3258589-3259714 cec: warnings: "Invalid pulse: Wrong timing"
3259714-3262098 cec: warnings: "Expected START: BIT found"
3262098-3264483 cec: warnings: "Expected START: BIT found"
3264483-3266868 cec: warnings: "Expected START: BIT found"
3266868-3269253 cec: warnings: "Expected START: BIT found"
3269253-3271638 cec: warnings: "Expected START: BIT found"
3271638-3274022 cec: warnings: "Expected START: BIT found"
3274022-3276407 cec: warnings: "Expected START: BIT found"
3276407-3278792 cec: warnings: "Expected START: BIT found"
3278792-3281177 cec: warnings: "Expected START: BIT found"
3281177-3283562 cec: warnings: "Expected START: BIT found"
3283562-3285947 cec: warnings: "Expected START: BIT found"
3285947-3288331 cec: warnings: "Expected START: BIT found"
3288331-3290716 cec: warnings: "Expected START: BIT found"
3290716-3293101 cec: warnings: "Expected START: BIT found"
3293101-3295486 cec: warnings: "Expected START: BIT found"
3295486-3297871 cec: warnings: "Expected START: BIT found"
3297871-3300255 cec: warnings: "Expected START: BIT found"
3300255-3302640 cec: warnings: "Expected START: BIT found"
3302640-3305025 cec: warnings: "Expected START: BIT found"
3305025-3307410 cec: warnings: "Expected START: BIT found"
3307410-3309795 cec: warnings: "Expected START: BIT found"
3309795-3312180 cec: warnings: "Expected START: BIT found"
3312180-3314564 cec: warnings: "Expected START: BIT found"
3314564-3316949 cec: warnings: "Expected START: BIT found"
3316949-3319334 cec: warnings: "Expected START: BIT found"
3319334-3321719 cec: warnings: "Expected START: BIT found"
3321719-3324104 cec: warnings: "Expected START: BIT found"
3324104-3326489 cec: warnings: "Expected START: BIT found"
3326489-3328873 cec: warnings: "Expected START: BIT found"
3328873-3343287 cec: warnings: "Expected START: BIT found"
3343287-3347774 cec: st: "ST"
3347774-3350155 cec: bits: "0"
3350155-3352536 cec: bits: "0"
3352536-3354917 cec: bits: "0"
3354917-3357298 cec: bits: "0"
3357298-3359679 cec: bits: "1"
3359679-3362060 cec: bits: "0"
3362060-3364441 cec: bits: "1"
3364441-3366822 cec: bits: "0"
3347774-3366822 cec: bytes: "0x0a"
3366822-3369203 cec: eom-1: "EOM=Y"
3369203-3373303 cec: nack: "NACK"
3347774-3369203 cec: frames: "0a"
3347774-3369203 cec: sections: "HDR: TV, Tuner_4 | OPC: PING | R: NACK"
3378849-3383336 cec: st: "ST"
3383336-3385717 cec: bits: "0"
3385717-3388098 cec: bits: "0"
3388098-3390479 cec: bits: "0"
3390479-3392860 cec: bits: "0"
3392860-3395241 cec: bits: "1"
3395241-3397622 cec: bits: "0"
3397622-3400003 cec: bits: "1"
3400003-3402384 cec: bits: "0"
3383336-3402384 cec: bytes: "0x0a"
3402384-3404765 cec: eom-1: "EOM=Y"
3404765-3408865 cec: nack: "NACK"
3383336-3404765 cec: frames: "0a"
3383336-3404765 cec: sections: "HDR: TV, Tuner_4 | OPC: PING | R: NACK"
3424026-3428513 cec: st: "ST"
3428513-3430894 cec: bits: "0"
3430894-3433275 cec: bits: "0"
3433275-3435656 cec: bits: "0"
3435656-3438037 cec: bits: "0"
3438037-3440418 cec: bits: "0"
3440418-3442799 cec: bits: "1"
3442799-3445180 cec: bits: "0"
3445180-3447561 cec: bits: "1"
3428513-3447561 cec: bytes: "0x05"
3447561-3449942 cec: eom-0: "EOM=N"
3449942-3452323 cec: ack: "ACK"
3452323-3454704 cec: bits: "0"
3454704-3457085 cec: bits: "1"
3457085-3459466 cec: bits: "1"
3459466-3461847 cec: bits: "1"
3461847-3464228 cec: bits: "0"
3464228-3466609 cec: bits: "0"
3466609-3468990 cec: bits: "0"
3468990-3471371 cec: bits: "1"
3452323-3471371 cec: bytes: "0x71"
3471371-3473752 cec: eom-1: "EOM=Y"
3473752-3477852 cec: ack: "ACK"
3428513-3473752 cec: frames: "05:71"
3428513-3473752 cec: sections: "HDR: TV, AudioSystem | OPC: GIVE_AUDIO_STATUS | R: ACK"
3488228-3492723 cec: st: "ST"
3492723-3495108 cec: bits: "0"
3495108-3497493 cec: bits: "1"
3497493-3499877 cec: bits: "0"
3499877-3502262 cec: bits: "1"
3502262-3504647 cec: bits: "0"
3504647-3507032 cec: bits: "0"
3507032-3509417 cec: bits: "0"
3509417-3511802 cec: bits: "0"
3492723-3511802 cec: bytes: "0x50"
3511802-3514186 cec: eom-0: "EOM=N"
3514186-3516571 cec: ack: "ACK"
3516571-3518956 cec: bits: "0"
3518956-3521341 cec: bits: "1"
3521341-3523726 cec: bits: "1"
3523726-3526110 cec: bits: "1"
3526110-3528495 cec: bits: "1"
3528495-3530880 cec: bits: "0"
3530880-3533265 cec: bits: "1"
3533265-3535650 cec: bits: "0"
3516571-3535650 cec: bytes: "0x7a"
3535650-3538035 cec: eom-0: "EOM=N"
3538035-3540419 cec: ack: "ACK"
3540419-3542804 cec: bits: "0"
3542804-3545189 cec: bits: "0"
3545189-3547574 cec: bits: "0"
3547574-3549959 cec: bits: "0"
3549959-3552344 cec: bits: "1"
3552344-3554728 cec: bits: "1"
3554728-3557113 cec: bits: "1"
3557113-3559498 cec: bits: "0"
3540419-3559498 cec: bytes: "0x0e"
3559498-3561883 cec: eom-1: "EOM=Y"
3561883-3565983 cec: ack: "ACK"
3492723-3561883 cec: frames: "50:7a:0e"
3492723-3561883 cec: sections: "HDR: AudioSystem, TV | OPC: REPORT_AUDIO_STATUS | OPS: 0x0e | R: ACK"
3576317-3580804 cec: st: "ST"
3580804-3583185 cec: bits: "0"
3583185-3585566 cec: bits: "0"
3585566-3587947 cec: bits: "0"
3587947-3590328 cec: bits: "0"
3590328-3592709 cec: bits: "1"
3592709-3595090 cec: bits: "0"
3595090-3597471 cec: bits: "0"
3597471-3599852 cec: bits: "1"
3580804-3599852 cec: bytes: "0x09"
3599852-3602232 cec: eom-1: "EOM=Y"
3602232-3606332 cec: nack: "NACK"
3580804-3602232 cec: frames: "09"
3580804-3602232 cec: sections: "HDR: TV, Recording_3 | OPC: PING | R: NACK"
3611878-3616366 cec: st: "ST"
3616366-3618747 cec: bits: "0"
3618747-3621128 cec: bits: "0"
3621128-3623509 cec: bits: "0"
3623509-3625890 cec: bits: "0"
3625890-3628271 cec: bits: "1"
3628271-3630651 cec: bits: "0"
3630651-3633032 cec: bits: "0"
3633032-3635413 cec: bits: "1"
3616366-3635413 cec: bytes: "0x09"
3635413-3637794 cec: eom-1: "EOM=Y"
3637794-3641894 cec: nack: "NACK"
3616366-3637794 cec: frames: "09"
3616366-3637794 cec: sections: "HDR: TV, Recording_3 | OPC: PING | R: NACK"
3657056-3661543 cec: st: "ST"
3661543-3663924 cec: bits: "0"
3663924-3666305 cec: bits: "0"
3666305-3668686 cec: bits: "0"
3668686-3671067 cec: bits: "0"
3671067-3673448 cec: bits: "1"
3673448-3675829 cec: bits: "0"
3675829-3678210 cec: bits: "0"
3678210-3680591 cec: bits: "0"
3661543-3680591 cec: bytes: "0x08"
3680591-3682972 cec: eom-1: "EOM=Y"
3682972-3687072 cec: nack: "NACK"
3661543-3682972 cec: frames: "08"
3661543-3682972 cec: sections: "HDR: TV, Playback_2 | OPC: PING | R: NACK"
3692618-3697105 cec: st: "ST"
3697105-3699486 cec: bits: "0"
3699486-3701867 cec: bits: "0"
3701867-3704248 cec: bits: "0"
3704248-3706629 cec: bits: "0"
3706629-3709010 cec: bits: "1"
3709010-3711391 cec: bits: "0"
3711391-3713772 cec: bits: "0"
3713772-3716153 cec: bits: "0"
3697105-3716153 cec: bytes: "0x08"
3716153-3718534 cec: eom-1: "EOM=Y"
3718534-3722634 cec: nack: "NACK"
3697105-3718534 cec: frames: "08"
3697105-3718534 cec: sections: "HDR: TV, Playback_2 | OPC: PING | R: NACK"
3737795-3742282 cec: st: "ST"
3742282-3744663 cec: bits: "0"
3744663-3747044 cec: bits: "0"
3747044-3749425 cec: bits: "0"
3749425-3751806 cec: bits: "0"
3751806-3754187 cec: bits: "0"
3754187-3756568 cec: bits: "1"
3756568-3758949 cec: bits: "1"
3758949-3761330 cec: bits: "1"
3742282-3761330 cec: bytes: "0x07"
3761330-3763711 cec: eom-1: "EOM=Y"
3763711-3767811 cec: nack: "NACK"
3742282-3763711 cec: frames: "07"
3742282-3763711 cec: sections: "HDR: TV, Tuner3 | OPC: PING | R: NACK"
3773357-3777844 cec: st: "ST"
3777844-3780225 cec: bits: "0"
3780225-3782606 cec: bits: "0"
3782606-3784987 cec: bits: "0"
3784987-3787368 cec: bits: "0"
3787368-3789749 cec: bits: "0"
3789749-3792130 cec: bits: "1"
3792130-3794511 cec: bits: "1"
3794511-3796892 cec: bits: "1"
3777844-3796892 cec: bytes: "0x07"
3796892-3799273 cec: eom-1: "EOM=Y"
3799273-3803373 cec: nack: "NACK"
3777844-3799273 cec: frames: "07"
3777844-3799273 cec: sections: "HDR: TV, Tuner3 | OPC: PING | R: NACK"
3818534-3823022 cec: st: "ST"
3823022-3825403 cec: bits: "0"
3825403-3827784 cec: bits: "0"
3827784-3830165 cec: bits: "0"
3830165-3832546 cec: bits: "0"
3832546-3834927 cec: bits: "0"
3834927-3837308 cec: bits: "1"
3837308-3839688 cec: bits: "1"
3839688-3842069 cec: bits: "0"
3823022-3842069 cec: bytes: "0x06"
3842069-3844450 cec: eom-1: "EOM=Y"
3844450-3848550 cec: nack: "NACK"
3823022-3844450 cec: frames: "06"
3823022-3844450 cec: sections: "HDR: TV, Tuner2 | OPC: PING | R: NACK"
3854096-3858584 cec: st: "ST"
3858584-3860965 cec: bits: "0"
3860965-3863346 cec: bits: "0"
3863346-3865727 cec: bits: "0"
3865727-3868108 cec: bits: "0"
3868108-3870488 cec: bits: "0"
3870488-3872869 cec: bits: "1"
3872869-3875250 cec: bits: "1"
3875250-3877631 cec: bits: "0"
3858584-3877631 cec: bytes: "0x06"
3877631-3880012 cec: eom-1: "EOM=Y"
3880012-3884112 cec: nack: "NACK"
3858584-3880012 cec: frames: "06"
3858584-3880012 cec: sections: "HDR: TV, Tuner2 | OPC: PING | R: NACK"
3899274-3903761 cec: st: "ST"
3903761-3906142 cec: bits: "0"
3906142-3908523 cec: bits: "0"
3908523-3910904 cec: bits: "0"
3910904-3913285 cec: bits: "0"
3913285-3915666 cec: bits: "0"
3915666-3918047 cec: bits: "1"
3918047-3920428 cec: bits: "0"
3920428-3922809 cec: bits: "1"
3903761-3922809 cec: bytes: "0x05"
3922809-3925190 cec: eom-1: "EOM=Y"
3925190-3929290 cec: ack: "ACK"
3903761-3925190 cec: frames: "05"
3903761-3925190 cec: sections: "HDR: TV, AudioSystem | OPC: PING | R: ACK"
3944451-3948938 cec: st: "ST"
3948938-3951319 cec: bits: "0"
3951319-3953700 cec: bits: "0"
3953700-3956081 cec: bits: "0"
3956081-3958462 cec: bits: "0"
3958462-3960843 cec: bits: "0"
3960843-3963224 cec: bits: "1"
3963224-3965605 cec: bits: "0"
3965605-3967986 cec: bits: "0"
3948938-3967986 cec: bytes: "0x04"
3967986-3970367 cec: eom-1: "EOM=Y"
3970367-3974467 cec: nack: "NACK"
3948938-3970367 cec: frames: "04"
3948938-3970367 cec: sections: "HDR: TV, Playback_1 | OPC: PING | R: NACK"
3980013-3984500 cec: st: "ST"
3984500-3986881 cec: bits: "0"
3986881-3989262 cec: bits: "0"
3989262-3991643 cec: bits: "0"
3991643-3994024 cec: bits: "0"
3994024-3996405 cec: bits: "0"
3996405-3998786 cec: bits: "1"
3998786-4001167 cec: bits: "0"
4001167-4003548 cec: bits: "0"
3984500-4003548 cec: bytes: "0x04"
4003548-4005929 cec: eom-1: "EOM=Y"
4005929-4010029 cec: nack: "NACK"
3984500-4005929 cec: frames: "04"
3984500-4005929 cec: sections: "HDR: TV, Playback_1 | OPC: PING | R: NACK"
4025191-4029678 cec: st: "ST"
4029678-4032059 cec: bits: "0"
4032059-4034440 cec: bits: "0"
4034440-4036821 cec: bits: "0"
4036821-4039202 cec: bits: "0"
4039202-4041583 cec: bits: "0"
4041583-4043964 cec: bits: "0"
4043964-4046345 cec: bits: "1"
4046345-4048725 cec: bits: "1"
4029678-4048725 cec: bytes: "0x03"
4048725-4051106 cec: eom-1: "EOM=Y"
4051106-4055206 cec: nack: "NACK"
4029678-4051106 cec: frames: "03"
4029678-4051106 cec: sections: "HDR: TV, Tuner_1 | OPC: PING | R: NACK"
4060752-4065240 cec: st: "ST"
4065240-4067621 cec: bits: "0"
4067621-4070002 cec: bits: "0"
4070002-4072383 cec: bits: "0"
4072383-4074764 cec: bits: "0"
4074764-4077144 cec: bits: "0"
4077144-4079525 cec: bits: "0"
4079525-4081906 cec: bits: "1"
4081906-4084287 cec: bits: "1"
4065240-4084287 cec: bytes: "0x03"
4084287-4086668 cec: eom-1: "EOM=Y"
4086668-4090768 cec: nack: "NACK"
4065240-4086668 cec: frames: "03"
4065240-4086668 cec: sections: "HDR: TV, Tuner_1 | OPC: PING | R: NACK"
4105930-4110417 cec: st: "ST"
4110417-4112798 cec: bits: "0"
4112798-4115179 cec: bits: "0"
4115179-4117560 cec: bits: "0"
4117560-4119941 cec: bits: "0"
4119941-4122322 cec: bits: "0"
4122322-4124703 cec: bits: "0"
4124703-4127084 cec: bits: "1"
4127084-4129465 cec: bits: "0"
4110417-4129465 cec: bytes: "0x02"
4129465-4131846 cec: eom-1: "EOM=Y"
4131846-4135946 cec: nack: "NACK"
4110417-4131846 cec: frames: "02"
4110417-4131846 cec: sections: "HDR: TV, Recording_2 | OPC: PING | R: NACK"
4141492-4145979 cec: st: "ST"
4145979-4148360 cec: bits: "0"
4148360-4150741 cec: bits: "0"
4150741-4153122 cec: bits: "0"
4153122-4155503 cec: bits: "0"
4155503-4157884 cec: bits: "0"
4157884-4160265 cec: bits: "0"
4160265-4162646 cec: bits: "1"
4162646-4165027 cec: bits: "0"
4145979-4165027 cec: bytes: "0x02"
4165027-4167408 cec: eom-1: "EOM=Y"
4167408-4171508 cec: nack: "NACK"
4145979-4167408 cec: frames: "02"
4145979-4167408 cec: sections: "HDR: TV, Recording_2 | OPC: PING | R: NACK"
4186669-4191156 cec: st: "ST"
4191156-4193537 cec: bits: "0"
4193537-4195918 cec: bits: "0"
4195918-4198299 cec: bits: "0"
4198299-4200680 cec: bits: "0"
4200680-4203061 cec: bits: "0"
4203061-4205442 cec: bits: "0"
4205442-4207823 cec: bits: "0"
4207823-4210204 cec: bits: "1"
4191156-4210204 cec: bytes: "0x01"
4210204-4212585 cec: eom-1: "EOM=Y"
4212585-4216685 cec: nack: "NACK"
4191156-4212585 cec: frames: "01"
4191156-4212585 cec: sections: "HDR: TV, Recording_1 | OPC: PING | R: NACK"
4222231-4226718 cec: st: "ST"
4226718-4229099 cec: bits: "0"
4229099-4231480 cec: bits: "0"
4231480-4233861 cec: bits: "0"
4233861-4236242 cec: bits: "0"
4236242-4238623 cec: bits: "0"
4238623-4241004 cec: bits: "0"
4241004-4243385 cec: bits: "0"
4243385-4245766 cec: bits: "1"
4226718-4245766 cec: bytes: "0x01"
4245766-4248147 cec: eom-1: "EOM=Y"
4248147-4252247 cec: nack: "NACK"
4226718-4248147 cec: frames: "01"
4226718-4248147 cec: sections: "HDR: TV, Recording_1 | OPC: PING | R: NACK"
4262623-4267118 cec: st: "ST"
4267118-4269502 cec: bits: "0"
4269502-4271887 cec: bits: "1"
4271887-4274272 cec: bits: "0"
4274272-4276657 cec: bits: "1"
4276657-4279042 cec: bits: "0"
4279042-4281427 cec: bits: "0"
4281427-4283811 cec: bits: "0"
4283811-4286196 cec: bits: "0"
4267118-4286196 cec: bytes: "0x50"
4286196-4288581 cec: eom-1: "EOM=Y"
4288581-4292681 cec: ack: "ACK"
4267118-4288581 cec: frames: "50"
4267118-4288581 cec: sections: "HDR: AudioSystem, TV | OPC: PING | R: ACK"
4303001-4307488 cec: st: "ST"
4307488-4309869 cec: bits: "0"
4309869-4312250 cec: bits: "0"
4312250-4314631 cec: bits: "0"
4314631-4317012 cec: bits: "0"
4317012-4319393 cec: bits: "0"
4319393-4321774 cec: bits: "1"
4321774-4324155 cec: bits: "0"
4324155-4326536 cec: bits: "1"
4307488-4326536 cec: bytes: "0x05"
4326536-4328917 cec: eom-0: "EOM=N"
4328917-4331298 cec: ack: "ACK"
4331298-4333679 cec: bits: "1"
4333679-4336060 cec: bits: "0"
4336060-4338441 cec: bits: "0"
4338441-4340822 cec: bits: "0"
4340822-4343203 cec: bits: "0"
4343203-4345584 cec: bits: "0"
4345584-4347965 cec: bits: "1"
4347965-4350346 cec: bits: "1"
4331298-4350346 cec: bytes: "0x83"
4350346-4352727 cec: eom-1: "EOM=Y"
4352727-4356827 cec: ack: "ACK"
4307488-4352727 cec: frames: "05:83"
4307488-4352727 cec: sections: "HDR: TV, AudioSystem | OPC: GIVE_PHYSICAL_ADDRESS | R: ACK"
4367188-4371683 cec: st: "ST"
4371683-4374068 cec: bits: "0"
4374068-4376453 cec: bits: "1"
4376453-4378837 cec: bits: "0"
4378837-4381222 cec: bits: "1"
4381222-4383607 cec: bits: "1"
4383607-4385992 cec: bits: "1"
4385992-4388377 cec: bits: "1"
4388377-4390762 cec: bits: "1"
4371683-4390762 cec: bytes: "0x5f"
4390762-4393146 cec: eom-0: "EOM=N"
4393146-4395531 cec: ack: "ACK"
4395531-4397916 cec: bits: "1"
4397916-4400301 cec: bits: "0"
4400301-4402686 cec: bits: "0"
4402686-4405070 cec: bits: "0"
4405070-4407455 cec: bits: "0"
4407455-4409840 cec: bits: "1"
4409840-4412225 cec: bits: "0"
4412225-4414610 cec: bits: "0"
4395531-4414610 cec: bytes: "0x84"
4414610-4416995 cec: eom-0: "EOM=N"
4416995-4419379 cec: ack: "ACK"
4419379-4421764 cec: bits: "0"
4421764-4424149 cec: bits: "0"
4424149-4426534 cec: bits: "0"
4426534-4428919 cec: bits: "1"
4428919-4431304 cec: bits: "0"
4431304-4433688 cec: bits: "0"
4433688-4436073 cec: bits: "0"
4436073-4438458 cec: bits: "0"
4419379-4438458 cec: bytes: "0x10"
4438458-4440843 cec: eom-0: "EOM=N"
4440843-4443228 cec: ack: "ACK"
4443228-4445612 cec: bits: "0"
4445612-4447997 cec: bits: "0"
4447997-4450382 cec: bits: "0"
4450382-4452767 cec: bits: "0"
4452767-4455152 cec: bits: "0"
4455152-4457537 cec: bits: "0"
4457537-4459921 cec: bits: "0"
4459921-4462306 cec: bits: "0"
4443228-4462306 cec: bytes: "0x00"
4462306-4464691 cec: eom-0: "EOM=N"
4464691-4467076 cec: ack: "ACK"
4467076-4469461 cec: bits: "0"
4469461-4471845 cec: bits: "0"
4471845-4474230 cec: bits: "0"
4474230-4476615 cec: bits: "0"
4476615-4479000 cec: bits: "0"
4479000-4481385 cec: bits: "1"
4481385-4483770 cec: bits: "0"
4483770-4486154 cec: bits: "1"
4467076-4486154 cec: bytes: "0x05"
4486154-4488539 cec: eom-1: "EOM=Y"
4488539-4492639 cec: ack: "ACK"
4371683-4488539 cec: frames: "5f:84:10:00:05"
4371683-4488539 cec: sections: "HDR: AudioSystem, Broadcast | OPC: REPORT_PHYSICAL_ADDRESS | OPS: 0x10, 0x00, 0x05 | R: ACK"
4502972-4507459 cec: st: "ST"
4507459-4509840 cec: bits: "0"
4509840-4512221 cec: bits: "0"
4512221-4514602 cec: bits: "0"
4514602-4516983 cec: bits: "0"
4516983-4519364 cec: bits: "0"
4519364-4521745 cec: bits: "1"
4521745-4524126 cec: bits: "0"
4524126-4526507 cec: bits: "1"
4507459-4526507 cec: bytes: "0x05"
4526507-4528888 cec: eom-0: "EOM=N"
4528888-4531269 cec: ack: "ACK"
4531269-4533650 cec: bits: "0"
4533650-4536031 cec: bits: "1"
4536031-4538412 cec: bits: "1"
4538412-4540793 cec: bits: "1"
4540793-4543174 cec: bits: "1"
4543174-4545555 cec: bits: "1"
4545555-4547936 cec: bits: "0"
4547936-4550317 cec: bits: "1"
4531269-4550317 cec: bytes: "0x7d"
4550317-4552698 cec: eom-1: "EOM=Y"
4552698-4556798 cec: ack: "ACK"
4507459-4552698 cec: frames: "05:7d"
4507459-4552698 cec: sections: "HDR: TV, AudioSystem | OPC: GIVE_SYSTEM_AUDIO_MODE_STATUS | R: ACK"
4567177-4571672 cec: st: "ST"
4571672-4574057 cec: bits: "0"
4574057-4576441 cec: bits: "1"
4576441-4578826 cec: bits: "0"
4578826-4581211 cec: bits: "1"
4581211-4583596 cec: bits: "0"
4583596-4585981 cec: bits: "0"
4585981-4588365 cec: bits: "0"
4588365-4590750 cec: bits: "0"
4571672-4590750 cec: bytes: "0x50"
4590750-4593135 cec: eom-0: "EOM=N"
4593135-4595520 cec: ack: "ACK"
4595520-4597905 cec: bits: "0"
4597905-4600290 cec: bits: "1"
4600290-4602674 cec: bits: "1"
4602674-4605059 cec: bits: "1"
4605059-4607444 cec: bits: "1"
4607444-4609829 cec: bits: "1"
4609829-4612214 cec: bits: "1"
4612214-4614598 cec: bits: "0"
4595520-4614598 cec: bytes: "0x7e"
4614598-4616983 cec: eom-0: "EOM=N"
4616983-4619368 cec: ack: "ACK"
4619368-4621753 cec: bits: "0"
4621753-4624138 cec: bits: "0"
4624138-4626523 cec: bits: "0"
4626523-4628907 cec: bits: "0"
4628907-4631292 cec: bits: "0"
4631292-4633677 cec: bits: "0"
4633677-4636062 cec: bits: "0"
4636062-4638447 cec: bits: "1"
4619368-4638447 cec: bytes: "0x01"
4638447-4640832 cec: eom-1: "EOM=Y"
4640832-4644932 cec: ack: "ACK"
4571672-4640832 cec: frames: "50:7e:01"
4571672-4640832 cec: sections: "HDR: AudioSystem, TV | OPC: SYSTEM_AUDIO_MODE_STATUS | OPS: 0x01 | R: ACK"
4655262-4659750 cec: st: "ST"
4659750-4662131 cec: bits: "0"
4662131-4664512 cec: bits: "0"
4664512-4666893 cec: bits: "0"
4666893-4669274 cec: bits: "0"
4669274-4671654 cec: bits: "0"
4671654-4674035 cec: bits: "1"
4674035-4676416 cec: bits: "0"
4676416-4678797 cec: bits: "1"
4659750-4678797 cec: bytes: "0x05"
4678797-4681178 cec: eom-0: "EOM=N"
4681178-4683559 cec: ack: "ACK"
4683559-4685940 cec: bits: "1"
4685940-4688321 cec: bits: "1"
4688321-4690702 cec: bits: "0"
4690702-4693083 cec: bits: "0"
4693083-4695464 cec: bits: "0"
4695464-4697845 cec: bits: "0"
4697845-4700226 cec: bits: "1"
4700226-4702607 cec: bits: "1"
4683559-4702607 cec: bytes: "0xc3"
4702607-4704988 cec: eom-1: "EOM=Y"
4704988-4709088 cec: ack: "ACK"
4659750-4704988 cec: frames: "05:c3"
4659750-4704988 cec: sections: "HDR: TV, AudioSystem | OPC: Invalid | R: ACK"
4719470-4723964 cec: st: "ST"
4723964-4726349 cec: bits: "0"
4726349-4728734 cec: bits: "1"
4728734-4731118 cec: bits: "0"
4731118-4733503 cec: bits: "1"
4733503-4735888 cec: bits: "0"
4735888-4738273 cec: bits: "0"
4738273-4740658 cec: bits: "0"
4740658-4743043 cec: bits: "0"
4723964-4743043 cec: bytes: "0x50"
4743043-4745427 cec: eom-0: "EOM=N"
4745427-4747812 cec: ack: "ACK"
4747812-4750197 cec: bits: "0"
4750197-4752582 cec: bits: "0"
4752582-4754967 cec: bits: "0"
4754967-4757352 cec: bits: "0"
4757352-4759736 cec: bits: "0"
4759736-4762121 cec: bits: "0"
4762121-4764506 cec: bits: "0"
4764506-4766891 cec: bits: "0"
4747812-4766891 cec: bytes: "0x00"
4766891-4769276 cec: eom-0: "EOM=N"
4769276-4771660 cec: ack: "ACK"
4771660-4774045 cec: bits: "1"
4774045-4776430 cec: bits: "1"
4776430-4778815 cec: bits: "0"
4778815-4781200 cec: bits: "0"
4781200-4783585 cec: bits: "0"
4783585-4785969 cec: bits: "0"
4785969-4788354 cec: bits: "1"
4788354-4790739 cec: bits: "1"
4771660-4790739 cec: bytes: "0xc3"
4790739-4793124 cec: eom-0: "EOM=N"
4793124-4795509 cec: ack: "ACK"
4795509-4797893 cec: bits: "0"
4797893-4800278 cec: bits: "0"
4800278-4802663 cec: bits: "0"
4802663-4805048 cec: bits: "0"
4805048-4807433 cec: bits: "0"
4807433-4809818 cec: bits: "0"
4809818-4812202 cec: bits: "0"
4812202-4814587 cec: bits: "0"
4795509-4814587 cec: bytes: "0x00"
4814587-4816972 cec: eom-1: "EOM=Y"
4816972-4821072 cec: ack: "ACK"
4723964-4816972 cec: frames: "50:00:c3:00"
4723964-4816972 cec: sections: "HDR: AudioSystem, TV | OPC: FEATURE_ABORT | OPS: 0xc3, 0x00 | R: ACK"
4831393-4835880 cec: st: "ST"
4835880-4838261 cec: bits: "0"
4838261-4840642 cec: bits: "0"
4840642-4843023 cec: bits: "0"
4843023-4845404 cec: bits: "0"
4845404-4847785 cec: bits: "0"
4847785-4850166 cec: bits: "1"
4850166-4852547 cec: bits: "0"
4852547-4854928 cec: bits: "1"
4835880-4854928 cec: bytes: "0x05"
4854928-4857309 cec: eom-0: "EOM=N"
4857309-4859690 cec: ack: "ACK"
4859690-4862071 cec: bits: "0"
4862071-4864452 cec: bits: "1"
4864452-4866833 cec: bits: "1"
4866833-4869214 cec: bits: "1"
4869214-4871595 cec: bits: "0"
4871595-4873976 cec: bits: "0"
4873976-4876357 cec: bits: "0"
4876357-4878738 cec: bits: "1"
4859690-4878738 cec: bytes: "0x71"
4878738-4881119 cec: eom-1: "EOM=Y"
4881119-4885219 cec: ack: "ACK"
4835880-4881119 cec: frames: "05:71"
4835880-4881119 cec: sections: "HDR: TV, AudioSystem | OPC: GIVE_AUDIO_STATUS | R: ACK"
4895610-4900105 cec: st: "ST"
4900105-4902489 cec: bits: "0"
4902489-4904874 cec: bits: "1"
4904874-4907259 cec: bits: "0"
4907259-4909644 cec: bits: "1"
4909644-4912029 cec: bits: "0"
4912029-4914413 cec: bits: "0"
4914413-4916798 cec: bits: "0"
4916798-4919183 cec: bits: "0"
4900105-4919183 cec: bytes: "0x50"
4919183-4921568 cec: eom-0: "EOM=N"
4921568-4923953 cec: ack: "ACK"
4923953-4926338 cec: bits: "0"
4926338-4928722 cec: bits: "1"
4928722-4931107 cec: bits: "1"
4931107-4933492 cec: bits: "1"
4933492-4935877 cec: bits: "1"
4935877-4938262 cec: bits: "0"
4938262-4940646 cec: bits: "1"
4940646-4943031 cec: bits: "0"
4923953-4943031 cec: bytes: "0x7a"
4943031-4945416 cec: eom-0: "EOM=N"
4945416-4947801 cec: ack: "ACK"
4947801-4950186 cec: bits: "0"
4950186-4952571 cec: bits: "0"
4952571-4954955 cec: bits: "0"
4954955-4957340 cec: bits: "0"
4957340-4959725 cec: bits: "1"
4959725-4962110 cec: bits: "1"
4962110-4964495 cec: bits: "1"
4964495-4966880 cec: bits: "0"
4947801-4966880 cec: bytes: "0x0e"
4966880-4969264 cec: eom-1: "EOM=Y"
4969264-4973364 cec: ack: "ACK"
4900105-4969264 cec: frames: "50:7a:0e"
4900105-4969264 cec: sections: "HDR: AudioSystem, TV | OPC: REPORT_AUDIO_STATUS | OPS: 0x0e | R: ACK"
4983684-4988171 cec: st: "ST"
4988171-4990552 cec: bits: "0"
4990552-4992933 cec: bits: "0"
4992933-4995314 cec: bits: "0"
4995314-4997695 cec: bits: "0"
4997695-5000076 cec: bits: "0"
5000076-5002457 cec: bits: "1"
5002457-5004838 cec: bits: "0"
5004838-5007219 cec: bits: "1"
4988171-5007219 cec: bytes: "0x05"
5007219-5009600 cec: eom-0: "EOM=N"
5009600-5011981 cec: ack: "ACK"
5011981-5014362 cec: bits: "0"
5014362-5016743 cec: bits: "1"
5016743-5019124 cec: bits: "1"
5019124-5021505 cec: bits: "1"
5021505-5023886 cec: bits: "0"
5023886-5026266 cec: bits: "0"
5026266-5028647 cec: bits: "0"
5028647-5031028 cec: bits: "0"
5011981-5031028 cec: bytes: "0x70"
5031028-5033409 cec: eom-0: "EOM=N"
5033409-5035790 cec: ack: "ACK"
5035790-5038171 cec: bits: "0"
5038171-5040552 cec: bits: "0"
5040552-5042933 cec: bits: "1"
5042933-5045314 cec: bits: "1"
5045314-5047695 cec: bits: "0"
5047695-5050076 cec: bits: "0"
5050076-5052457 cec: bits: "0"
5052457-5054838 cec: bits: "0"
5035790-5054838 cec: bytes: "0x30"
5054838-5057219 cec: eom-0: "EOM=N"
5057219-5059600 cec: ack: "ACK"
5059600-5061981 cec: bits: "0"
5061981-5064362 cec: bits: "0"
5064362-5066743 cec: bits: "0"
5066743-5069124 cec: bits: "0"
5069124-5071505 cec: bits: "0"
5071505-5073886 cec: bits: "0"
5073886-5076267 cec: bits: "0"
5076267-5078648 cec: bits: "0"
5059600-5078648 cec: bytes: "0x00"
5078648-5081029 cec: eom-1: "EOM=Y"
5081029-5085129 cec: ack: "ACK"
4988171-5081029 cec: frames: "05:70:30:00"
4988171-5081029 cec: sections: "HDR: TV, AudioSystem | OPC: SYSTEM_AUDIO_MODE_REQUEST | OPS: 0x30, 0x00 | R: ACK"
5095507-5100002 cec: st: "ST"
5100002-5102386 cec: bits: "0"
5102386-5104771 cec: bits: "1"
5104771-5107156 cec: bits: "0"
5107156-5109541 cec: bits: "1"
5109541-5111926 cec: bits: "1"
5111926-5114310 cec: bits: "1"
5114310-5116695 cec: bits: "1"
5116695-5119080 cec: bits: "1"
5100002-5119080 cec: bytes: "0x5f"
5119080-5121465 cec: eom-0: "EOM=N"
5121465-5123850 cec: ack: "ACK"
5123850-5126235 cec: bits: "0"
5126235-5128619 cec: bits: "1"
5128619-5131004 cec: bits: "1"
5131004-5133389 cec: bits: "1"
5133389-5135774 cec: bits: "0"
5135774-5138159 cec: bits: "0"
5138159-5140543 cec: bits: "1"
5140543-5142928 cec: bits: "0"
5123850-5142928 cec: bytes: "0x72"
5142928-5145313 cec: eom-0: "EOM=N"
5145313-5147698 cec: ack: "ACK"
5147698-5150083 cec: bits: "0"
5150083-5152468 cec: bits: "0"
5152468-5154852 cec: bits: "0"
5154852-5157237 cec: bits: "0"
5157237-5159622 cec: bits: "0"
5159622-5162007 cec: bits: "0"
5162007-5164392 cec: bits: "0"
5164392-5166777 cec: bits: "1"
5147698-5166777 cec: bytes: "0x01"
5166777-5169161 cec: eom-1: "EOM=Y"
5169161-5173261 cec: ack: "ACK"
5100002-5169161 cec: frames: "5f:72:01"
5100002-5169161 cec: sections: "HDR: AudioSystem, Broadcast | OPC: SET_SYSTEM_AUDIO_MODE | OPS: 0x01 | R: ACK"
5183594-5188081 cec: st: "ST"
5188081-5190462 cec: bits: "0"
5190462-5192843 cec: bits: "0"
5192843-5195224 cec: bits: "0"
5195224-5197605 cec: bits: "0"
5197605-5199986 cec: bits: "0"
5199986-5202367 cec: bits: "1"
5202367-5204748 cec: bits: "0"
5204748-5207129 cec: bits: "1"
5188081-5207129 cec: bytes: "0x05"
5207129-5209510 cec: eom-0: "EOM=N"
5209510-5211891 cec: ack: "ACK"
5211891-5214272 cec: bits: "1"
5214272-5216653 cec: bits: "1"
5216653-5219034 cec: bits: "0"
5219034-5221414 cec: bits: "0"
5221414-5223795 cec: bits: "0"
5223795-5226176 cec: bits: "0"
5226176-5228557 cec: bits: "1"
5228557-5230938 cec: bits: "0"
5211891-5230938 cec: bytes: "0xc2"
5230938-5233319 cec: eom-1: "EOM=Y"
5233319-5237419 cec: ack: "ACK"
5188081-5233319 cec: frames: "05:c2"
5188081-5233319 cec: sections: "HDR: TV, AudioSystem | OPC: Invalid | R: ACK"
5252581-5257068 cec: st: "ST"
5257068-5259449 cec: bits: "0"
5259449-5261830 cec: bits: "0"
5261830-5264211 cec: bits: "0"
5264211-5266592 cec: bits: "0"
5266592-5268973 cec: bits: "0"
5268973-5271354 cec: bits: "1"
5271354-5273735 cec: bits: "0"
5273735-5276116 cec: bits: "1"
5257068-5276116 cec: bytes: "0x05"
5276116-5278497 cec: eom-0: "EOM=N"
5278497-5280878 cec: ack: "ACK"
5280878-5283259 cec: bits: "0"
5283259-5285640 cec: bits: "1"
5285640-5288021 cec: bits: "0"
5288021-5290402 cec: bits: "0"
5290402-5292783 cec: bits: "0"
5292783-5295164 cec: bits: "1"
5295164-5297544 cec: bits: "1"
5297544-5299925 cec: bits: "0"
5280878-5299925 cec: bytes: "0x46"
5299925-5302306 cec: eom-1: "EOM=Y"
5302306-5306406 cec: ack: "ACK"
5257068-5302306 cec: frames: "05:46"
5257068-5302306 cec: sections: "HDR: TV, AudioSystem | OPC: GIVE_OSD_NAME | R: ACK"
5316776-5321270 cec: st: "ST"
5321270-5323655 cec: bits: "0"
5323655-5326040 cec: bits: "1"
5326040-5328425 cec: bits: "0"
5328425-5330809 cec: bits: "1"
5330809-5333194 cec: bits: "0"
5333194-5335579 cec: bits: "0"
5335579-5337964 cec: bits: "0"
5337964-5340349 cec: bits: "0"
5321270-5340349 cec: bytes: "0x50"
5340349-5342734 cec: eom-0: "EOM=N"
5342734-5345118 cec: ack: "ACK"
5345118-5347503 cec: bits: "0"
5347503-5349888 cec: bits: "1"
5349888-5352273 cec: bits: "0"
5352273-5354658 cec: bits: "0"
5354658-5357043 cec: bits: "0"
5357043-5359427 cec: bits: "1"
5359427-5361812 cec: bits: "1"
5361812-5364197 cec: bits: "1"
5345118-5364197 cec: bytes: "0x47"
5364197-5366582 cec: eom-0: "EOM=N"
5366582-5368967 cec: ack: "ACK"
5368967-5371351 cec: bits: "0"
5371351-5373736 cec: bits: "1"
5373736-5376121 cec: bits: "0"
5376121-5378506 cec: bits: "1"
5378506-5380891 cec: bits: "0"
5380891-5383276 cec: bits: "0"
5383276-5385660 cec: bits: "1"
5385660-5388045 cec: bits: "0"
5368967-5388045 cec: bytes: "0x52"
5388045-5390430 cec: eom-0: "EOM=N"
5390430-5392815 cec: ack: "ACK"
5392815-5395200 cec: bits: "0"
5395200-5397584 cec: bits: "1"
5397584-5399969 cec: bits: "0"
5399969-5402354 cec: bits: "1"
5402354-5404739 cec: bits: "1"
5404739-5407124 cec: bits: "0"
5407124-5409509 cec: bits: "0"
5409509-5411893 cec: bits: "0"
5392815-5411893 cec: bytes: "0x58"
5411893-5414278 cec: eom-0: "EOM=N"
5414278-5416663 cec: ack: "ACK"
5416663-5419048 cec: bits: "0"
5419048-5421433 cec: bits: "0"
5421433-5423818 cec: bits: "1"
5423818-5426202 cec: bits: "0"
5426202-5428587 cec: bits: "1"
5428587-5430972 cec: bits: "1"
5430972-5433357 cec: bits: "0"
5433357-5435742 cec: bits: "1"
5416663-5435742 cec: bytes: "0x2d"
5435742-5438126 cec: eom-0: "EOM=N"
5438126-5440511 cec: ack: "ACK"
5440511-5442896 cec: bits: "0"
5442896-5445281 cec: bits: "1"
5445281-5447666 cec: bits: "0"
5447666-5450051 cec: bits: "0"
5450051-5452435 cec: bits: "0"
5452435-5454820 cec: bits: "0"
5454820-5457205 cec: bits: "0"
5457205-5459590 cec: bits: "1"
5440511-5459590 cec: bytes: "0x41"
5459590-5461975 cec: eom-0: "EOM=N"
5461975-5464360 cec: ack: "ACK"
5464360-5466744 cec: bits: "0"
5466744-5469129 cec: bits: "0"
5469129-5471514 cec: bits: "1"
5471514-5473899 cec: bits: "1"
5473899-5476284 cec: bits: "0"
5476284-5478668 cec: bits: "0"
5478668-5481053 cec: bits: "1"
5481053-5483438 cec: bits: "0"
5464360-5483438 cec: bytes: "0x32"
5483438-5485823 cec: eom-0: "EOM=N"
5485823-5488208 cec: ack: "ACK"
5488208-5490593 cec: bits: "0"
5490593-5492977 cec: bits: "0"
5492977-5495362 cec: bits: "1"
5495362-5497747 cec: bits: "1"
5497747-5500132 cec: bits: "0"
5500132-5502517 cec: bits: "0"
5502517-5504901 cec: bits: "0"
5504901-5507286 cec: bits: "0"
5488208-5507286 cec: bytes: "0x30"
5507286-5509671 cec: eom-0: "EOM=N"
5509671-5512056 cec: ack: "ACK"
5512056-5514441 cec: bits: "0"
5514441-5516826 cec: bits: "0"
5516826-5519210 cec: bits: "1"
5519210-5521595 cec: bits: "1"
5521595-5523980 cec: bits: "0"
5523980-5526365 cec: bits: "1"
5526365-5528750 cec: bits: "1"
5528750-5531135 cec: bits: "0"
5512056-5531135 cec: bytes: "0x36"
5531135-5533519 cec: eom-0: "EOM=N"
5533519-5535904 cec: ack: "ACK"
5535904-5538289 cec: bits: "0"
5538289-5540674 cec: bits: "0"
5540674-5543059 cec: bits: "1"
5543059-5545443 cec: bits: "1"
5545443-5547828 cec: bits: "0"
5547828-5550213 cec: bits: "0"
5550213-5552598 cec: bits: "0"
5552598-5554983 cec: bits: "0"
5535904-5554983 cec: bytes: "0x30"
5554983-5557368 cec: eom-1: "EOM=Y"
5557368-5561468 cec: ack: "ACK"
5321270-5557368 cec: frames: "50:47:52:58:2d:41:32:30:36:30"
5321270-5557368 cec: sections: "HDR: AudioSystem, TV | OPC: SET_OSD_NAME | OPS: 0x52, 0x58, 0x2d, 0x41, 0x32, 0x30, 0x36, 0x30 | R: ACK"
5571783-5576271 cec: st: "ST"
5576271-5578652 cec: bits: "0"
5578652-5581033 cec: bits: "0"
5581033-5583414 cec: bits: "0"
5583414-5585795 cec: bits: "0"
5585795-5588176 cec: bits: "0"
5588176-5590556 cec: bits: "1"
5590556-5592937 cec: bits: "0"
5592937-5595318 cec: bits: "1"
5576271-5595318 cec: bytes: "0x05"
5595318-5597699 cec: eom-0: "EOM=N"
5597699-5600080 cec: ack: "ACK"
5600080-5602461 cec: bits: "1"
5602461-5604842 cec: bits: "0"
5604842-5607223 cec: bits: "0"
5607223-5609604 cec: bits: "0"
5609604-5611985 cec: bits: "1"
5611985-5614366 cec: bits: "1"
5614366-5616747 cec: bits: "0"
5616747-5619128 cec: bits: "0"
5600080-5619128 cec: bytes: "0x8c"
5619128-5621509 cec: eom-1: "EOM=Y"
5621509-5625609 cec: ack: "ACK"
5576271-5621509 cec: frames: "05:8c"
5576271-5621509 cec: sections: "HDR: TV, AudioSystem | OPC: GIVE_DEVICE_VENDOR_ID | R: ACK"
5635975-5640469 cec: st: "ST"
5640469-5642854 cec: bits: "0"
5642854-5645239 cec: bits: "1"
5645239-5647624 cec: bits: "0"
5647624-5650009 cec: bits: "1"
5650009-5652394 cec: bits: "1"
5652394-5654778 cec: bits: "1"
5654778-5657163 cec: bits: "1"
5657163-5659548 cec: bits: "1"
5640469-5659548 cec: bytes: "0x5f"
5659548-5661933 cec: eom-0: "EOM=N"
5661933-5664318 cec: ack: "ACK"
5664318-5666702 cec: bits: "1"
5666702-5669087 cec: bits: "0"
5669087-5671472 cec: bits: "0"
5671472-5673857 cec: bits: "0"
5673857-5676242 cec: bits: "0"
5676242-5678627 cec: bits: "1"
5678627-5681011 cec: bits: "1"
5681011-5683396 cec: bits: "1"
5664318-5683396 cec: bytes: "0x87"
5683396-5685781 cec: eom-0: "EOM=N"
5685781-5688166 cec: ack: "ACK"
5688166-5690551 cec: bits: "0"
5690551-5692936 cec: bits: "0"
5692936-5695320 cec: bits: "0"
5695320-5697705 cec: bits: "0"
5697705-5700090 cec: bits: "0"
5700090-5702475 cec: bits: "0"
5702475-5704860 cec: bits: "0"
5704860-5707244 cec: bits: "0"
5688166-5707244 cec: bytes: "0x00"
5707244-5709629 cec: eom-0: "EOM=N"
5709629-5712014 cec: ack: "ACK"
5712014-5714399 cec: bits: "1"
5714399-5716784 cec: bits: "0"
5716784-5719169 cec: bits: "1"
5719169-5721553 cec: bits: "0"
5721553-5723938 cec: bits: "0"
5723938-5726323 cec: bits: "0"
5726323-5728708 cec: bits: "0"
5728708-5731093 cec: bits: "0"
5712014-5731093 cec: bytes: "0xa0"
5731093-5733477 cec: eom-0: "EOM=N"
5733477-5735862 cec: ack: "ACK"
5735862-5738247 cec: bits: "1"
5738247-5740632 cec: bits: "1"
5740632-5743017 cec: bits: "0"
5743017-5745402 cec: bits: "1"
5745402-5747786 cec: bits: "1"
5747786-5750171 cec: bits: "1"
5750171-5752556 cec: bits: "1"
5752556-5754941 cec: bits: "0"
5735862-5754941 cec: bytes: "0xde"
5754941-5757326 cec: eom-1: "EOM=Y"
5757326-5761426 cec: ack: "ACK"
5640469-5757326 cec: frames: "5f:87:00:a0:de"
5640469-5757326 cec: sections: "HDR: AudioSystem, Broadcast | OPC: DEVICE_VENDOR_ID | OPS: 0x00, 0xa0, 0xde | R: ACK"
